"ElementName","DataType","Size","Required","ElementDescription","ValueRange","Notes","Aliases"
"subjectkey","GUID","","Required","The NDAR Global Unique Identifier (GUID) for research subject","NDAR*","",""
"src_subject_id","String","20","Required","Subject ID how it's defined in lab/project","","","id,patid"
"interview_date","Date","","Required","Date on which the interview/genetic test/sampling/imaging/biospecimen was completed. MM/DD/YYYY","","",""
"interview_age","Integer","","Required","Age in months at the time of the interview/test/sampling/imaging.","0::1440","Age is rounded to chronological month. If the research participant is 15-days-old at time of interview, the appropriate value would be 0 months. If the participant is 16-days-old, the value would be 1 month.",""
"sex","String","20","Required","Sex of subject at birth","M;F; O; NR","M = Male; F = Female; O=Other; NR = Not reported","gender"
"relationship","Integer","","Recommended","Relationship of respondent to individual","1::95;-999","1 = Biological mom; 2 = Biological dad; 3 = Grandparent; 4 = Special education (sped) teacher; 5 = General education teacher; 6 = Occupational therapist; 7 = Speech and language therapist; 8 = Behavioral therapist; 9 = Paraprofessional; 10 = Aide; 11 = Principal; 12 = Administrator; 14 = Content teacher; 15 = Parent center director; 16 = Self; 17 = Adoptive mother; 18 = Adoptive father; 19 = Foster mother; 20 = Foster father; 21 = Grandmother; 22 = Grandfather; 23 = Step-mother; 24 = Step-father; 25 = Aunt; 26 = Uncle; 28 = Both parents; 31 = Grandmother from mother side; 32 = Grandfather from mother side; 33 = Grandmother from father side; 34 = Grandfather from father side; 36 = Brother; 37 = Sister; 38 = Cousin; 39 = Female caregiver; 40 = Male caregiver; 41 = Female child; 42 = Male child; 43 = Spouse/Mate; 44 = Friend; 45 = Parent; 46 = Significant other; 47 = Sibling; 48 = Son/Daughter; 49 = Son-in-law/Daughter-in law; 50 = Other Relative; 51 = Paid caregiver; 52 = Friends; 53 = Roommate; 54 = Supervisor; 55 = Mother's boyfriend; 56 = Other parental figure; 57 = Summary; 58 = Counselor; 59 = Other female relative; 60 = Other male relative; 61 = Non-relative ; 62 = Maternal Aunt; 63 = Maternal Uncle; 64 = Maternal Cousin; 65 = Paternal Aunt; 66 = Paternal Uncle; 67 = Paternal Cousin; 68 = Biological/Adoptive Mother and Grandmother; 69 = Biological/Adoptive Mother and Stepmother and Grandmother; 70 = Biological/Adoptive Mother and Grandmother and Foster Father; 71 = Biological/Adoptive Mother and Stepmother and Foster Mother; 72 = Biological/Adoptive Mother and Foster Mother; 73 = Biological/Adoptive Mother and Biological/Adoptive Father; 74 = Biological/Adoptive Mother and Stepmother and Biological/Adoptive Father; 75 = Biological/Adoptive Mother and Other; 76 = Biological/Adoptive Mother and Stepmother and Stepfather; 77 = Biological/Adoptive Mother and Stepfather; 78 = Biological/Adoptive Mother and Grandfather; 79 = Biological/Adoptive Mother and Stepmother and Foster Father; 80 = Biological/Adoptive Mother and Stepmother; 81 = Guardian, female; 82 = Other female; 83 = Guardian, male; 84 = Other male; 85 = Other/Grandparent/Nanny; 86 = Mother, Father, Guardian; 87 = Daughter, son, grandchild; 88 = Professional (e.g., social worker, nurse, therapist, psychiatrist, or group home staff); -999 = Missing; 89 = Biological parent; 90 = Other; 91 = Stepparent; 92 = Adoptive parent; 93 = Foster parent; 94 = Co-worker; 95 = Independent Evaluator",""
"chsi_1","Integer","","Recommended","Labor and/or delivery did not go the way I had hoped.","0 :: 4;-99;77; 88","0=Not at all; 1=A little; 2=Somewhat; 3=Very; 4=Extremely; -99=NA; 77=Refused; 88=Missing",""
"chsi_2","Integer","","Recommended","A bad experience with hospital staff or hospital procedures","0 :: 4;-99;77; 88","0=Not at all; 1=A little; 2=Somewhat; 3=Very; 4=Extremely; -99=NA; 77=Refused; 88=Missing",""
"chsi_3","Integer","","Recommended","Conflicts over childcare with family and friends.","0 :: 4;-99;77; 88","0=Not at all; 1=A little; 2=Somewhat; 3=Very; 4=Extremely; -99=NA; 77=Refused; 88=Missing",""
"chsi_4","Integer","","Recommended","My relationship with the baby's father has been strained","0 :: 4;-99;77; 88","0=Not at all; 1=A little; 2=Somewhat; 3=Very; 4=Extremely; -99=NA; 77=Refused; 88=Missing",""
"chsi_5","Integer","","Recommended","I can't give enough time to the baby's father","0 :: 4;-99;77; 88","0=Not at all; 1=A little; 2=Somewhat; 3=Very; 4=Extremely; -99=NA; 77=Refused; 88=Missing",""
"chsi_6","Integer","","Recommended","I am not receiving enough support or attention from the baby's father","0 :: 4;-99;77; 88","0=Not at all; 1=A little; 2=Somewhat; 3=Very; 4=Extremely; -99=NA; 77=Refused; 88=Missing",""
"chsi_7","Integer","","Recommended","The baby's father does not help with work as much as I would like.","0 :: 4;-99;77; 88","0=Not at all; 1=A little; 2=Somewhat; 3=Very; 4=Extremely; -99=NA; 77=Refused; 88=Missing",""
"chsi_8","Integer","","Recommended","Overwhelmed by the demands of infant care","0 :: 4;-99;77; 88","0=Not at all; 1=A little; 2=Somewhat; 3=Very; 4=Extremely; -99=NA; 77=Refused; 88=Missing",""
"chsi_9","Integer","","Recommended","The house being more disorganized than usual.","0 :: 4;-99;77; 88","0=Not at all; 1=A little; 2=Somewhat; 3=Very; 4=Extremely; -99=NA; 77=Refused; 88=Missing",""
"chsi_10","Integer","","Recommended","Problems feeding the baby","0 :: 4;-99;77; 88","0=Not at all; 1=A little; 2=Somewhat; 3=Very; 4=Extremely; -99=NA; 77=Refused; 88=Missing",""
"chsi_11","Integer","","Recommended","I can't quiet the baby's cries","0 :: 4;-99;77; 88","0=Not at all; 1=A little; 2=Somewhat; 3=Very; 4=Extremely; -99=NA; 77=Refused; 88=Missing",""
"chsi_12","Integer","","Recommended","I can't relax with the baby.","0 :: 4;-99;77; 88","0=Not at all; 1=A little; 2=Somewhat; 3=Very; 4=Extremely; -99=NA; 77=Refused; 88=Missing",""
"chsi_13","Integer","","Recommended","The baby has health problems.","0 :: 4;-99;77; 88","0=Not at all; 1=A little; 2=Somewhat; 3=Very; 4=Extremely; -99=NA; 77=Refused; 88=Missing",""
"chsi_14","Integer","","Recommended","It is taking longer than I expected to learn to love the baby","0 :: 4;-99;77; 88","0=Not at all; 1=A little; 2=Somewhat; 3=Very; 4=Extremely; -99=NA; 77=Refused; 88=Missing",""
"chsi_15","Integer","","Recommended","Having trouble establishing regular feeding times.","0 :: 4;-99;77; 88","0=Not at all; 1=A little; 2=Somewhat; 3=Very; 4=Extremely; -99=NA; 77=Refused; 88=Missing",""
"chsi_16","Integer","","Recommended","Having trouble establishing regular nap times and bed time for the baby","0 :: 4;-99;77; 88","0=Not at all; 1=A little; 2=Somewhat; 3=Very; 4=Extremely; -99=NA; 77=Refused; 88=Missing",""
"chsi_17","Integer","","Recommended","I don't know what the baby needs when he or she cries.","0 :: 4;-99;77; 88","0=Not at all; 1=A little; 2=Somewhat; 3=Very; 4=Extremely; -99=NA; 77=Refused; 88=Missing",""
"chsi_18","Integer","","Recommended","My baby rarely or never seems content.","0 :: 4;-99;77; 88","0=Not at all; 1=A little; 2=Somewhat; 3=Very; 4=Extremely; -99=NA; 77=Refused; 88=Missing",""
"chsi_19","Integer","","Recommended","Feel trapped or confined.","0 :: 4;-99;77; 88","0=Not at all; 1=A little; 2=Somewhat; 3=Very; 4=Extremely; -99=NA; 77=Refused; 88=Missing",""
"chsi_20","Integer","","Recommended","Trapped or confined.","0 :: 4;-99;77; 88","0=Not at all; 1=A little; 2=Somewhat; 3=Very; 4=Extremely; -99=NA; 77=Refused; 88=Missing",""
"chsi_21","Integer","","Recommended","I miss my previous activities or work","0 :: 4;-99;77; 88","0=Not at all; 1=A little; 2=Somewhat; 3=Very; 4=Extremely; -99=NA; 77=Refused; 88=Missing",""
"chsi_count","Integer","","Recommended","Childcare Stress Inventory Total score","","",""
"chsi_weighted_average","Float","","Recommended","Childcare Stress Inventory Mean score","","Sum of all questions divided by the number of questions",""
