"ElementName","DataType","Size","Required","ElementDescription","ValueRange","Notes","Aliases"
"subjectkey","GUID","","Required","The NDAR Global Unique Identifier (GUID) for research subject","NDAR*","",""
"src_subject_id","String","20","Required","Subject ID how it's defined in lab/project","","",""
"interview_date","Date","","Required","Date on which the interview/genetic test/sampling/imaging/biospecimen was completed. MM/DD/YYYY","","",""
"interview_age","Integer","","Required","Age in months at the time of the interview/test/sampling/imaging.","0::1440","Age is rounded to chronological month. If the research participant is 15-days-old at time of interview, the appropriate value would be 0 months. If the participant is 16-days-old, the value would be 1 month.",""
"sex","String","20","Required","Sex of subject at birth","M;F; O; NR","M = Male; F = Female; O=Other; NR = Not reported",""
"peg1","Integer","","Recommended","What number best describes your pain on average in the past week?","0::10","0=No Pain; 10=Pain as bad as you can imagine",""
"peg2","Integer","","Recommended","What number best describes how, during the past week, pain has interfered with your enjoyment of life?","0::10","0=Very little interference/Does not interfere; 10=A lot of interference/Completely interferes",""
"peg3","Integer","","Recommended","What number best describes how, during the past week, pain has interfered with your general activity?","0::10","0=Very little interference/Does not interfere; 10=A lot of interference/Completely interferes",""
"dem_race","Integer","","Recommended","Race","1::6; 88; 99","1 = American Indian or Alaska Native; 2 = Asian; 3 = Black or African American; 4 = Native Hawaiian or Pacific Islander; 5 = White or Caucasian; 6 = More Than One Race; 88 = Unknown; 99 = Choose not to report",""
