"ElementName","DataType","Size","Required","ElementDescription","ValueRange","Notes","Aliases"
"adostb17","Integer","","Recommended","B17. Level of Engagement","0::3;9;-9","0 = Spontaneously engaged and consistently interested in activities presented by the examiner; 1 = Inconsistently spontaneously engaged; 2 = Engaged only when the examiner works hard to get and keep the child's interest, OR the child is engaged only during snack; 3 = Not engaged, even when the examiner makes efforts to attract the child's interest, OR the child is engaged only during snack or games involving physical contact; 9 = Cannot be rated for some reason other than that listed above, such as if an examiner makes an error and does not administer a particular ADOS-2 activity.","Lev_o_Engag"
"adostb18","Integer","","Recommended","B18. Overall Quality of Rapport","0::3;9;-9","0 = Comfortable interaction between the child and examiner that is appropriate to the context of the ADOS-2 assessment. 1 = Interaction sometimes comfortable, but not sustained (e.g., sometimes feels awkward or stilted, or the child's behavior seems mechanical or slightly inappropriate). 2 = One-sided or unusual interaction resulting in a consistently mildly uncomfortable session. 3 = The child shows minimal regard for the examiner AND/OR the observation was markedly difficult or uncomfortable for a significant proportion of the time. 9 = Cannot be rated for some reason other than that listed above, such as if an examiner makes an error and does not administer a particular ADOS-2 activity.","OvQu_o_Rap"
"adostc01","Integer","","Recommended","C1. Functional Play With Objects","0::3;9;-9","0 = Spontaneously plays with a variety of toys in a conventional manner, including appropriate play with several different miniatures/representational toys (e.g., telephone, truck, dishes, materials in the 'Bath Time' routine). Do not include imitations, prompted actions, or pushing the car; 1 = Some spontaneous functional play with at least one miniature/representational toy. Do not include imitations, responses to the examiner's or a parent/caregiver's direct requests (e.g., 'Answer the phone'), pushing the car, or use of construction toys; 2 = Plays appropriately with cause-and-effect toys and/or construction toys only, AND/OR pushing the car. This may include imitating a demonstration or imitating more representational play with other toys; 3 = No play with toys or only stereotyped play; 9 = Cannot be rated for some reason other than that listed above, such as if an examiner makes an error and does not administer a particular ADOS-2 activity.","Fxl_Play_w_Ob"
"adostc02","Integer","","Recommended","C2. Imagination/Creativity","0::3;9;-9","0 = Spontaneous use of a doll or other object as an independent agent (e.g., makes the baby wash its face), OR spontaneous use of objects to represent other objects (e.g., uses a utensil as a phone). 1 = Spontaneous pretend play with a doll (e.g., feeding, hugging, or washing) or other objects, but no use of a doll or other toy as an independent agent or to represent something else. 2 = Imitates pretend play as described above for a rating of 1, OR imitation with a placeholder; no spontaneous pretend play. 3 = No imitated or spontaneous pretend play. 9 = Cannot be rated for some reason other than that listed above, such as if an examiner makes an error and does not administer a particular ADOS-2 activity.","Imag_Creat"
"adostc03","Integer","","Recommended","C3. Functional and Symbolic Imitation","0;1;2;3;9;-9","0 = Child uses placeholder as object not previously demonstrated. 1 = Child uses placeholder as object previously demonstrated. 2 = Child imitates use of actual object previously demonstrated. 3 = No imitation, as defined above. 9 = Cannot be rated for some reason other than that listed above, such as if an examiner makes an error and does not administer a particular ADOS-2 activity.",""
"adostd01","Integer","","Recommended","D1. Unusual Sensory Interest in Play Material/Person","0::3;9;-9","0 = No unusual sensory interests or sensory-seeking behaviors. 1 = Several possible sensory interests not as clear as specified below for a rating of 2, AND/OR only one clear occurrence of an unusual sensory interest or a sensory-seeking behavior. One ""possible"" sensory interest should be coded 0. 2 = Definite interest in sensory elements of objects or of play materials, OR sensory examination of himself or herself or others; two or more clear occurrences must be observed. May be observed during the same activity. 3 = Definite unusual sensory-seeking behaviors occur during at least two different tasks or activities and may interfere with the ADOS-2 assessment. 9 = Cannot be rated for some reason other than that listed above, such as if an examiner makes an error and does not administer a particular ADOS-2 activity.","USliPMP"
"adostd01a","String","255","Recommended","Specify Unusual Sensory Interest","","",""
"adostd02","Integer","","Recommended","D2. Hand and Finger Movements/Posturing","0::3;9;-9","0 = None; 1 = Unusual and/or repetitive movements not as clear as specified below for ratings of 2 and 3; 2 = Definite hand and finger mannerisms. May be brief and/or rare if clear; 3 = Hand and finger mannerisms, as described above, occur frequently, during at least two different tasks or activities, and/or may interfere with the ADOS-2 assessment; 9 = Cannot be rated for some reason other than that listed above, such as if an examiner makes an error and does not administer a particular ADOS-2 activity.","HaFMP"
"adostd02a","String","255","Recommended","Specify Hand and Finger Movements","","",""
"adostd03","Integer","","Recommended","D3. Other Complex Mannerisms","0::3;9;-9","0 = None; 1 = Unusual and/or repetitive  mannerisms not as clear as specified below for ratings of 2 and 3; 2 = Definite complex mannerisms. May be brief and/or rare if clear; 3 = Mannerisms, as described above, occur frequently, during at least two different tasks or activities, and/or may interfere with the ADOS-2 assessment; 9 = Cannot be rated for some reason other than that listed above, such as if an examiner makes an error and does not administer a particular ADOS-2 activity.","Oth_Com_Man"
"adostd03a","String","255","Recommended","Specify Other Complex Mannerisms","","",""
"adostd04","Integer","","Recommended","D4. Self-Injurious Behavior","0::3;9;-9","0 = No attempts to harm self; 1 = Dubious or possible self-injury; 2 = Rare but clear self-injury (e.g., one clear example of biting at own hand or arm, pulling own hair, slapping own face, or banging own head); 3 = More than one clear example of self-injury, such as head-banging, face slapping, hair pulling, or self-biting; 9 = Cannot be rated for some reason other than that listed above, such as if an examiner makes an error and does not administer a particular ADOS-2 activity.","SelfInjBeh"
"adostd05","Integer","","Recommended","D5. Unusually Repetitive Interests or Stereotyped Behaviors","0::3;9;-9","0 = No repetitive or stereotyped behaviors during the ADOS-2 evaluation; 1 = An interest or behavior that is repetitive or stereotyped to an unusual degree, including an intense interest in a particular toy or object, a definite interest in an unusual object or activity (odd for the child's level of motor skill), an unusually routinized activity, or a clear interest in a part of an object. This interest or behavior occurs in conjunction with several other activities and does not prevent the child from completing any ADOS-2 activities; 2 = Clearly repetitive or stereotyped interests and/or behaviors, as described above. These behaviors may form a substantial minority of the child's interests and spontaneous behaviors and may interfere with the child's ability to complete ADOS-2 activities, but it is possible for his or her attention to be directed to other objects or activities, at least momentarily; 3 = Repetitive or stereotyped interests and/or behaviors, as described above, form the majority of the child's interests, AND/OR attempts to direct his or her attention to other objects or activities are met with significant resistance and/or distress; 9 = Cannot be rated for some reason other than that listed above, such as if an examiner makes an error and does not administer a particular ADOS-2 activity.","URIoSB"
"adostd05a","String","255","Recommended","Specify Unusually Repetitive Interests","","",""
"adoste01","Integer","","Recommended","E1. Overactivity","0::3;7;9;-9","0 = Sits or stands still appropriately when expected to do so during the ADOS-2 assessment. May explore the room as expected for developmental level but is not obviously overactive. 1 = Sits or stands still when clearly expected to do so (e.g., during the symbolic imitation task, the bath time routine) for activities besides the snack, but often fidgets, moves about, or gets up out of his or her seat. 2 = Fidgety; more active than other children of same developmental level. 3 = Incessantly and energetically moves around the room in a way that is difficult to interrupt; the level of activity disrupts the ADOS-2 assessment. 7 = Underactive. 9 = Cannot be rated for some reason other than that listed above, such as if an examiner makes an error and does not administer a particular ADOS-2 activity.","Overactivity"
"adoste02","Integer","","Recommended","2. Fussiness","0;1;2;3;-9","","Fussiness"
"adoste03","Integer","","Recommended","E3. Aggression and Disruptive Behavior","0::3;9;-9","0 = Not aggressive or intentionally disruptive during the ADOS-2 evaluation; 1 = Occasional display of mild aggression or intentionally disruptive behavior; 2 = Shows repeated acts of mild aggression or intentionally disruptive behavior; 3 =Clear display or displays of significant (i.e., more than mild) aggression; 9 = Cannot be rated for some reason other than that listed above, such as if an examiner makes an error and does not administer a particular ADOS-2 activity.","Ag_a_DisBeh"
"adoste04","Integer","","Recommended","E4. Anxiety","0::3;9;-9","0 = No obvious anxiety (e.g., trembling or jumpiness), OR displays brief initial apprehension; 1 = Mild signs of anxiety, OR shows extended mild stranger anxiety; 2 =Marked anxiety only in response to a specific request or to one particular toy or task, OR persistent marked stranger anxiety; 3 = Marked anxiety in response to more than one toy or task or several times during the ADOS-2 evaluation; 9 = Cannot be rated for some reason other than that listed above, such as if an examiner makes an error and does not administer a particular ADOS-2 activity.","Anxiety"
"year_mta","Integer","","Recommended","Year in study","","","visit_year"
