"ElementName","DataType","Size","Required","ElementDescription","ValueRange","Notes","Aliases"
"subjectkey","GUID","","Required","The NDAR Global Unique Identifier (GUID) for research subject","NDAR*","",""
"src_subject_id","String","20","Required","Subject ID how it's defined in lab/project","","","subj"
"interview_date","Date","","Required","Date on which the interview/genetic test/sampling/imaging/biospecimen was completed. MM/DD/YYYY","","","cbq_date"
"interview_age","Integer","","Required","Age in months at the time of the interview/test/sampling/imaging.","0::1440","Age is rounded to chronological month. If the research participant is 15-days-old at time of interview, the appropriate value would be 0 months. If the participant is 16-days-old, the value would be 1 month.",""
"sex","String","20","Required","Sex of subject at birth","M;F; O; NR","M = Male; F = Female; O=Other; NR = Not reported","gender"
"cbq01","Integer","","Recommended","Seems to always be in a big hurry to get from one place to another","1::7; -9","1 = Extremely untrue; 2 = Quite untrue; 3 = Slightly untrue; 4 = Neither true nor false; 5 = Slightly true; 6 = Quite true; 7 = Extremely true; -9 = Not applicable","cbq1"
"cbq31","Integer","","Recommended","Gets quite frustrated when prevented from doing something s/he wants to do","1::7; -9","1 = Extremely untrue; 2 = Quite untrue; 3 = Slightly untrue; 4 = Neither true nor false; 5 = Slightly true; 6 = Quite true; 7 = Extremely true; -9 = Not applicable","cbq2"
"cbq59","Integer","","Recommended","""When drawing or coloring in a book, shows strong concentration""","1::7; -9","1 = Extremely untrue; 2 = Quite untrue; 3 = Slightly untrue; 4 = Neither true nor false; 5 = Slightly true; 6 = Quite true; 7 = Extremely true; -9 = Not applicable","cbq3"
"cbq02","Integer","","Recommended","Likes going down high slides or other adventurous activities","1::7; -9","1 = Extremely untrue; 2 = Quite untrue; 3 = Slightly untrue; 4 = Neither true nor false; 5 = Slightly true; 6 = Quite true; 7 = Extremely true; -9 = Not applicable","cbq4"
"cbq_29","Integer","","Recommended","Is quite upset by a little cut or bruise","1::7;-9","1 = Extremely untrue; 2 = Quite untrue; 3 = Slightly untrue; 4 = Neither true nor false; 5 = Slightly true; 6 = Quite true; 7 = Extremely true; -9 = Not applicable","cbq5"
"cbq133","Integer","","Recommended","Prepares for trips and outings by planning things s/he will need","1::7; -9","1 = Extremely untrue; 2 = Quite untrue; 3 = Slightly untrue; 4 = Neither true nor false; 5 = Slightly true; 6 = Quite true; 7 = Extremely true; -9 = Not applicable","cbq6"
"cbq_28","Integer","","Recommended","Often rushes into new situations","1::7;-9","1 = Extremely untrue; 2 = Quite untrue; 3 = Slightly untrue; 4 = Neither true nor false; 5 = Slightly true; 6 = Quite true; 7 = Extremely true; -9 = Not applicable","cbq7"
"cbq124","Integer","","Recommended","Tends to become sad if the family's plans don't work out","1::7; -9","1 = Extremely untrue; 2 = Quite untrue; 3 = Slightly untrue; 4 = Neither true nor false; 5 = Slightly true; 6 = Quite true; 7 = Extremely true; -9 = Not applicable","cbq8"
"cbq11","Integer","","Recommended","Likes being sung to","1::7; -9","1 = Extremely untrue; 2 = Quite untrue; 3 = Slightly untrue; 4 = Neither true nor false; 5 = Slightly true; 6 = Quite true; 7 = Extremely true; -9 = Not applicable","cbq9"
"cbq09","Integer","","Recommended","Seems to be at ease with almost any person","1::7; -9","1 = Extremely untrue; 2 = Quite untrue; 3 = Slightly untrue; 4 = Neither true nor false; 5 = Slightly true; 6 = Quite true; 7 = Extremely true; -9 = Not applicable","cbq10"
"cbq_17","Integer","","Recommended","Is afraid of burglars or the boogie man","1::7;-9","1 = Extremely untrue; 2 = Quite untrue; 3 = Slightly untrue; 4 = Neither true nor false; 5 = Slightly true; 6 = Quite true; 7 = Extremely true; -9 = Not applicable","cbq011"
"cbq49","Integer","","Recommended","Notices when parents are wearing new clothing","1::7; -9","1 = Extremely untrue; 2 = Quite untrue; 3 = Slightly untrue; 4 = Neither true nor false; 5 = Slightly true; 6 = Quite true; 7 = Extremely true; -9 = Not applicable","cbq12"
"cbq48","Integer","","Recommended","Prefers quiet activities to active games","1::7; -9","1 = Extremely true of your child; 2 = Quite true of your child; 3 = Slightly true of your child; 4 = Neither true nor false of your child; 5 = Slightly untrue of your child; 6 = Quite untrue of your child; 7 = Extremely untrue of your child; -9 = Not applicable","cbq13"
"cbq77","Integer","","Recommended","""When angry about something, s/he tends to stay upset for ten minutes or longer""","1::7; -9","1 = Extremely untrue; 2 = Quite untrue; 3 = Slightly untrue; 4 = Neither true nor false; 5 = Slightly true; 6 = Quite true; 7 = Extremely true; -9 = Not applicable","cbq14"
"cbq71","Integer","","Recommended","""When building or putting something together, becomes very involved in what s/he is doing, and works for long periods""","1::7; -9","1 = Extremely untrue; 2 = Quite untrue; 3 = Slightly untrue; 4 = Neither true nor false; 5 = Slightly true; 6 = Quite true; 7 = Extremely true; -9 = Not applicable","cbq15"
"cbq62","Integer","","Recommended","Likes to go high and fast when pushed on a swing","1::7; -9","1 = Extremely untrue; 2 = Quite untrue; 3 = Slightly untrue; 4 = Neither true nor false; 5 = Slightly true; 6 = Quite true; 7 = Extremely true; -9 = Not applicable","cbq16"
"cbq127","Integer","","Recommended","Seems to feel depressed when unable to accomplish some task","1::7; -9","1 = Extremely untrue; 2 = Quite untrue; 3 = Slightly untrue; 4 = Neither true nor false; 5 = Slightly true; 6 = Quite true; 7 = Extremely true; -9 = Not applicable","cbq17"
"cbq69","Integer","","Recommended","Is good at following instructions","1::7; -9","1 = Extremely untrue; 2 = Quite untrue; 3 = Slightly untrue; 4 = Neither true nor false; 5 = Slightly true; 6 = Quite true; 7 = Extremely true; -9 = Not applicable","cbq18"
"cbq135","Integer","","Recommended","Takes a long time in approaching new situations","1::7; -9","1 = Extremely true of your child; 2 = Quite true of your child; 3 = Slightly true of your child; 4 = Neither true nor false of your child; 5 = Slightly untrue of your child; 6 = Quite untrue of your child; 7 = Extremely untrue of your child; -9 = Not applicable","cbq19"
"cbq194","Integer","","Recommended","Hardly ever complains when ill with a cold","1::7; -9","1 = Extremely true of your child; 2 = Quite true of your child; 3 = Slightly true of your child; 4 = Neither true nor false of your child; 5 = Slightly untrue of your child; 6 = Quite untrue of your child; 7 = Extremely untrue of your child; -9 = Not applicable","cbq20"
"cbq03","Integer","","Recommended","""Likes the sound of words, as in nursery rhymes""","1::7; -9","1 = Extremely untrue; 2 = Quite untrue; 3 = Slightly untrue; 4 = Neither true nor false; 5 = Slightly true; 6 = Quite true; 7 = Extremely true; -9 = Not applicable","cbq21"
"cbq137","Integer","","Recommended","Is sometimes shy even around people s/he has known a long time","1::7; -9","1 = Extremely true of your child; 2 = Quite true of your child; 3 = Slightly true of your child; 4 = Neither true nor false of your child; 5 = Slightly untrue of your child; 6 = Quite untrue of your child; 7 = Extremely untrue of your child; -9 = Not applicable","cbq22"
"cbq65","Integer","","Recommended","Is very difficult to soothe when s/he has become upset","1::7; -9","1 = Extremely untrue; 2 = Quite untrue; 3 = Slightly untrue; 4 = Neither true nor false; 5 = Slightly true; 6 = Quite true; 7 = Extremely true; -9 = Not applicable","cbq23"
"cbq54","Integer","","Recommended","Is quickly aware of some new item in the living room","1::7; -9","1 = Extremely untrue; 2 = Quite untrue; 3 = Slightly untrue; 4 = Neither true nor false; 5 = Slightly true; 6 = Quite true; 7 = Extremely true; -9 = Not applicable","cbq24"
"cbq84","Integer","","Recommended","""Is full of energy, even in the evening""","1::7; -9","1 = Extremely untrue; 2 = Quite untrue; 3 = Slightly untrue; 4 = Neither true nor false; 5 = Slightly true; 6 = Quite true; 7 = Extremely true; -9 = Not applicable","cbq25"
"cbq_35","Integer","","Recommended","Is not afraid of the dark","1::7;-9","1 = Extremely true of your child; 2 = Quite true of your child; 3 = Slightly true of your child; 4 = Neither true nor false of your child; 5 = Slightly untrue of your child; 6 = Quite untrue of your child; 7 = Extremely untrue of your child; -9 = Not applicable","cbq26"
"cbq191","Integer","","Recommended","Sometimes becomes absorbed in a picture book and looks at it for a long time","1::7; -9","1 = Extremely untrue; 2 = Quite untrue; 3 = Slightly untrue; 4 = Neither true nor false; 5 = Slightly true; 6 = Quite true; 7 = Extremely true; -9 = Not applicable","cbq27"
"cbq028","Integer","","Recommended","Likes rough and rowdy games","1::7; -9","1 = Extremely untrue of your child; 2 = Quite untrue of your child; 3 = Slightly untrue of your child; 4 = Neither true nor false of your child; 5 = Slightly untrue of your child; 6 = Quite true of your child; 7 = Extremely true of your child; -9 = Not applicable","cbq28"
"cbq_49","Integer","","Recommended","Is not very upset at minor cuts or bruises","1::7;-9","1 = Extremely true of your child; 2 = Quite true of your child; 3 = Slightly true of your child; 4 = Neither true nor false of your child; 5 = Slightly untrue of your child; 6 = Quite untrue of your child; 7 = Extremely untrue of your child; -9 = Not applicable","cbq29"
"cbq170","Integer","","Recommended","Approaches places s/he has been told are dangerous slowly and cautiously","1::7; -9","1 = Extremely untrue; 2 = Quite untrue; 3 = Slightly untrue; 4 = Neither true nor false; 5 = Slightly true; 6 = Quite true; 7 = Extremely true; -9 = Not applicable","cbq30"
"cbq147","Integer","","Recommended","Is slow and unhurried in deciding what to do next","1::7; -9","1 = Extremely true of your child; 2 = Quite true of your child; 3 = Slightly true of your child; 4 = Neither true nor false of your child; 5 = Slightly untrue of your child; 6 = Quite untrue of your child; 7 = Extremely untrue of your child; -9 = Not applicable","cbq031"
"cbq032","Integer","","Recommended","Gets angry when s/he can't find something s/he wants to play with","1::7; -9","1 = Extremely untrue of your child; 2 = Quite untrue of your child; 3 = Slightly untrue of your child; 4 = Neither true nor false of your child; 5 = Slightly untrue of your child; 6 = Quite true of your child; 7 = Extremely true of your child; -9 = Not applicable","cbq32"
"cbq_94","Integer","","Recommended","Enjoys gentle rhythmic activities","1::7;-9","1 = Extremely untrue; 2 = Quite untrue; 3 = Slightly untrue; 4 = Neither true nor false; 5 = Slightly true; 6 = Quite true; 7 = Extremely true; -9 = Not applicable","cbq033"
"cbq168","Integer","","Recommended","Sometimes turns away shyly from new acquaintances","1::7; -9","1 = Extremely true of your child; 2 = Quite true of your child; 3 = Slightly true of your child; 4 = Neither true nor false of your child; 5 = Slightly untrue of your child; 6 = Quite untrue of your child; 7 = Extremely untrue of your child; -9 = Not applicable","cbq34"
"cbq33","Integer","","Recommended","Becomes upset when loved relatives or friends are getting ready to leave following a visit","1::7; -9","1 = Extremely untrue; 2 = Quite untrue; 3 = Slightly untrue; 4 = Neither true nor false; 5 = Slightly true; 6 = Quite true; 7 = Extremely true; -9 = Not applicable","cbq35"
"cbq36","Integer","","Recommended","Comments when a parent has changed his/her appearance","1::7; -9","1 = Extremely untrue; 2 = Quite untrue; 3 = Slightly untrue; 4 = Neither true nor false; 5 = Slightly true; 6 = Quite true; 7 = Extremely true; -9 = Not applicable","cbq036"
"cbqscale1","Float","","Required","Surgency Scale","","1, 4, 7, 10, 13, 16, 19, 22, 25, 28, 31, 34","cbq_surgency"
"cbqscale2","Float","","Required","Negative Affect Scale","","2, 5, 8, 11, 14, 17, 20, 23, 26, 29, 32, 35","cbq_negaff"
"cbqscale3","Float","","Required","Effortful Control Scale","","3, 6, 9, 12, 15, 18, 21, 24, 27, 30, 33, 36","cbq_effcon"
