"ElementName","DataType","Size","Required","ElementDescription","ValueRange","Notes","Aliases"
"subjectkey","GUID","","Required","The NDAR Global Unique Identifier (GUID) for research subject","NDAR*","",""
"src_subject_id","String","45","Required","Subject ID how it's defined in lab/project","","",""
"interview_date","Date","","Required","Date on which the interview/genetic test/sampling/imaging/biospecimen was completed. MM/DD/YYYY","","",""
"interview_age","Integer","","Required","Age in months at the time of the interview/test/sampling/imaging.","0::1440","Age is rounded to chronological month. If the research participant is 15-days-old at time of interview, the appropriate value would be 0 months. If the participant is 16-days-old, the value would be 1 month.",""
"sex","String","20","Required","Sex of subject at birth","M;F; O; NR","M = Male; F = Female; O=Other; NR = Not reported",""
"timepoint_label","String","50","Recommended","Timepoint/visit label","","e.g., Baseline, Morning, At Bedtime",""
"condomruler","Integer","","Recommended","Each rung on this ladder represents where various people are in thinking about changing their condom use habits. Select the number that indicates where you are.","0::10","0= I never think about using condoms.; 2= Sometimes I think about using condoms more.; 5= I have decided to use condoms more often.; 8= I am already trying to use condoms more during sex.; 10= My condom use has changed. I now always use condoms.",""
