"ElementName","DataType","Size","Required","ElementDescription","ValueRange","Notes","Aliases"
"subjectkey","GUID","","Required","The NDAR Global Unique Identifier (GUID) for research subject","NDAR*","",""
"src_subject_id","String","45","Required","Subject ID how it's defined in lab/project","","",""
"interview_date","Date","","Required","Date on which the interview/genetic test/sampling/imaging/biospecimen was completed. MM/DD/YYYY","","",""
"interview_age","Integer","","Required","Age in months at the time of the interview/test/sampling/imaging.","0::1440","Age is rounded to chronological month. If the research participant is 15-days-old at time of interview, the appropriate value would be 0 months. If the participant is 16-days-old, the value would be 1 month.",""
"sex","String","20","Required","Sex of subject at birth","M;F; O; NR","M = Male; F = Female; O=Other; NR = Not reported",""
"covid01","Integer","","Recommended","Have you been tested for coronavirus?","0::5; -9","0 = No; 1 = Yes; 2 = Prefer to not answer; 3 = Yes, and I tested negative; 4 = Yes, and I tested positive; 5 = Yes, but I do not yet have the results; -9 = Do not know","covid19q1"
"covid02","Integer","","Recommended","Have you ever tested positive for coronavirus?","0::2","0=No; 1=Yes; 2=Don't know/results pending","covid_2"
"covid03","Date","","Recommended","What was the date of the positive test?","","",""
"covid04","Integer","","Recommended","Don't remember (ask participant for month and approximate timing) In what month would you say you had the positive test","1::12","1=January; 2=February; 3=March; 4=April; 5=May; 6=June; 7=July; 8=August; 9=September; 10=October; 11=November; 12=December",""
"covid05","Integer","","Recommended","Would you say you had the test in the early, middle or late part of the month?","0::2","0=Early; 1=Middle; 2=Late",""
"covid06","Date","","Recommended","(If test negative or pending)What was the date of your test?","","",""
"covid07","Integer","","Recommended","Don't remember (ask participant for month and approximate timing)In what month would you say you had the test for coronavirus?","1::12","1=January; 2=February; 3=March; 4=April; 5=May; 6=June; 7=July; 8=August; 9=September; 10=October; 11=November; 12=December",""
"covid08","Integer","","Recommended","Would you say you had the test in the early, middle or late part of the month?","0::2","0=Early; 1=Middle; 2=Late",""
"covid09","Integer","","Recommended","Have you ever had a blood draw to test for coronavirus antibodies in your blood?","0::2","0=No; 1=Yes; 2=Unknown",""
"covid10","Integer","","Recommended","Have you ever tested positive for coronavirus antibodies?","0::2","0=No; 1=Yes; 2=Don't know/results pending",""
"covid11","Date","","Recommended","What was the date of the positive antibody test?","","",""
"covid12","Integer","","Recommended","Don't remember (ask participant for month and approximate timing) In what month would you say you had the positive antibody test?","1::12","1=January; 2=February; 3=March; 4=April; 5=May; 6=June; 7=July; 8=August; 9=September; 10=October; 11=November; 12=December",""
"covid13","Integer","","Recommended","Would you say you had the test in the early, middle or late part of the month?","0::2","0=Early; 1=Middle; 2=Late",""
"covid14","Integer","","Recommended","Did not experience and symptoms.","0;1","0=No; 1=Yes",""
"covid15","Integer","","Recommended","Fever of 100.5 F (38 C) or higher: Present?","0;1","0=No; 1=Yes",""
"covid16","Integer","","Recommended","Fever of 100.5 F (38 C) or higher: Severity","0::2","0=Mild; 1=Moderate; 2=Severe",""
"covid17","Integer","","Recommended","Fever of 100.5 F (38 C) or higher: How many days did symptoms last?","","",""
"covid18","Integer","","Recommended","Fever of 100.5 F (38 C) or higher: Symptoms in the past 14 days?","0;1","0=No; 1=Yes",""
"covid19","Integer","","Recommended","Felt feverish: Present?","0;1","0=No; 1=Yes",""
"covid20","Integer","","Recommended","Felt feverish: Severity","0::2","0=Mild; 1=Moderate; 2=Severe",""
"covid21","Integer","","Recommended","Felt feverish: How many days did symptoms last?","","",""
"covid22","Integer","","Recommended","Felt feverish: Symptoms in the past 14 days?","0;1","0=No; 1=Yes",""
"covid23","Integer","","Recommended","Chills: Present?","0;1","0=No; 1=Yes",""
"covid24","Integer","","Recommended","Chills: Severity","0::2","0=Mild; 1=Moderate; 2=Severe",""
"covid25","Integer","","Recommended","Chills: How many days did symptoms last?","","",""
"covid26","Integer","","Recommended","Chills: Symptoms in the past 14 days?","0;1","0=No; 1=Yes",""
"covid27","Integer","","Recommended","Cough: Present?","0;1","0=No; 1=Yes",""
"covid28","Integer","","Recommended","Cough: Severity","0::2","0=Mild; 1=Moderate; 2=Severe",""
"covid29","Integer","","Recommended","Cough: How many days did symptoms last?","","",""
"covid30","Integer","","Recommended","Cough: Symptoms in the past 14 days?","0;1","0=No; 1=Yes",""
"covid31","Integer","","Recommended","Shortness of Breath: Present?","0;1","0=No; 1=Yes",""
"covid32","Integer","","Recommended","Shortness of Breath: Severity","0::2","0=Mild; 1=Moderate; 2=Severe",""
"covid33","Integer","","Recommended","Shortness of Breath: How many days did symptoms last?","","",""
"covid34","Integer","","Recommended","Shortness of Breath: Symptoms in the past 14 days?","0;1","0=No; 1=Yes",""
"covid35","Integer","","Recommended","Muscle Aches: Present?","0;1","0=No; 1=Yes",""
"covid36","Integer","","Recommended","Muscle Aches: Severity","0::2","0=Mild; 1=Moderate; 2=Severe",""
"covid37","Integer","","Recommended","Muscle Aches: How many days did symptoms last?","","",""
"covid38","Integer","","Recommended","Muscle Aches: Symptoms in the past 14 days?","0;1","0=No; 1=Yes",""
"covid39","Integer","","Recommended","Headache: Present?","0;1","0=No; 1=Yes",""
"covid40","Integer","","Recommended","Headache: Severity","0::2","0=Mild; 1=Moderate; 2=Severe",""
"covid41","Integer","","Recommended","Headache: How many days did symptoms last?","","",""
"covid42","Integer","","Recommended","Headache: Symptoms in the past 14 days?","0;1","0=No; 1=Yes",""
"covid43","Integer","","Recommended","Fatigue or tiredness: Present?","0;1","0=No; 1=Yes",""
"covid44","Integer","","Recommended","Fatigue or tiredness: Severity","0::2","0=Mild; 1=Moderate; 2=Severe",""
"covid45","Integer","","Recommended","Fatigue or tiredness: How many days did symptoms last?","","",""
"covid46","Integer","","Recommended","Fatigue or tiredness: Symptoms in the past 14 days?","0;1","0=No; 1=Yes",""
"covid47","Integer","","Recommended","Sore throat: Present?","0;1","0=No; 1=Yes",""
"covid48","Integer","","Recommended","Sore throat: Severity","0::2","0=Mild; 1=Moderate; 2=Severe",""
"covid49","Integer","","Recommended","Sore throat: How many days did symptoms last?","","",""
"covid50","Integer","","Recommended","Sore throat: Symptoms in the past 14 days?","0;1","0=No; 1=Yes",""
"covid51","Integer","","Recommended","Runny Nose: Present?","0;1","0=No; 1=Yes",""
"covid52","Integer","","Recommended","Runny Nose: Severity","0::2","0=Mild; 1=Moderate; 2=Severe",""
"covid53","Integer","","Recommended","Runny Nose: How many days did symptoms last?","","",""
"covid54","Integer","","Recommended","Runny Nose: Symptoms in the past 14 days?","0;1","0=No; 1=Yes",""
"covid55","Integer","","Recommended","Loss of taste: Present?","0;1","0=No; 1=Yes",""
"covid56","Integer","","Recommended","Loss of taste: Severity","0::2","0=Mild; 1=Moderate; 2=Severe",""
"covid57","Integer","","Recommended","Loss of taste: How many days did symptoms last?","","",""
"covid58","Integer","","Recommended","Loss of taste: Symptoms in the past 14 days?","0;1","0=No; 1=Yes",""
"covid59","Integer","","Recommended","Loss of smell: Present?","0;1","0=No; 1=Yes",""
"covid60","Integer","","Recommended","Loss of smell: Severity","0::2","0=Mild; 1=Moderate; 2=Severe",""
"covid61","Integer","","Recommended","Loss of smell: How many days did symptoms last?","","",""
"covid62","Integer","","Recommended","Loss of smell: Symptoms in the past 14 days?","0;1","0=No; 1=Yes",""
"covid63","Integer","","Recommended","Abdominal Pain: Present?","0;1","0=No; 1=Yes",""
"covid64","Integer","","Recommended","Abdominal Pain: Severity","0::2","0=Mild; 1=Moderate; 2=Severe",""
"covid65","Integer","","Recommended","Abdominal Pain: How many days did symptoms last?","","",""
"covid66","Integer","","Recommended","Abdominal Pain: Symptoms in the past 14 days?","0;1","0=No; 1=Yes",""
"covid67","Integer","","Recommended","Nausea or Vomiting: Present?","0;1","0=No; 1=Yes",""
"covid68","Integer","","Recommended","Nausea or Vomiting: Severity","0::2","0=Mild; 1=Moderate; 2=Severe",""
"covid69","Integer","","Recommended","Nausea or Vomiting: How many days did symptoms last?","","",""
"covid70","Integer","","Recommended","Nausea or Vomiting: Symptoms in the past 14 days?","0;1","0=No; 1=Yes",""
"covid71","Integer","","Recommended","Diarrhea: Present?","0;1","0=No; 1=Yes",""
"covid72","Integer","","Recommended","Diarrhea: Severity","0::2","0=Mild; 1=Moderate; 2=Severe",""
"covid73","Integer","","Recommended","Diarrhea: How many days did symptoms last?","","",""
"covid74","Integer","","Recommended","Diarrhea: Symptoms in the past 14 days?","0;1","0=No; 1=Yes",""
"covid75","Integer","","Recommended","Loss of Appetite: Present?","0;1","0=No; 1=Yes",""
"covid76","Integer","","Recommended","Loss of Appetite: Severity","0::2","0=Mild; 1=Moderate; 2=Severe",""
"covid77","Integer","","Recommended","Loss of Appetite: How many days did symptoms last?","","",""
"covid78","Integer","","Recommended","Loss of Appetite: Symptoms in the past 14 days?","0;1","0=No; 1=Yes",""
"covid79","Integer","","Recommended","Something Else: Present?","0;1","0=No; 1=Yes",""
"covid80","Integer","","Recommended","Something Else: Severity","0::2","0=Mild; 1=Moderate; 2=Severe",""
"covid81","Integer","","Recommended","Something Else: How many days did symptoms last?","","",""
"covid82","Integer","","Recommended","Something Else: Symptoms in the past 14 days?","0;1","0=No; 1=Yes",""
"covid83","Integer","","Recommended","Did any of these symptoms happen at the same time?","0;1","0=No; 1=Yes",""
"covid84","Date","","Recommended","(If yes) When did you first experience symptoms?","","",""
"covid85","Integer","","Recommended","Don't remember (probe for best guess)In what month would you say the symptoms started?","1::12","1=January; 2=February; 3=March; 4=April; 5=May; 6=June; 7=July; 8=August; 9=September; 10=October; 11=November; 12=December",""
"covid86","Integer","","Recommended","Would you say they started in the early, middle, or late part of month?","0::2","0=Early; 1=Middle; 2=Late",""
"suspectedtocovid19","Integer","","Recommended","Have you ever been suspected to have COVID19","0;1","0=No; 1=Yes",""
"symptomssomethingelse","String","100","Recommended","SymptomsSomething Else","","",""
"testedcovid19pos_age","Integer","","Recommended","If positive AGE IN MONTHS at test","","",""
"testedcovid19negative_age","Integer","","Recommended","If negative AGE IN MONTHS at test","","",""
"covidposantibodies_age","Integer","","Recommended","If Antibodies Positive AGE IN MONTHS at test","","",""
"covidnegantibodies_age","Integer","","Recommended","If Antibodies Negative AGE IN MONTHS at test","","",""
"firstexpsym_age","Integer","","Recommended","If yes AGE IN MONTHS when you first experienced symptoms","","",""
"vac2nddose_date","Date","","Recommended","Date when final (second) vaccine was received:","","","datevac2_datevaccinated_2"
"syn_vacbooster_yn","Integer","","Recommended","Had the participant received a COVID-19 vaccinate booster dose at time of blood draw?","","0= No; 1=Yes received booster","prod_vacbooster_yn"
"vacbooster_name","String","50","Recommended","Which vaccine?(booster)","","",""
"vacbooster_date","Date","","Recommended","Date when vaccine booster was received:","","",""
"visit","String","60","Recommended","Visit name","","e.g., Baseline, 6-Month Follow Up, Year 2",""
"perceivedinfection_self","Integer","","Recommended","Perceived Infection - Self","1;2","1=Positive; 2=Negative",""
"syn_vac_yn","Integer","","Recommended","Had the participant received any COVID-19 vaccination at time of blood draw?","0::2","0=No; 1=Yes Fully vaccinated; 2=Yes partially vaccinated ","prod_vac_yn"
"vacname","String","50","Recommended","Which vaccine?","","",""
"vac1stdose_date","Date","","Recommended","Date when first vaccine was received:","","MM/DD/YYYY","datevac_datevaccinated"
"covid_vac_5_no___3","Integer","","Recommended","Do you intend to receive the COVID-19 vaccine, if it is offered/available to you? If no, why?: The vaccine could be harmful to my unborn child/child.","0;1","0=No; 1=Yes",""
"covid_vac_5_no___4","Integer","","Recommended","Do you intend to receive the COVID-19 vaccine, if it is offered/available to you? If no, why?: The vaccine is not useful.","0;1","0=No; 1=Yes",""
"covid_vac_5_no___5","Integer","","Recommended","Do you intend to receive the COVID-19 vaccine, if it is offered/available to you? If no, why?: My provider did not recommend the vaccine.","0;1","0=No; 1=Yes",""
"covid_vac_5_no___6","Integer","","Recommended","Do you intend to receive the COVID-19 vaccine, if it is offered/available to you? If no, why?: Other","0;1","0=No; 1=Yes",""
"covid_vac_5_no___7","Integer","","Recommended","Do you intend to receive the COVID-19 vaccine, if it is offered/available to you? If no, why?: Prefer not to respond.","0;1","0=No; 1=Yes",""
"covid_vac_5_yes___1","Integer","","Recommended","Do you intend to receive the COVID-19 vaccine, if it is offered/available to you? If yes, why?: I feel at risk.","0;1","0=No; 1=Yes",""
"covid_vac_5_yes___2","Integer","","Recommended","Do you intend to receive the COVID-19 vaccine, if it is offered/available to you? If yes, why?: The SARS-CoV-2, the virus that causes COVID-19, could be harmful for my health.","0;1","0=No; 1=Yes",""
"covid_vac_5_yes___3","Integer","","Recommended","Do you intend to receive the COVID-19 vaccine, if it is offered/available to you? If yes, why?: The vaccine useful.","0;1","0=No; 1=Yes",""
"covid_vac_5_yes___4","Integer","","Recommended","Do you intend to receive the COVID-19 vaccine, if it is offered/available to you? If yes, why?: My provider recommende the vaccine.","0;1","0=No; 1=Yes",""
"covid_vac_5_yes___5","Integer","","Recommended","Do you intend to receive the COVID-19 vaccine, if it is offered/available to you? If yes, why?: Other","0;1","0=No; 1=Yes",""
"covid_vac_5_yes___6","Integer","","Recommended","Do you intend to receive the COVID-19 vaccine, if it is offered/available to you? If yes, why?: Prefer not to respond.","0;1","0=No; 1=Yes",""
"covid_vac_5_undec___1","Integer","","Recommended","Do you intend to receive the COVID-19 vaccine, if it is offered/available to you? If undecided, why?: I am unsure if I am at risk.","0;1","0=No; 1=Yes",""
"covid_vac_5_undec___2","Integer","","Recommended","Do you intend to receive the COVID-19 vaccine, if it is offered/available to you? If undecided, why?: I feel I need more information about the vaccine.","0;1","0=No; 1=Yes",""
"covid_vac_5_undec___3","Integer","","Recommended","Do you intend to receive the COVID-19 vaccine, if it is offered/available to you? If undecided, why?: The vaccine could be harmful to me.","0;1","0=No; 1=Yes",""
"covid_vac_5_undec___4","Integer","","Recommended","Do you intend to receive the COVID-19 vaccine, if it is offered/available to you? If undecided, why?: The vaccine could be harmful to my unborn child/child.","0;1","0=No; 1=Yes",""
"covid_vac_5_undec___5","Integer","","Recommended","Do you intend to receive the COVID-19 vaccine, if it is offered/available to you? If undecided, why?: The vaccine is not useful.","0;1","0=No; 1=Yes",""
"covid_vac_5_undec___6","Integer","","Recommended","Do you intend to receive the COVID-19 vaccine, if it is offered/available to you? If undecided, why?: My provider did not recommend the vaccine.","0;1","0=No; 1=Yes",""
"covid_vac_5_undec___7","Integer","","Recommended","Do you intend to receive the COVID-19 vaccine, if it is offered/available to you? If undecided, why?: Prefer not to respond.","0;1","0=No; 1=Yes",""
"covid_vac_6a","Integer","","Recommended","At the time of this survey, have you received at least one COVID-19 vaccine dose?","1::4","1=No, I have not received any dose of COVID-19 vaccination; 2=Yes, partially vaccinated. (one dose of a two-part series; applicable only for vaccines, with a two-dose regimen.);3=Yes, fully vaccinated. (when booster COVID-19 vaccines are FDA approved, proceed, to question 6b.); 4=Prefer not to respond.",""
"covid_vac_6b","Integer","","Recommended","If you are fully vaccinated, have you received a booster vaccine in addition to the complete initial vaccine series?","1::3","1=Yes, I have received a booster vaccine; 2=No, I have not received a booster vaccine; 3=Prefer not to respond.",""
"covid_vac_1","Integer","","Recommended","How likely do you think it is that you have been exposed to SARS-CoV-2, the virus that causes COVID-19?","1::11","1=Very Low; 10=Very High; 11=Prefer not to respond",""
"covid19_vac_survey_complete","Integer","","Recommended","Covid-19 Vaccination Survey Complete?","0::2","0=Incomplete; 1=Unverified; 2=Complete",""
"covid_vac_2","Integer","","Recommended","Did you get the seasonal influenza vaccination (a flu shot) in the most recent fall/winter season?","1::3","1=Yes; 2=No; 3=Prefer not to respond",""
"covid_vac_3","Integer","","Recommended","How useful do you think the COVID-19 vaccine is? (1 useless; 10 very useful)","1::11","1=Useless; 10=Very useful; 11=Prefer not to respond",""
"covid_vac_4","Integer","","Recommended","Do you think that it is dangerous for you to get the COVID-19 vaccination? (1 not dangerous; 10 very dangerous)","1::11","1=Not dangerous; 10=Very dangerous; 11=Prefer not to respond",""
"covid_vac_5","Integer","","Recommended","Do you intend to receive the COVID-19 vaccine, if it is offered/available to you?","1::4","1=Yes; 2=No; 3=Undecided; 4=Prefer not to respond",""
"covid_vac_5_no___1","Integer","","Recommended","Do you intend to receive the COVID-19 vaccine, if it is offered/available to you? If no, why?: I do not feel at risk.","0;1","0=No; 1=Yes",""
"covid_vac_5_no___2","Integer","","Recommended","Do you intend to receive the COVID-19 vaccine, if it is offered/available to you? If no, why?: The vaccine could be harmful to me.","0;1","0=No; 1=Yes",""
"numberofbooster","Integer","","Recommended","How many COVID-19 booster doses had the participant received at time of blood draw? ","0::12","number of boosters",""
"vacbooster_name_2","String","25","Recommended","Second Booster:  Which Vaccine?","","",""
"vacbooster_date_2","Date","","Recommended","Date When 2nd Vaccine Booster Was Received","","MM/DD/YYYY",""
"vacbooster_name_3","String","25","Recommended","Third Booster:  Which Vaccine?","","",""
"vacbooster_date_3","Date","","Recommended","Date When 3rd Vaccine Booster Was Received","","MM/DD/YYYY",""
"vacbooster_name_4","String","25","Recommended","Fourth Booster:  Which Vaccine?","","",""
"vacbooster_date_4","Date","","Recommended","Date When 4th Vaccine Booster Was Received","","MM/DD/YYYY",""
"covid19q9","Integer","","Recommended","I do not want to get a vacine to prevent COVID-19.","1::6","1 = Strongly disagree; 2 = Somewhat disagree; 3 = Neither agree nor disagree; 4 = Somewhat agree; 5 = Strongly agree; 6 = I prefer not to answer",""
"covid19q2","Integer","","Recommended","Have you ever received a diagnosis of COVID-19?","0::2","0 = No; 1 = Yes; 2 = Prefer to not answer",""
"covid19q3","Integer","","Recommended","Have you ever received a COVID-19 vaccine?","0::2","0 = No; 1 = Yes; 2 = Prefer to not answer",""
"covid19q4","Integer","","Recommended","If you did receive a COVID-19 vaccine, which vaccine did you receive?","1::6","1 = Pfizer; 2 = Moderna; 3 = Johnson & Johnson; 4 = I don't know; 5 = I prefer to not answer; 6=Other",""
"covid19q5","Integer","","Recommended","If you did receive a COVID-19 vaccine, how many doses of the vaccine have you received?","1::4","1 = 1; 2 = 2; 3 = 3; 4 = I prefer to not answer",""
"covid19q6","Integer","","Recommended","If you have received less than 2 doses and not Johnson & Johnson, do you have your second dose scheduled?","0::2","0 = No; 1 = Yes; 2 = Prefer to not answer",""
"covid19q7","Integer","","Recommended","I am worried that the COVID-19 vaccines could be harmful.","1::6","1 = Strongly disagree; 2 = Somewhat disagree; 3 = Neither agree nor disagree; 4 = Somewhat agree; 5 = Strongly agree; 6 = I prefer not to answer",""
"covid19q8","Integer","","Recommended","I do not trust the COVID-19 vaccines.","1::6","1 = Strongly disagree; 2 = Somewhat disagree; 3 = Neither agree nor disagree; 4 = Somewhat agree; 5 = Strongly agree; 6 = I prefer not to answer",""
"covid19_testpast_intake","Integer","","Recommended","Were you formally tested during your past COVID-19 illness?","0;1","0 = No; 1 = Yes",""
"covid19_testdatep_intake","Date","","Recommended","During your past COVID-19 illness, what date did you test positive?","","",""
"covid19_symppast_intake","Integer","","Recommended","During your past COVID-19 illness, did you experience symptoms?","0;1","0 = No, I was asymptomatic; 1 = Yes, I had symptoms",""
"covid19_past_symptom1","Integer","","Recommended","Please select ALL symptoms you experienced during your past COVID-19 illness: Temperature/fever greater than 99.5 F?","0;1","0 = No; 1 = Yes",""
"covid19_past_symptom2","Integer","","Recommended","Please select ALL symptoms you experienced during your past COVID-19 illness: Cough?","0;1","0 = No; 1 = Yes",""
"covid19_past_symptom3","Integer","","Recommended","Please select ALL symptoms you experienced during your past COVID-19 illness: Difficulty breathing?","0;1","0 = No; 1 = Yes",""
"covid19_past_symptom4","Integer","","Recommended","Please select ALL symptoms you experienced during your past COVID-19 illness: Chills?","0;1","0 = No; 1 = Yes",""
"covid19_past_symptom5","Integer","","Recommended","Please select ALL symptoms you experienced during your past COVID-19 illness: Night sweats?","0;1","0 = No; 1 = Yes",""
"covid19_past_symptom6","Integer","","Recommended","Please select ALL symptoms you experienced during your past COVID-19 illness: Muscle pain?","0;1","0 = No; 1 = Yes",""
"covid19_past_symptom7","Integer","","Recommended","Please select ALL symptoms you experienced during your past COVID-19 illness: Joint pain?","0;1","0 = No; 1 = Yes",""
"covid19_past_symptom8","Integer","","Recommended","Please select ALL symptoms you experienced during your past COVID-19 illness: Headache?","0;1","0 = No; 1 = Yes",""
"covid19_past_symptom9","Integer","","Recommended","Please select ALL symptoms you experienced during your past COVID-19 illness: Diarrhea?","0;1","0 = No; 1 = Yes",""
"covid19_past_symptom10","Integer","","Recommended","Please select ALL symptoms you experienced during your past COVID-19 illness: Eye pain?","0;1","0 = No; 1 = Yes",""
"covid19_past_symptom11","Integer","","Recommended","Please select ALL symptoms you experienced during your past COVID-19 illness: Decreased sense of smell?","0;1","0 = No; 1 = Yes",""
"covid19_past_symptom12","Integer","","Recommended","Please select ALL symptoms you experienced during your past COVID-19 illness: Decreased sense of taste?","0;1","0 = No; 1 = Yes",""
"covid19_past_symptom13","Integer","","Recommended","Please select ALL symptoms you experienced during your past COVID-19 illness: Extreme fatigue?","0;1","0 = No; 1 = Yes",""
"covid19_past_symptom14","Integer","","Recommended","Please select ALL symptoms you experienced during your past COVID-19 illness: None of the above?","0;1","0 = No; 1 = Yes",""
"covid19_sympres_intake","Date","","Recommended","What date did you notice that all of your symptoms fully resolved from your past COVID-19 illness? If your symptoms are still ongoing, please fill in 01/01/2000.","","",""
"covid19_poscur_intake","Integer","","Recommended","Have you tested positive for COVID-19 recently or suspect you have COVID-19 currently?","0;1","0= No; 1= Yes",""
"covid19_priorcur_intake","Integer","","Recommended","Have you filled out a questionnaire with us before about your current COVID-19 illness?","0::2","0= No; 1= Yes; 2= Unsure",""
"timepoint_label","String","50","Recommended","Timepoint/visit label","","e.g., Baseline, 6-Month Follow Up, Year 2; Morning, At Bedtime",""
"covid19_suspcur_intake","Date","","Recommended","During your current COVID-19 illness, what date did you first suspect you might have COVID-19 (either due to symptoms manifesting or concerns about contact with a COVID-19 positive person)?","","",""
"covid19_testcur_intake","Integer","","Recommended","Were you formally tested during your current COVID-19 illness?","0;1","0 = No; 1 = Yes",""
"covid19_testdatec_intake","Date","","Recommended","During your current COVID-19 illness, what date did you test positive?","","",""
"covid19_sympcur_intake","Integer","","Recommended","Are you currently experiencing symptoms?","0;1","0= No, I am asymptomatic; 1= Yes, I have symptoms",""
"covid19_symplistcur","Integer","","Recommended","Please select ALL symptoms you experienced during your current COVID-19 illness: Temperature/fever greater than 99.5 F?","0;1","0 = No; 1 = Yes",""
"covid19_curr_symptom1","Integer","","Recommended","Please select ALL symptoms you experienced during your current COVID-19 illness: Cough?","0;1","0 = No; 1 = Yes",""
"covid19_curr_symptom2","Integer","","Recommended","Please select ALL symptoms you experienced during your current COVID-19 illness: Difficulty breathing?","0;1","0 = No; 1 = Yes",""
"covid19_curr_symptom3","Integer","","Recommended","Please select ALL symptoms you experienced during your current COVID-19 illness: Chills?","0;1","0 = No; 1 = Yes",""
