"ElementName","DataType","Size","Required","ElementDescription","ValueRange","Notes","Aliases"
"cov_test","Integer","","Recommended","Have you ever been tested for coronavirus (COVID-19)?","1::4;-99","1 = Yes, and I tested positive for COVID-19 at least once; 2 = Yes, and I tested negative for COVID-19 every time; 3 = No, I wanted to but was not able to get a test; 4 = No, I never tried to get tested; -99= Missing data",""
"cov_sev","Integer","","Recommended","How severe is/was the illness? (If you had COVID multiple times, report the severity of the worst time you had it)","1::4;-99","1 = Not at all severe; 2 = Not too severe; 3 = Somewhat severe; 4 = Very severe; -99= Missing data",""
"cov_hosp_new_1","Integer","","Recommended","Did you ever have to stay in a hospital or visit an emergency room because of COVID symptoms? (Please select all that apply): Yes, stayed in a hospital overnight","0;1;-99","0= Not selected; 1 = Selected; -99= Missing data",""
"cov_hosp_new_2","Integer","","Recommended","Did you ever have to stay in a hospital or visit an emergency room because of COVID symptoms? (Please select all that apply): Yes, visited an emergency room","0;1;-99","0= Not selected; 1 = Selected; -99= Missing data",""
"cov_hosp_new_3","Integer","","Recommended","Did you ever have to stay in a hospital or visit an emergency room because of COVID symptoms? (Please select all that apply): Yes, visited a doctor or urgent care clinic","0;1;-99","0= Not selected; 1 = Selected; -99= Missing data",""
"cov_hosp_new_4","Integer","","Recommended","Did you ever have to stay in a hospital or visit an emergency room because of COVID symptoms? (Please select all that apply): No","0;1;-99","0= Not selected; 1 = Selected; -99= Missing data",""
"c19dx1","Integer","","Recommended","Have you ever tested positive for COVID-19?","0;1","0 = No; 1 = Yes",""
"c19dx2","Integer","","Recommended","How many times have you had COVID-19?","","Respond if c19dx1 is Yes",""
"c19when","String","30","Recommended","When did you have COVID (most recently; month/year only)?","","Respond if c19dx1 is Yes",""
"c19severity","Integer","","Recommended","How would you characterize the severity of your experience with COVID-19?","0::3","0 = Mild; 1 = Moderate; 2 = Severe, not hospitalized; 3 = Severe, hospitalized; Respond if c19dx1 is Yes",""
"c19long","Integer","","Recommended","As a result of having COVID-19, did you experience (or are you currently experiencing) any long-term effects (referred to as ''post-covid'' conditions, or ''Long Covid''), that lasted weeks, months or years after your infection, including any of the following: Tiredness or fatigue that interferes with daily life; Symptoms that get worse after physical or mental effort (also known as ''post-exertional malaise''); Fever; Difficulty breathing or shortness of breath; Cough; Chest pain; Fast-beating or pounding heart (also known as heart palpitations); Difficulty thinking or concentrating (sometimes referred to as ''brain fog''); Headache; Sleep problems; Dizziness when you stand up (lightheadedness); Pins-and-needles feelings; Change in smell or taste; Depression or anxiety; Diarrhea; Stomach pain; Joint or muscle pain; Rash; Changes in menstrual cycles; Any other symptom attributed to COVID-19?","0;1","0 = No; 1 = Yes; Respond if c19dx1 is Yes",""
"c19isol1","Integer","","Recommended","Have you ever had to isolate or quarantine due to exposure to COVID-19?","0;1","0 = No; 1 = Yes",""
"c19isol2","Integer","","Recommended","How many times did you have to isolate/quarantine due to exposure to COVID-19?","","Respond if c19dx1 is Yes",""
