"ElementName","DataType","Size","Required","ElementDescription","ValueRange","Notes","Aliases"
"cooper_13","Integer","","Recommended","If you have a mother, how would you describe your relationship with her at the moment?","1::5","1= No mother; 2= Close, warm relationship; 3= Fair, reasonable warm, some minor discord; 4= Poor, not particularly warm, some serious bad feelings; 5= Very poor, relationship cold and hostile",""
"cooper_14","Integer","","Recommended","Have you anyone, apart from your mother or partner, in whom you can confide?","1;2","1= Yes; 2= No",""
"cooper_15","Integer","","Recommended","What is your highest level of education?","1::6","1= 8th grade or less; 2= High school; 3= GED; 4= Further qualifications (e.g. secretarial, nursing); 5= College degree; 6= Graduate degree",""
"cooper_16","Integer","","Recommended","How would you describe the area that you live in?","1::4","1= Very satisfactory; 2= Reasonably satisfactory; 3= Rather unsatisfactory; 4= Very unsatisfactory",""
"cooper_17","Integer","","Recommended","If you worked during this pregnancy, how do you feel about giving up work?","1::5","1= Not working; 2= Keen to stop; 3= Mixed feelings; 4= Reluctant to stop; 5= Don't intend to stop",""
"primiparae","Float","","Recommended","Primipara calculated score","","",""
"m0_score","Float","","Recommended","Multiple (M0) with no previous history of depression calculated score","","",""
"have_children","Integer","","Recommended","Do you have children?","0;1","0 = No;  1 = Yes",""
"cooper_2","Integer","","Recommended","Do you already have children? If Yes, after any previous delivery were you particularly miserable or depressed at any time during the following year?","1;2","1= Yes; 2= No",""
"cooper_3","Integer","","Recommended","Have you ever had difficulty getting pregnant and sought help?","1::3","1= Yes; 2= Yes, from own doctor; 3= Yes, from Clinic",""
"cooper_4","Integer","","Recommended","Has this pregnancy been a positive experience for you?","1::4","1= Yes, definitely; 2= Yes, mostly; 3= Mostly not; 4= Definitely not",""
"cooper_5","Integer","","Recommended","Have you felt at all tense or anxious during this pregnancy?","1::3","1= No, not at all; 2= Yes, a little; 3= Yes, a lot",""
"cooper_6","Integer","","Recommended","Have you felt particularly depressed or miserable over the last few weeks?","1;2","1= Yes; 2= No",""
"cooper_7","Integer","","Recommended","Have there been other times in your life (other than in the year following a delivery) when you have felt particularly miserable or depressed?","1;2","1= Yes; 2= No",""
