"ElementName","DataType","Size","Required","ElementDescription","ValueRange","Notes","Aliases"
"dri07","Integer","","Recommended","I was happy with the amount of support I received from people at home  ","1 :: 5 ; 444  ; 555 ; 777 ; 888 ; 999","1 = Strongly disagree ; 2 = Somewhat disagree ; 3 = Neither agree nor disagree ; 4 = Somewhat agree ; 5 = Strongly agree ; 444= Do not wish to respond; 999= No Answer; 888= Skipped; 777= Condition Skipped; 555= Missing",""
"dri08","Integer","","Recommended","People at home did things to show they cared about me.  ","1 :: 5 ; 444  ; 555 ; 777 ; 888 ; 999","1 = Strongly disagree ; 2 = Somewhat disagree ; 3 = Neither agree nor disagree ; 4 = Somewhat agree ; 5 = Strongly agree ; 444= Do not wish to respond; 999= No Answer; 888= Skipped; 777= Condition Skipped; 555= Missing",""
"drj01","Integer","","Recommended","My unit was like family to me.  ","1 :: 5 ; 444  ; 555 ; 777 ; 888 ; 999","1 = Strongly disagree ; 2 = Somewhat disagree ; 3 = Neither agree nor disagree ; 4 = Somewhat agree ; 5 = Strongly agree ; 444= Do not wish to respond; 999= No Answer; 888= Skipped; 777= Condition Skipped; 555= Missing",""
"drj02","Integer","","Recommended","People in my unit were trustworthy.  ","1 :: 5 ; 444  ; 555 ; 777 ; 888 ; 999","1 = Strongly disagree ; 2 = Somewhat disagree ; 3 = Neither agree nor disagree ; 4 = Somewhat agree ; 5 = Strongly agree ; 444= Do not wish to respond; 999= No Answer; 888= Skipped; 777= Condition Skipped; 555= Missing",""
"drj03","Integer","","Recommended","My fellow unit members appreciated my efforts.  ","1 :: 5 ; 444  ; 555 ; 777 ; 888 ; 999","1 = Strongly disagree ; 2 = Somewhat disagree ; 3 = Neither agree nor disagree ; 4 = Somewhat agree ; 5 = Strongly agree ; 444= Do not wish to respond; 999= No Answer; 888= Skipped; 777= Condition Skipped; 555= Missing",""
"drj04","Integer","","Recommended","I felt valued by my fellow unit members.  ","1 :: 5 ; 444  ; 555 ; 777 ; 888 ; 999","1 = Strongly disagree ; 2 = Somewhat disagree ; 3 = Neither agree nor disagree ; 4 = Somewhat agree ; 5 = Strongly agree ; 444= Do not wish to respond; 999= No Answer; 888= Skipped; 777= Condition Skipped; 555= Missing",""
"drj05","Integer","","Recommended","members of my unit were interested in my wellbeing.  ","1 :: 5 ; 444  ; 555 ; 777 ; 888 ; 999","1 = Strongly disagree ; 2 = Somewhat disagree ; 3 = Neither agree nor disagree ; 4 = Somewhat agree ; 5 = Strongly agree ; 444= Do not wish to respond; 999= No Answer; 888= Skipped; 777= Condition Skipped; 555= Missing",""
