"ElementName","DataType","Size","Required","ElementDescription","ValueRange","Notes","Aliases"
"home1_81","Integer","","Recommended","Does the exterior of the building have any of the following?  Do the interior common areas of the building (examples: entrance, foyer, hallways) contain holes in floor?","1;2;-2;-99;77;88","1= Yes ; 2= No ; -2, -2 Not Observed ; -99= N/A ; 77= Refused ; 88= Missing","home2_81"
"home1_82","Integer","","Recommended","Does the exterior of the building have any of the following?  Do the interior common areas of the building (examples: entrance, foyer, hallways) contain broken plaster or peeling paint over one square foot?","1;2;-2;-99;77;88","1= Yes ; 2= No ; -2, -2 Not Observed ; -99= N/A ; 77= Refused ; 88= Missing","home2_82"
"home1_83","Integer","","Recommended","Does the exterior of the building have any of the following?  Do the interior common areas of the building (examples: entrance, foyer, hallways) contain exposed wires?","1;2;-2;-99;77;88","1= Yes ; 2= No ; -2, -2 Not Observed ; -99= N/A ; 77= Refused ; 88= Missing","home2_83"
"home1_84","Integer","","Recommended","Does the exterior of the building have any of the following?  Were there any broken windows or cracked windowpanes?","1;2;-2;-99;77;88","1= Yes ; 2= No ; -2, -2 Not Observed ; -99= N/A ; 77= Refused ; 88= Missing","home2_84"
"home1_85","Integer","","Recommended","Does the exterior of the building have any of the following?  Was the wiring in the apartment or house exposed?","1::3;-2;-99;77;88","1= Yes ; 2= No ; 3= No electrical wiring ; -2, -2 Not observed; -99= N/A ; 77= Refused ; 88= Missing","home2_85"
"home1_86","Integer","","Recommended","Does the exterior of the building have any of the following?  Did the housing unit contain open cracks or holes in the walls or ceiling?","1;2;-2;-99;77;88","1= Yes ; 2= No ; -2, -2 Not Observed ; -99= N/A ; 77= Refused ; 88= Missing","home2_86"
"home1_87","Integer","","Recommended","Does the exterior of the building have any of the following?  Did the housing unit contain holes in the floor?","1;2;-2;-99;77;88","1= Yes ; 2= No ; -2, -2 Not Observed ; -99= N/A ; 77= Refused ; 88= Missing","home2_87"
"home1_88","Integer","","Recommended","Does the exterior of the building have any of the following?  Did the housing unit contain broken plaster or peeling paint over 1 square foot or more?","1;2;-2;-99;77;88","1= Yes ; 2= No ; -2, -2 Not Observed ; -99= N/A ; 77= Refused ; 88= Missing","home2_88"
"home1_89","Integer","","Recommended","Does the exterior of the building have any of the following?  Was the inside of the home dark?","1;2;-2;-99;77;88","1= Yes ; 2= No ; -2, -2 Not Observed ; -99= N/A ; 77= Refused ; 88= Missing","home2_89"
"home1_90","Integer","","Recommended","Does the exterior of the building have any of the following?  Was the inside of the home crowded?","1;2;-2;-99;77;88","1= Yes ; 2= No ; -2, -2 Not Observed ; -99= N/A ; 77= Refused ; 88= Missing","home2_90"
"home1_91","Integer","","Recommended","Does the exterior of the building have any of the following?  Were all visible rooms of the house/apartment noticeably cluttered?","1::4;-2;-99;77;88","1= Almost none ; 2= Yes, but not a lot ; 3= Yes quite a bit ; 4= Yes, almost everywhere ; -2= -2 Not Observed ; -99= N/A ; 77= Refused ; 88= Missing","home2_91"
"home1_92","Integer","","Recommended","Does the exterior of the building have any of the following?  Were all visible rooms of the house/apartment dirty or not reasonably cleaned?","1::4;-2;-99;77;88","1= Almost none ; 2= Yes, but not a lot ; 3= Yes quite a bit ; 4= Yes, almost everywhere ; -2= -2 Not Observed ; -99= N/A ; 77= Refused ; 88= Missing","home2_92"
"home1_93","Integer","","Recommended","Does the exterior of the building have any of the following?  Was the environment inside the home unsafe for young children?","1;2;-2;-99;77;88","1=  Yes ; 2= No ; -2=Not Observed ; -99= N/A ; 77= Refused ; 88= Missing","home2_93"
"home1_94","String","15","Recommended","Does the exterior of the building have any of the following?  Please check all hazardous conditions you observed","","1= Frayed electrical wires ; 2= Mice or rats ; 3= Broken glass ;4= Poisonous substances within reach of children ; 5= Falling plaster ; 6= Broken stairs  ; 7= Peeling paint  ; 8= Cleaning materials left out ; 9= Flames and heath within reach of young children; 10=0  Weapons (guns or knives) within reach of children ; 11=1 Other (specify) ; -2, -2 Not observed ;-99= N/A ; 77= Refused ; 88= Missing","home2_94"
"home1_94a","String","150","Recommended","Does the exterior of the building have any of the following?  Describe 'Other'","","","home2_94a"
"home1_95","Integer","","Recommended","Does the exterior of the building have any of the following?  Did you observe any youth's artwork or photographs of household children on display in the home (examples: artwork or photos on the refrigerator or on walls)","1;2;-2;-99;77;88","1= Yes ; 2= No ; -2, -2 Not Observed ; -99= N/A ; 77= Refused ; 88= Missing","home2_95"
"home1_96","Integer","","Recommended","Does the exterior of the building have any of the following?  Was the house or apartment overly noisy from noise in the house? (examples: television, shouts of children, radio)","1;2;-2;-99;77;88","1= Yes ; 2= No ; -2, -2 Not Observed ; -99= N/A ; 77= Refused ; 88= Missing","home2_96"
"home1_97","Integer","","Recommended","Does the exterior of the building have any of the following?  Was the house or apartment overly noisy from noise outside the house? (examples: train, cars, people, music)","1;2;-2;-99;77;88","1= Yes ; 2= No ; -2, -2 Not Observed ; -99= N/A ; 77= Refused ; 88= Missing","home2_97"
"home1_98","Integer","","Recommended","Does the exterior of the building have any of the following?  Were there obvious signs of recent alcohol or non-prescription drug consumption inside the home? (examples: drug paraphernalia, beer cans, liquor bottles)","1;2;-2;-99;77;88","1= Yes ; 2= No ; -2, -2 Not Observed ; -99= N/A ; 77= Refused ; 88= Missing","home2_98"
"home1_99","Integer","","Recommended","Does the exterior of the building have any of the following?  At least 10 books were present and visible in the household.","1;2;-2;-99;77;88","1= Yes ; 2= No ; -2, -2 Not Observed ; -99= N/A ; 77= Refused ; 88= Missing","home2_99"
"version_form","String","121","Recommended","Form used/assessment name","","e.g., Self-Report, Parent Form, Short Form, Revised Version",""
"home8","Integer","","Recommended","Parent uses complete sentence structure and some long words in conversing","1;2","1= Plus (behavior is observed during the visit or parent reports the conditions or events are characteristic of the home environment); 2= Minus (behavior is not observed during the visit or parent reports the conditions or events are not characteristic of the home environment)",""
"home9","Integer","","Recommended","When speaking of or to child, parent''s voice conveys positive feelings","1;2","1= Plus (behavior is observed during the visit or parent reports the conditions or events are characteristic of the home environment); 2= Minus (behavior is not observed during the visit or parent reports the conditions or events are not characteristic of the home environment)",""
"home10","Integer","","Recommended","Parent initiates verbal interchanges with visitor, asks questions, makes spontaneous comments","1;2","1= Plus (behavior is observed during the visit or parent reports the conditions or events are characteristic of the home environment); 2= Minus (behavior is not observed during the visit or parent reports the conditions or events are not characteristic of the home environment)",""
"home11","Integer","","Recommended","Family requires child to carry out certain self care routines, e.g., make bed, clean room, clean up after spills, bathe self","1;2","1= Plus (behavior is observed during the visit or parent reports the conditions or events are characteristic of the home environment); 2= Minus (behavior is not observed during the visit or parent reports the conditions or events are not characteristic of the home environment)",""
"home12","Integer","","Recommended","Family requires child to keep living and play area reasonably clean and straight","1;2","1= Plus (behavior is observed during the visit or parent reports the conditions or events are characteristic of the home environment); 2= Minus (behavior is not observed during the visit or parent reports the conditions or events are not characteristic of the home environment)",""
"home13","Integer","","Recommended","Child puts own outdoor clothing, dirty clothes, night clothes in special place","1;2","1= Plus (behavior is observed during the visit or parent reports the conditions or events are characteristic of the home environment); 2= Minus (behavior is not observed during the visit or parent reports the conditions or events are not characteristic of the home environment)",""
"home14","Integer","","Recommended","Parents set limits for child and generally enforce them (curfew, homework before TV, or other regulations that fit family pattern)","1;2","1= Plus (behavior is observed during the visit or parent reports the conditions or events are characteristic of the home environment); 2= Minus (behavior is not observed during the visit or parent reports the conditions or events are not characteristic of the home environment)",""
"home15","Integer","","Recommended","Parent is consistent in establishing or applying family rules","1;2","1= Plus (behavior is observed during the visit or parent reports the conditions or events are characteristic of the home environment); 2= Minus (behavior is not observed during the visit or parent reports the conditions or events are not characteristic of the home environment)",""
"home16","Integer","","Recommended","Parent introduces visitor to child","1;2","1= Plus (behavior is observed during the visit or parent reports the conditions or events are characteristic of the home environment); 2= Minus (behavior is not observed during the visit or parent reports the conditions or events are not characteristic of the home environment)",""
"home17","Integer","","Recommended","Parent does not violate rules of common courtesy during visit (welcomes, greets, offers visitor a sit)","1;2","1= Plus (behavior is observed during the visit or parent reports the conditions or events are characteristic of the home environment); 2= Minus (behavior is not observed during the visit or parent reports the conditions or events are not characteristic of the home environment)",""
"home18","Integer","","Recommended","Parent has not lost temper with child more than once during previous week","1;2","1= Plus (behavior is observed during the visit or parent reports the conditions or events are characteristic of the home environment); 2= Minus (behavior is not observed during the visit or parent reports the conditions or events are not characteristic of the home environment)",""
"home19","Integer","","Recommended","Parent reports no more than one instance of physical punishment occurred during past month","1;2","1= Plus (behavior is observed during the visit or parent reports the conditions or events are characteristic of the home environment); 2= Minus (behavior is not observed during the visit or parent reports the conditions or events are not characteristic of the home environment)",""
"home20","Integer","","Recommended","Child can express negative feelings toward parents without harsh reprisals","1;2","1= Plus (behavior is observed during the visit or parent reports the conditions or events are characteristic of the home environment); 2= Minus (behavior is not observed during the visit or parent reports the conditions or events are not characteristic of the home environment)",""
"home21","Integer","","Recommended","Parent has not cried or been visibly upset in child''s presence more than once during past week","1;2","1= Plus (behavior is observed during the visit or parent reports the conditions or events are characteristic of the home environment); 2= Minus (behavior is not observed during the visit or parent reports the conditions or events are not characteristic of the home environment)",""
"home22","Integer","","Recommended","Child has a special place in which to keep his/her possessions","1;2","1= Plus (behavior is observed during the visit or parent reports the conditions or events are characteristic of the home environment); 2= Minus (behavior is not observed during the visit or parent reports the conditions or events are not characteristic of the home environment)",""
"home23","Integer","","Recommended","Parent talks to child during visit (beyond correction and introduction)","1;2","1= Plus (behavior is observed during the visit or parent reports the conditions or events are characteristic of the home environment); 2= Minus (behavior is not observed during the visit or parent reports the conditions or events are not characteristic of the home environment)",""
"home24","Integer","","Recommended","Parent uses some term of endearment or some diminutive for child''s name when talking about child at least twice during visit","1;2","1= Plus (behavior is observed during the visit or parent reports the conditions or events are characteristic of the home environment); 2= Minus (behavior is not observed during the visit or parent reports the conditions or events are not characteristic of the home environment)",""
"home25","Integer","","Recommended","Parents does not express overt annoyance with or hostility toward child (complains, describes child as ''bad,'' says child will not mind, etc.)","1;2","1= Plus (behavior is observed during the visit or parent reports the conditions or events are characteristic of the home environment); 2= Minus (behavior is not observed during the visit or parent reports the conditions or events are not characteristic of the home environment)",""
"home26","Integer","","Recommended","Parent buys and reads a newspaper daily","1;2","1= Plus (behavior is observed during the visit or parent reports the conditions or events are characteristic of the home environment); 2= Minus (behavior is not observed during the visit or parent reports the conditions or events are not characteristic of the home environment)",""
"home27","Integer","","Recommended","Family has a dictionary and encourages child to use it","1;2","1= Plus (behavior is observed during the visit or parent reports the conditions or events are characteristic of the home environment); 2= Minus (behavior is not observed during the visit or parent reports the conditions or events are not characteristic of the home environment)",""
"home1","Integer","","Recommended","Family has fairly regular and predictable daily schedule for child (meals, day care, bedtime, TV, homework, etc)","1;2","1= Plus (behavior is observed during the visit or parent reports the conditions or events are characteristic of the home environment); 2= Minus (behavior is not observed during the visit or parent reports the conditions or events are not characteristic of the home environment)",""
"home28","Integer","","Recommended","Child has visited a friend by him/herself in the past week","1;2","1= Plus (behavior is observed during the visit or parent reports the conditions or events are characteristic of the home environment); 2= Minus (behavior is not observed during the visit or parent reports the conditions or events are not characteristic of the home environment)",""
"home29","Integer","","Recommended","Child has free access to TV or radio (can freely switch on radio or TV)","1;2","1= Plus (behavior is observed during the visit or parent reports the conditions or events are characteristic of the home environment); 2= Minus (behavior is not observed during the visit or parent reports the conditions or events are not characteristic of the home environment)",""
"home30","Integer","","Recommended","Child has free access to musical instrument (piano, drum, ukulele or guitar, etc.)","1;2","1= Plus (behavior is observed during the visit or parent reports the conditions or events are characteristic of the home environment); 2= Minus (behavior is not observed during the visit or parent reports the conditions or events are not characteristic of the home environment)",""
"home31","Integer","","Recommended","Child has free access to at least ten appropriate books","1;2","1= Plus (behavior is observed during the visit or parent reports the conditions or events are characteristic of the home environment); 2= Minus (behavior is not observed during the visit or parent reports the conditions or events are not characteristic of the home environment)",""
"home32","Integer","","Recommended","Child has free access to desk or other suitable place for reading or studying","1;2","1= Plus (behavior is observed during the visit or parent reports the conditions or events are characteristic of the home environment); 2= Minus (behavior is not observed during the visit or parent reports the conditions or events are not characteristic of the home environment)",""
"home33","Integer","","Recommended","House has at least two pictures or other type of art work on the walls","1;2","1= Plus (behavior is observed during the visit or parent reports the conditions or events are characteristic of the home environment); 2= Minus (behavior is not observed during the visit or parent reports the conditions or events are not characteristic of the home environment)",""
"home34","Integer","","Recommended","Family has a TV and it is used judiciously, not left on continuously","1;2","1= Plus (behavior is observed during the visit or parent reports the conditions or events are characteristic of the home environment); 2= Minus (behavior is not observed during the visit or parent reports the conditions or events are not characteristic of the home environment)",""
"home35","Integer","","Recommended","Family encourages child to develop and sustain hobbies","1;2","1= Plus (behavior is observed during the visit or parent reports the conditions or events are characteristic of the home environment); 2= Minus (behavior is not observed during the visit or parent reports the conditions or events are not characteristic of the home environment)",""
"home36","Integer","","Recommended","Child is regularly included in family''s recreational hobby","1;2","1= Plus (behavior is observed during the visit or parent reports the conditions or events are characteristic of the home environment); 2= Minus (behavior is not observed during the visit or parent reports the conditions or events are not characteristic of the home environment)",""
"home37","Integer","","Recommended","Family provides lessons or organizational membership to support child''s talents (Kids'' sports league, swimming lessons, tennis lessons, etc.)","1;2","1= Plus (behavior is observed during the visit or parent reports the conditions or events are characteristic of the home environment); 2= Minus (behavior is not observed during the visit or parent reports the conditions or events are not characteristic of the home environment)",""
"home2","Integer","","Recommended","Parent sometimes yield to child''s fears or rituals (allows night light, accompanies child to new experiences)","1;2","1= Plus (behavior is observed during the visit or parent reports the conditions or events are characteristic of the home environment); 2= Minus (behavior is not observed during the visit or parent reports the conditions or events are not characteristic of the home environment)",""
"home38","Integer","","Recommended","Child has ready access to at least two pieces of playground equipment and toys in the immediate vicinity","1;2","1= Plus (behavior is observed during the visit or parent reports the conditions or events are characteristic of the home environment); 2= Minus (behavior is not observed during the visit or parent reports the conditions or events are not characteristic of the home environment)",""
"home39","Integer","","Recommended","Child has access to a library card, and family arranges for child to go to library once a month","1;2","1= Plus (behavior is observed during the visit or parent reports the conditions or events are characteristic of the home environment); 2= Minus (behavior is not observed during the visit or parent reports the conditions or events are not characteristic of the home environment)",""
"home40","Integer","","Recommended","Family member has taken child on (or arranged for child to take) a plane or bus trip within the past year","1;2","1= Plus (behavior is observed during the visit or parent reports the conditions or events are characteristic of the home environment); 2= Minus (behavior is not observed during the visit or parent reports the conditions or events are not characteristic of the home environment)",""
"home41","Integer","","Recommended","Family visits or receives visits from relatives or friends at least twice a month","1;2","1= Plus (behavior is observed during the visit or parent reports the conditions or events are characteristic of the home environment); 2= Minus (behavior is not observed during the visit or parent reports the conditions or events are not characteristic of the home environment)",""
"home42","Integer","","Recommended","Child has accompanied parent on a family business venture 3 - 4 times within the past year (to garage, clothing shop, appliance repair shop, etc.)","1;2","1= Plus (behavior is observed during the visit or parent reports the conditions or events are characteristic of the home environment); 2= Minus (behavior is not observed during the visit or parent reports the conditions or events are not characteristic of the home environment)",""
"home43","Integer","","Recommended","Family member has taken child to (or arranged for child to attend) some type of musical or theatre performance","1;2","1= Plus (behavior is observed during the visit or parent reports the conditions or events are characteristic of the home environment); 2= Minus (behavior is not observed during the visit or parent reports the conditions or events are not characteristic of the home environment)",""
"home44","Integer","","Recommended","Family member has taken child on (or arranged for child to take) a trip of more than 50 miles from his home (50 miles radial distance, not total distance)","1;2","1= Plus (behavior is observed during the visit or parent reports the conditions or events are characteristic of the home environment); 2= Minus (behavior is not observed during the visit or parent reports the conditions or events are not characteristic of the home environment)",""
"home45","Integer","","Recommended","Parents discuss TV programs with child","1;2","1= Plus (behavior is observed during the visit or parent reports the conditions or events are characteristic of the home environment); 2= Minus (behavior is not observed during the visit or parent reports the conditions or events are not characteristic of the home environment)",""
"home46","Integer","","Recommended","Parent helps child to achieve motor skills - ride a two wheel bicycle, play football, etc.","1;2","1= Plus (behavior is observed during the visit or parent reports the conditions or events are characteristic of the home environment); 2= Minus (behavior is not observed during the visit or parent reports the conditions or events are not characteristic of the home environment)",""
"home47","Integer","","Recommended","Father (or father substitute) regularly engages in outdoor recreation with child","1;2","1= Plus (behavior is observed during the visit or parent reports the conditions or events are characteristic of the home environment); 2= Minus (behavior is not observed during the visit or parent reports the conditions or events are not characteristic of the home environment)",""
"home3","Integer","","Recommended","Child has been praised at least twice during past week for doing something","1;2","1= Plus (behavior is observed during the visit or parent reports the conditions or events are characteristic of the home environment); 2= Minus (behavior is not observed during the visit or parent reports the conditions or events are not characteristic of the home environment)",""
"home48","Integer","","Recommended","Child sees and spends some time with father or father figure 4 days a week","1;2","1= Plus (behavior is observed during the visit or parent reports the conditions or events are characteristic of the home environment); 2= Minus (behavior is not observed during the visit or parent reports the conditions or events are not characteristic of the home environment)",""
"home49","Integer","","Recommended","Child eats at least one meal per day, on most days with mother and father (or mother and father figures)","1;2","1= Plus (behavior is observed during the visit or parent reports the conditions or events are characteristic of the home environment); 2= Minus (behavior is not observed during the visit or parent reports the conditions or events are not characteristic of the home environment)",""
"home50","Integer","","Recommended","Child has remained with this primary family group for all his life aside from 2-3 week vacations, illness of mother, visits of grandmother, etc.","1;2","1= Plus (behavior is observed during the visit or parent reports the conditions or events are characteristic of the home environment); 2= Minus (behavior is not observed during the visit or parent reports the conditions or events are not characteristic of the home environment)",""
"home51","Integer","","Recommended","Childs room has picture or wall decoration appealing to children","1;2","1= Plus (behavior is observed during the visit or parent reports the conditions or events are characteristic of the home environment); 2= Minus (behavior is not observed during the visit or parent reports the conditions or events are not characteristic of the home environment)",""
