"ElementName","DataType","Size","Required","ElementDescription","ValueRange","Notes","Aliases"
"home52","Integer","","Recommended","The interior of the apartment is not dark or perceptually monotonous","1;2","1= Plus (behavior is observed during the visit or parent reports the conditions or events are characteristic of the home environment); 2= Minus (behavior is not observed during the visit or parent reports the conditions or events are not characteristic of the home environment)",""
"home53","Integer","","Recommended","In terms of available floor space, the rooms are not overcrowded with furniture","1;2","1= Plus (behavior is observed during the visit or parent reports the conditions or events are characteristic of the home environment); 2= Minus (behavior is not observed during the visit or parent reports the conditions or events are not characteristic of the home environment)",""
"home54","Integer","","Recommended","All visible rooms of the house are reasonably clean and minimally cluttered","1;2","1= Plus (behavior is observed during the visit or parent reports the conditions or events are characteristic of the home environment); 2= Minus (behavior is not observed during the visit or parent reports the conditions or events are not characteristic of the home environment)",""
"home55","Integer","","Recommended","There is at least 100 square feet of living space per person in the house","1;2","1= Plus (behavior is observed during the visit or parent reports the conditions or events are characteristic of the home environment); 2= Minus (behavior is not observed during the visit or parent reports the conditions or events are not characteristic of the home environment)",""
"home56","Integer","","Recommended","House is not overly noisy - TV, shouts of children, radio, etc.","1;2","1= Plus (behavior is observed during the visit or parent reports the conditions or events are characteristic of the home environment); 2= Minus (behavior is not observed during the visit or parent reports the conditions or events are not characteristic of the home environment)",""
"home57","Integer","","Recommended","Building has no potentially dangerous structural or health defects (e.g., plaster coming down from ceiling and walls, leaking roof, rodents, etc.)","1;2","1= Plus (behavior is observed during the visit or parent reports the conditions or events are characteristic of the home environment); 2= Minus (behavior is not observed during the visit or parent reports the conditions or events are not characteristic of the home environment)",""
"home4","Integer","","Recommended","Child is encouraged to read on his own","1;2","1= Plus (behavior is observed during the visit or parent reports the conditions or events are characteristic of the home environment); 2= Minus (behavior is not observed during the visit or parent reports the conditions or events are not characteristic of the home environment)",""
"home58","Integer","","Recommended","Childs outside play environment appears safe and free of hazards","1;2","1= Plus (behavior is observed during the visit or parent reports the conditions or events are characteristic of the home environment); 2= Minus (behavior is not observed during the visit or parent reports the conditions or events are not characteristic of the home environment)",""
"home5","Integer","","Recommended","Parent encourages child to contribute to the conversation during visit","1;2","1= Plus (behavior is observed during the visit or parent reports the conditions or events are characteristic of the home environment); 2= Minus (behavior is not observed during the visit or parent reports the conditions or events are not characteristic of the home environment)",""
"home6","Integer","","Recommended","Parent shows some emotional response to praise of child by visitor","1;2","1= Plus (behavior is observed during the visit or parent reports the conditions or events are characteristic of the home environment); 2= Minus (behavior is not observed during the visit or parent reports the conditions or events are not characteristic of the home environment)",""
"home7","Integer","","Recommended","Parent responds to child''s questions during visit","1;2","1= Plus (behavior is observed during the visit or parent reports the conditions or events are characteristic of the home environment); 2= Minus (behavior is not observed during the visit or parent reports the conditions or events are not characteristic of the home environment)",""
