"ElementName","DataType","Size","Required","ElementDescription","ValueRange","Notes","Aliases"
"subjectkey","GUID","","Required","The NDAR Global Unique Identifier (GUID) for research subject","NDAR*","",""
"src_subject_id","String","45","Required","Subject ID how it's defined in lab/project","","",""
"network_type","String","50","Recommended","Network type","","",""
"int_weight","Integer","","Recommended","number of times during the past three months","0::3; 4; 6; 7; 10; 12; 24; 60; 120; 180","",""
"wave","Integer","","Recommended","wave 1= September to December, wave 2= April to June, wave 3=summer months","1::3","wave 1= September to December, wave 2= April to June, wave 3=summer months",""
"comment","String","500","Recommended","Miscellaneous comments about assessment","","",""
"interview_date","Date","","Required","Date on which the interview/genetic test/sampling/imaging/biospecimen was completed. MM/DD/YYYY","","",""
"interview_age","Integer","","Required","Age in months at the time of the interview/test/sampling/imaging.","0::1440","Age is rounded to chronological month. If the research participant is 15-days-old at time of interview, the appropriate value would be 0 months. If the participant is 16-days-old, the value would be 1 month.",""
"sex","String","20","Required","Sex of subject at birth","M;F; O; NR","M = Male; F = Female; O=Other; NR = Not reported","gender"
