"ElementName","DataType","Size","Required","ElementDescription","ValueRange","Notes","Aliases"
"subjectkey","GUID","","Required","The NDAR Global Unique Identifier (GUID) for research subject","NDAR*","",""
"src_subject_id","String","45","Required","Subject ID how it's defined in lab/project","","",""
"interview_date","Date","","Required","Date on which the interview/genetic test/sampling/imaging/biospecimen was completed. MM/DD/YYYY","","",""
"interview_age","Integer","","Required","Age in months at the time of the interview/test/sampling/imaging.","0::1440","Age is rounded to chronological month. If the research participant is 15-days-old at time of interview, the appropriate value would be 0 months. If the participant is 16-days-old, the value would be 1 month.",""
"sex","String","20","Required","Sex of subject at birth","M;F; O; NR","M = Male; F = Female; O=Other; NR = Not reported",""
"hps1","Integer","","Recommended","I feel at risk of HIV infection in the next 3 months","0::3","0= Strongly disagree; 1= Disagree; 2= Agree; 3= Strongly agree",""
"hps2","Integer","","Recommended","Imagining myself having HIV in the next 3 months is something I find easy to do","0::3","0= Strongly disagree; 1= Disagree; 2= Agree; 3= Strongly agree",""
"hps3","Integer","","Recommended","I am concerned that I might have sex with someone who could give me HIV in the next 3 months","0::3","0= Strongly disagree; 1= Disagree; 2= Agree; 3= Strongly agree",""
"hps4","Integer","","Recommended","I am much more likely to get HIV than my friends in the next 3 months","0::3","0= Strongly disagree; 1= Disagree; 2= Agree; 3= Strongly agree",""
"hps5","Integer","","Recommended","My sexual behavior gives me a chance of getting HIV in the next 3 months","0::3","0= Strongly disagree; 1= Disagree; 2= Agree; 3= Strongly agree",""
"hps6","Integer","","Recommended","I feel able to protect myself from getting HIV","0::3","0= Strongly disagree; 1= Disagree; 2= Agree; 3= Strongly agree",""
"hps7","Integer","","Recommended","I think about my chances of getting HIV whenever I have a new sexual partner","0::3","0= Strongly disagree; 1= Disagree; 2= Agree; 3= Strongly agree",""
"hps8","Integer","","Recommended","My main sexual partner's behavior gives me a chance of getting HIV in the next 3 months","0::3","0= Strongly disagree; 1= Disagree; 2= Agree; 3= Strongly agree",""
"hps9","Integer","","Recommended","I trust my main sexual partner to keep me free from HIV","0::3","0= Strongly disagree; 1= Disagree; 2= Agree; 3= Strongly agree",""
