"ElementName","DataType","Size","Required","ElementDescription","ValueRange","Notes","Aliases"
"subjectkey","GUID","","Required","The NDAR Global Unique Identifier (GUID) for research subject","NDAR*","",""
"src_subject_id","String","45","Required","Subject ID how it's defined in lab/project","","",""
"interview_date","Date","","Required","Date on which the interview/genetic test/sampling/imaging/biospecimen was completed. MM/DD/YYYY","","",""
"interview_age","Integer","","Required","Age in months at the time of the interview/test/sampling/imaging.","0::1440","Age is rounded to chronological month. If the research participant is 15-days-old at time of interview, the appropriate value would be 0 months. If the participant is 16-days-old, the value would be 1 month.",""
"sex","String","20","Required","Sex of subject at birth","M;F; O; NR","M = Male; F = Female; O=Other; NR = Not reported",""
"ieloc_01","Integer","","Recommended","I am my own boss","1::5","1= Does not apply at all; 2= Applies a bit; 3= Applies somewhat; 4= Applies mostly; 5= Applies completely",""
"ieloc_02","Integer","","Recommended","If I work hard, I will succeed","1::5","1= Does not apply at all; 2= Applies a bit; 3= Applies somewhat; 4= Applies mostly; 5= Applies completely",""
"ieloc_03","Integer","","Recommended","Whether at work or in my private life: What I do is mainly determined by others","1::5","1= Does not apply at all; 2= Applies a bit; 3= Applies somewhat; 4= Applies mostly; 5= Applies completely",""
"ieloc_04","Integer","","Recommended","Fate often gets in the way of my plans","1::5","1= Does not apply at all; 2= Applies a bit; 3= Applies somewhat; 4= Applies mostly; 5= Applies completely",""
