"ElementName","DataType","Size","Required","ElementDescription","ValueRange","Notes","Aliases"
"subjectkey","GUID","","Required","The NDAR Global Unique Identifier (GUID) for research subject","NDAR*","",""
"src_subject_id","String","45","Required","Subject ID how it's defined in lab/project","","",""
"interview_date","Date","","Required","Date on which the interview/genetic test/sampling/imaging/biospecimen was completed. MM/DD/YYYY","","",""
"interview_age","Integer","","Required","Age in months at the time of the interview/test/sampling/imaging.","0::1440","Age is rounded to chronological month. If the research participant is 15-days-old at time of interview, the appropriate value would be 0 months. If the participant is 16-days-old, the value would be 1 month.",""
"sex","String","20","Required","Sex of subject at birth","M;F; O; NR","M = Male; F = Female; O=Other; NR = Not reported","gender"
"visit","String","60","Recommended","Visit name","","e.g., Baseline, 6-Month Follow Up, Year 2, Daily","tpid"
"session_id","String","20","Recommended","session ID/screening ID","","",""
"mentalhealth1","Integer","","Recommended","have you had any visits with a mental health professional, psychologist, psychiatrist, or similar?","0;1","0=No; 1=Yes",""
"mentalhealth2","String","50","Recommended","What was the visit with mental health professional, psychologist, etc. for?","","",""
"mentalhealth3","Integer","","Recommended","Was the last visit mental health professional, psychologist, etc. within the last year?","0;1","0=No; 1=Yes",""
"mentalhealth4","Integer","","Recommended","have you received private counseling?","0;1","0=No; 1=Yes",""
"mentalhealth5","String","50","Recommended","What was private counseling for?","","",""
"mentalhealth6","Integer","","Recommended","Was the last private counseling session within the last year?","0;1","0=No; 1=Yes",""
"mentalhealth7","Integer","","Recommended","have you been hospitalized for a mental health condition?","0;1","0=No; 1=Yes",""
"mentalhealth8","String","50","Recommended","What was hospitalization for?","","",""
"mentalhealth9","Integer","","Recommended","Was the last hospitilzation within the last year?","0;1","0=No; 1=Yes",""
"mentalhealth10","Integer","","Recommended","have you received treatment from a primary care doctor for anxiety or depression?","0;1","0=No; 1=Yes",""
"mentalhealth11","String","50","Recommended","What was treatment for?","","",""
"mentalhealth12","Date","","Recommended","Date of treatment for anxiety or depression","","MM/DD/YYYY",""
"mentalhealth13","Integer","","Recommended","have you used any medications for treatment of anxiety or depression?  q5","0;1","0=No; 1=Yes",""
"mentalhealth14","String","100","Recommended","Who prescribed the medications","","",""
"psychmed1_date","Date","","Recommended","Medication 1; if past, date last used","","","mentalhealth15"
"mentalhealth16","Integer","","Recommended","have you attended a support group for depression or anxiety?","0;1","0=No; 1=Yes",""
"mentalhealth17","Integer","","Recommended","Was the support group face-to-face or online?","1;2","1=Face to Face; 2= Online",""
"mentalhealth18","Integer","","Recommended","Was the last support group within the last year?","0;1","0=No; 1=Yes",""
"mentalhealth19","Integer","","Recommended","have you been treated for an alcohol problem?","0;1","0=No; 1=Yes",""
"mentalhealth20","String","100","Recommended","Who treated alcohol problem?","","",""
"mentalhealth21","Integer","","Recommended","Was the last treatment within the last year?","0;1","0=No; 1=Yes",""
"mentalhealth22","Integer","","Recommended","have you used alternate therapies such as acupuncture or herbal remedies for any mental health problems?","0;1","0=No; 1=Yes",""
"mentalhealth23","String","100","Recommended","What type of alternate therapies were used?","","",""
"mentalhealth24","String","100","Recommended","Who in family sufferes from anxiety?","","",""
"mentalhealth25","String","100","Recommended","Who in family sufferes from depression?","","",""
"mentalhealth26","String","100","Recommended","Who in family sufferes from bipolar/ manic disorder?","","",""
"mentalhealth27","String","100","Recommended","Who in family sufferes from other mental illnesses?","","",""
"mentalhealth28","String","255","Recommended","Describe other mental illnesses family members suffer from","","",""
"mentalhealth29","String","100","Recommended","Who in family has attempted suicide?","","",""
"version_form","String","121","Recommended","Form used/assessment name","","e.g., Self-Report, Parent Form, Short Form, Revised Version","formid"
"b_mentalhealth03a_3","Integer","","Recommended","[If yes, to another person who thoughr you have problems with nerves or emotions] Who thought this? Neighbor","0;1","0=No; 1= Yes",""
"b_mentalhealth03a_4","Integer","","Recommended","[If yes, to another person who thoughr you have problems with nerves or emotions] Who thought this? Minister, Priest","0;1","0=No; 1= Yes",""
"b_mentalhealth03a_5","Integer","","Recommended","[If yes, to another person who thoughr you have problems with nerves or emotions] Who thought this? Professor","0;1","0=No; 1= Yes",""
"b_mentalhealth03a_6","Integer","","Recommended","[If yes, to another person who thoughr you have problems with nerves or emotions] Who thought this? Other","0;1","0=No; 1= Yes",""
"b_mentalhealth04","Integer","","Recommended","Have you ever gone to a doctor or other health care professional for emotional or mental health problems?  ","0;1;99","0= No; 1= Yes; 99= Not Sure",""
"b_mentalhealth04a_1","Integer","","Recommended","[If yes, to going to the doctor about emotion or mental health] Who did you see? Primary Care Doctor","0;1","0=No; 1= Yes",""
"b_mentalhealth04a_2","Integer","","Recommended","[If yes, to going to the doctor about emotion or mental health] Who did you see? Primary Care Nurse","0;1","0=No; 1= Yes",""
"b_mentalhealth04a_3","Integer","","Recommended","[If yes, to going to the doctor about emotion or mental health] Who did you see? Community Health Worker","0;1","0=No; 1= Yes",""
"b_mentalhealth04a_4","Integer","","Recommended","[If yes, to going to the doctor about emotion or mental health] Who did you see? Psychologist","0;1","0=No; 1= Yes",""
"b_mentalhealth04a_5","Integer","","Recommended","[If yes, to going to the doctor about emotion or mental health] Who did you see? Psychiatrist","0;1","0=No; 1= Yes",""
"b_mentalhealth04a_6","Integer","","Recommended","[If yes, to going to the doctor about emotion or mental health] Who did you see? Another Health Professional","0;1","0=No; 1= Yes",""
"b_mentalhealth04b","String","50","Recommended","Other information about the health professional(s) (optional):","","",""
"b_mentalhealth05","Integer","","Recommended","Have you ever consulted another person (other than a health care professional) about your emotional or mental health problems?","0;1;99","0= No; 1= Yes; 99= Not Sure",""
"b_mentalhealth05a_1","Integer","","Recommended","[If yes, to seeing another person about emotion or mental health] Who did you consult? Minister, Priest","0;1","0=No; 1= Yes",""
"b_mentalhealth05a_2","Integer","","Recommended","[If yes, to seeing another person about emotion or mental health] Who did you consult? Therapist/Coach","0;1","0=No; 1= Yes",""
"b_mentalhealth05a_3","Integer","","Recommended","[If yes, to seeing another person about emotion or mental health] Who did you consult? Professor","0;1","0=No; 1= Yes",""
"b_mentalhealth05a_4","Integer","","Recommended","[If yes, to seeing another person about emotion or mental health] Who did you consult? Family Member","0;1","0=No; 1= Yes",""
"b_mentalhealth05a_5","Integer","","Recommended","[If yes, to seeing another person about emotion or mental health] Who did you consult? Friend","0;1","0=No; 1= Yes",""
"b_mentalhealth05a_6","Integer","","Recommended","[If yes, to seeing another person about emotion or mental health] Who did you consult? Another Person","0;1","0=No; 1= Yes",""
"b_mentalhealth06","Integer","","Recommended","Did you receive treatment for depression or anxiety in the past? ","0;1;99","0= No; 1= Yes; 99= Not Sure",""
"b_mentalhealth01","Integer","","Recommended","During the past month, have you ever had personal, emotional, behavioral or mental health problems severe enough that you felt you needed help?","0;1;99","0= No; 1= Yes; 99= Not Sure",""
"b_mentalhealth06a","String","25","Recommended","How long ago? [Did you receive treatment for depression or anxiety]","","",""
"b_mentalhealth06b","Integer","","Recommended","Did you receive treatment with medications, therapy, or both?","1 :: 3;99","1= Medication; 2= Therapy; 3= Both; 99= No Response",""
"b_mentalhealth07","Integer","","Recommended","Are you receiving treatment now? ","0;1;99","0= No; 1= Yes; 99= Not Sure",""
"b_mentalhealth07a","Integer","","Recommended","Are you currently receiving treatment with mediations, therapy, or both?","1 :: 3;99","1= Medication; 2= Therapy; 3= Both; 99= No Response",""
"b_mentalhealth08","Integer","","Recommended","Did you let any of your friends know you were getting help for depression?","0;1;99","0= No; 1= Yes; 99= Not Sure",""
"b_mentalhealth09","Integer","","Recommended","Did you let any of your family members know you were getting help for depression? ","0;1;99","0= No; 1= Yes; 99= Not Sure",""
"b_mentalhealth10","String","4000","Recommended","Was there anything that prevented you from getting the help that you wanted? Please describe.","","",""
"b_mentalhealth11","String","4000","Recommended","What would make it possible for you to obtain help if you felt like you needed it?","","",""
"b_mentalhealth02","String","4000","Recommended","How would you describe what you were going through/feeling/thinking? ","","",""
"b_mentalhealth02a","Integer","","Recommended","Do you think the Covid19 pandemic has contributed to these symptoms?","0;1;99","0= No; 1= Yes; 99= Not Sure",""
"b_mentalhealth02b","String","4000","Recommended","[If yes, to Covid19 contribute] In what sense? Please explain.","","",""
"b_mentalhealth03","Integer","","Recommended","During the last year, did another person (family member, friend, neighbor, minister, priest or other) think that you had a problem with nerves, or an emotional problem? ","0;1;99","0= No; 1= Yes; 99= Not Sure",""
"b_mentalhealth03a_1","Integer","","Recommended","[If yes, to another person who thoughr you have problems with nerves or emotions] Who thought this? Family Member","0;1","0=No; 1= Yes",""
"b_mentalhealth03a_2","Integer","","Recommended","[If yes, to another person who thoughr you have problems with nerves or emotions] Who thought this? Friend","0;1","0=No; 1= Yes",""
"iddx","Integer","","Recommended","Intellectual disability","0;1;94","0 = No; 1 = Yes; 94 = Don't know",""
"lddx","Integer","","Recommended","Learning disorders: Dyslexia, reading, math, or other learning problem other than ADD/ADHD","0;1;94","0 = No; 1 = Yes; 94 = Don't know",""
"depr","Integer","","Recommended","depressed","0;1;-7","0=No; 1=Yes; -7=Refused",""
"eddx","Integer","","Recommended","Eating disorder","0;1;94","0 = No; 1 = Yes; 94 = Don't know",""
"bpdx","Integer","","Recommended","How old was the subject when she/he was first diagnosed with Bipolar Disorder? (specify age in years)","","",""
"schiz","Integer","","Recommended","Schizophrenia","0;1;94","0 = No; 1 = Yes; 94 = Don't know",""
"anx","Integer","","Recommended","Please rate how ANXIOUS you feel right now with a clear perpendicular mark on the line.","0 :: 100","in mm; 0 = not at all anxious; 100 = extremely anxious",""
"subuse","Integer","","Recommended","Substance use or alcohol use disorder","0;1;94","0 = No; 1 = Yes; 94 = Don't know",""
"college","String","150","Recommended","""If you did not complete a college program in which you were enrolled, what was the reason? ""","","",""
"dorm","Integer","","Recommended","Do you presently attend a 2-year or 4-year college or university? If yes: Do you reside in a college dormitory or university housing?","0;1;94","0 = No; 1 = Yes; 94 = Don't know",""
"partner","Integer","","Recommended","spouse partner conflict","0;1;-7","0=No; 1=Yes; -7=Refused",""
"education","Integer","","Recommended","How much education have you completed?","5::20","""5 = Less Than 5 grade; 6 = 6 grade;7 = 7 grade; 8 = 8 grade; 9 = 9grade; 10 = 10 grade; 11 = 11 grade; 12 = 12 grade;13 = Some college, but no degree;14 = Technical Degree;15 = Associates Degree;16 = More than two years, but no degree;17 = Bachelor's Degree;18 = Some graduate level coursework;19 = Master's Degree;20 = Ph.D. or M.D.""",""
"ed_other","String","500","Recommended","What is the highest level of education that you have completed? If you chose other, please describe:","","99=No data",""
"employ","Integer","","Recommended","Patient Employment Status at Baseline","0::3","0=Unknown; 1=Full Time;  2=Part Time; 3=Did Not Work; Full time = worked at least 18 days in past month; Part time = worked less than 18 days in past month and earned income (SURFQA=1); Did not work = worked less than 18 days in past month and did not earn income (SURFQA = 2 or 3)",""
"emp_other","String","500","Recommended","Are you currently employed full or part-time? If you chose other, please describe:","","",""
"reside","Integer","","Recommended","Offsprnig over 18: Children reside with you?","0;1","0 = No; 1 = Yes",""
"lunch","Integer","","Recommended","2. Lunch","1::4;-999","1= Never or almost never ; 2= 1 - 2 times per week ; 3= 3 - 4 times per week ; 4= 5 or more times per week ; -999= Missing",""
"orient","Integer","","Recommended","Regarding sexual orientation, I identify as (choose the best one):","1::7","1 = Heterosexual or straight; 2 = Bisexual; 3 = Homosexual, gay, lesbian; 4 = Asexual (I do not feel or have rarely felt sexually attracted to others); 5 = Pansexual (I feel attracted to people of all genders); 6 = Other (any other sexual orientation); 7 = Don't know/prefer not to say",""
"agedx","Integer","","Recommended","If applicable, at what age were you first diagnosed with autism?","","(age in months)",""
"ptsd","Integer","","Recommended","does participant have post-traumatic stress disorder? 0 = no; 1 = yes","0;1;999;-99","0 = No; 1 = Yes; -99= Missing/No answer",""
"adhd","Integer","","Recommended","does participant have adhd? 1 = does participant have adhd? 1 = ADHD-Innatentive; 2=ADHD-Hyperactive/Impulsive; 3=ADHD-Combined; 4=ADHD-NOS; 5=rule out ADHD","0 :: 5;999","1 = ADHD-Innatentive; 2 = ADHD-Hyperactive/Impulsive; 3 = ADHD-Combined; 4 = ADHD-NOS; 5 = Rule out ADHD",""
"oddcd","Integer","","Recommended","Oppositional/defiant disorder or conduct disorder (ODD or CD)","0;1;94","0 = No; 1 = Yes; 94 = Don't know",""
"dmhi5","Integer","","Recommended","Since you started our research study, have you been taking any medications prescribed by a doctor or nurse practitioner for substance abuse (e.g., Antabuse, naltrexone, methadone, buprenorphine, etc.)","0;1","0= No; 1= Yes",""
"dmhi5a","Integer","","Recommended","(if yes) Since you started our research study, did you have any changes in your prescribed medications for substance abuse?","0 :: 2","0= No; 1= Yes, added a new medication or increased the dose of an existing medication; 2= Yes, discontinued a medication or decreased the dose of an existing medication",""
"dmhi1","Integer","","Recommended","Since you started in our research study, please indicate what best describes your average involvement in support groups, such as Alcoholics Anonymous and Narcotics Anonymous?","0 :: 6","0= None; 1= Less than Once a Month; 2= Once a Month; 3= Every Other Week; 4= Once a Week; 5= Twice a Week; 6= Mora than twice a week",""
"dmhi2","Integer","","Recommended","Since you started in our research study, please indicate what best describes your average involvement in individual therapy.","0 :: 7","0= None; 1= Less than Once a Month; 2= Once a Month; 3= Every Other Week; 4= Once a Week; 5= Twice a Week; 6= Mora than twice a week; 7= New to Mental Health Treatment",""
"dmhi2a","Integer","","Recommended","(If any individual therapy) Since you started in our research study, what types of issues were you addressing in individual therapy?","1 :: 3","1= Mental Health; 2= Substance Abuse; 3= Both Mental Health and Substance Abuse",""
"dmhi3","Integer","","Recommended","Since you started in our research study, please indicate what best describes your average involvement in group therapy.","0 :: 7","0= None; 1= Less than Once a Month; 2= Once a Month; 3= Every Other Week; 4= Once a Week; 5= Twice a Week; 6= Mora than twice a week; 7= New to Mental Health Treatment",""
"dmhi3a","Integer","","Recommended","(if any group therapy) Since you started in our research study, what types of issues were you addressing in group therapy?","1 :: 3","1= Mental Health; 2= Substance Abuse; 3= Both Mental Health and Substance Abuse",""
"dmhi4","Integer","","Recommended","Since you started in our research study, have you been taking any medications prescribed by a doctor or nurse practitioner for mental health difficulties other than substance abuse (e.g., anxiety, sleep problems, depression, posttraumatic stress disorder)?","0;1","0= No; 1= Yes",""
"dmhi4a","Integer","","Recommended","(if yes) Since you started in our research study, did you have any changes in your prescribed medications for mental health difficulties other than substance abuse?","0 :: 2","0= No; 1= Yes, added a new medication or increased the dose of an existing medication; 2= Yes, discontinued a medication or decreased the dose of an existing medication",""
"he_1_c","Integer","","Recommended","Compared to another person of your age, would you say your health is:","1 :: 3;998;999","1= Worse than others; 2= Same as others; 3= Better than others; 998= Do Not Know; 999= No Answer",""
"he_2_c","String","500","Recommended","How often in the past one month were you unable to do the work you usually do because of an emotional or psychological problem?","","998= Do Not Know; 999= No Answer",""
"he_3_c","String","500","Recommended","How often in the past one month did you have to lie in bed for more than half a day because because of an emotional or psychological problem?","","998= Do Not Know; 999= No Answer",""
"he_4_c","Integer","","Recommended","During the past month, how much difficulty did you have in taking care of your household responsibilities because of an emotional or psychological problem?","0 :: 3;998;999","0= Not At All; 1= A Little; 2= Quite A Bit; 3= Extremely; 998= Do Not Know; 999= No Answer",""
"mntlhlth_1","String","100","Recommended","As you know, your doctor recently prescribed you an antidepressant medication for your symptoms of depression. How long ago did these symptoms start? (Write in and specify the time unit, e.g., days, weeks, months or years)","","N/A if not applicable",""
"mntlhlth_2","Integer","","Recommended","How old were you when you first had symptoms of depression? In years","","0 if not applicable",""
"mntlhlth_3","Integer","","Recommended","Have you started taking the antidepressant medication that you were recently prescribed?","0;1","0 = No; 1 = Yes",""
"mntlhlth_4","Integer","","Recommended","For how many days have you taken this antidepressant?","","Number of days",""
"mntlhlth_5","Integer","","Recommended","Have you received any psychological counseling or therapy for your current symptoms of depression?","0;1","0 = No; 1 = Yes",""
"mntlhlth_6","Integer","","Recommended","Before this antidepressant, have you ever taken an antidepressant medication for symptoms of depression?","0;1","0 = No; 1 = Yes",""
"mntlhlth_7_yrs","Integer","","Recommended","When was the last time that you took an antidepressant medication? - Number of Years","","",""
"mntlhlth_7_mths","Integer","","Recommended","When was the last time that you took an antidepressant medication? - Number of Months","","",""
"mntlhlth_8","Integer","","Recommended","How satisfied were you with that antidepressant?","1::5; -888","1 = Very satisfied; 2 = Satisfied; 3 = Neither satisfied nor dissatisfied; 4 = Dissatisfied; 5 = Very dissatisfied; -888 = Not applicable",""
"mntlhlth_9","Integer","","Recommended","In general would you say your physical health is:","1::5","1 = Excellent; 2 = Very Good; 3 = Good; 4 = Fair; 5 = Poor",""
"mntlhlth_10","Integer","","Recommended","In general would you say your mental health is:","1::5","1 = Excellent; 2 = Very Good; 3 = Good; 4 = Fair; 5 = Poor",""
"mntlhlth_11","Integer","","Recommended","How would you rate your overall life satisfaction and contentment during the past week?","1::5","1 = Very Good; 2 = Good; 3 = Fair; 4 = Poor; 5 = Very Poor",""
"mntlhlth_12","Integer","","Recommended","On a ten point scale, where 0 is not at all and 10 is extremely, to what extent have symptoms of depression disrupted your WORK in the last week?","0::10; -888","0 = Not at all; 10 = Extremely; -888 = N/A, Not working",""
"mntlhlth_13","Integer","","Recommended","On a ten point scale, where 0 is not at all and 10 is extremely, to what extent have symptoms of depression disrupted your SOCIAL LIFE OR LEISURE ACTIVITIES in the last week?","0::10","0 = Not at all; 10 = Extremely; -888 = Not applicable",""
"mntlhlth_14","Integer","","Recommended","On a ten point scale, where 0 is not at all and 10 is extremely, to what extent have symptoms of depression disrupted your FAMILY LIFE OR HOME RESPONSIBILITIES in the last week?","0::10","0 = Not at all; 10 = Extremely; -888 = Not applicable",""
"timepoint_label","String","50","Recommended","Timepoint/visit label","","e.g., Baseline, 6-Month Follow Up, Year 2; Morning, At Bedtime",""
"trtarm","String","200","Recommended","Treatment arm","","e.g., Control, Intervention, Experimental, Placebo",""
"mhhq6","Integer","","Recommended","Have/has you/your child been diagnosed with or treated for: Alcohol Use Disorder (drinking that was excessive, caused problems such as health issues or emotional difficulties, or interfered with relationships or other activities)","0;1","0=No; 1=Yes",""
"mhhq7","Integer","","Recommended","Have/has you/your child been diagnosed with or treated for: Substance Use Disorder (substance use that was excessive, caused problems such as health issues or emotional difficulties, or interfered with relationships or other activities)","0;1","0=No; 1=Yes",""
"mhhq7a","String","20","Recommended","Have/has you/your child been diagnosed with or treated for: Substance Use Disorder (substance use that was excessive, caused problems such as health issues or emotional difficulties, or interfered with relationships or other activities). If Yes, specify most problematic drug(s):","","",""
"mhhq8","Integer","","Recommended","Have/has you/your child been diagnosed with or treated for: Attention-Deficit/Hyperactivity Disorder (problems with inattention, hyperactivity, and/or impulsivity that started before age 12)","0;1","0=No; 1=Yes",""
"mhhq9","Integer","","Recommended","Have/has you/your child been diagnosed with or treated for: Conduct Disorder (significant behavior problems involving aggression and/or breaking rules, such as engaging in physical fights, bullying or threatening others, using weapons, physical cruelty to animals or people, intentional property destruction, breaking and entering, shoplifting, running away overnight, frequently skipping school)","0;1","0=No; 1=Yes",""
"mhhq10","Integer","","Recommended","Have/has you/your child been diagnosed with or treated for: Eating Disorder (anorexia nervosa, bulimia nervosa, binge-eating disorder; trying to keep from gaining weight or restricting food intake, fear of gaining weight, eating binges)","0;1","0=No; 1=Yes",""
"mhhq11","Integer","","Recommended","Have/has you/your child been diagnosed with or treated for: Generalized Anxiety Disorder (excessive worry about multiple things that is hard to control and is accompanied by symptoms including irritability, difficulty concentrating, muscle tension, trouble sleeping, restlessness, fatigue)","0;1","0=No; 1=Yes",""
"mhhq12","Integer","","Recommended","Have/has you/your child been diagnosed with or treated for: Autism Spectrum Disorder (problems with social communication and social interaction as well as restricted, repetitive interests, behavior, or activities; may have been diagnosed with Asperger Syndrome)","0;1","0=No; 1=Yes",""
"mhhq13","Integer","","Recommended","Have/has you/your child been diagnosed with or treated for: Learning Disorder (such as dyslexia or significant difficulties with math, reading, or writing; having an individualized education plan (IEP) or being in a special class to help with learning difficulties)","0;1","0=No; 1=Yes",""
"mhhq14","Integer","","Recommended","Have/has you/your child been diagnosed with or treated for: Posttraumatic Stress Disorder (Intrusive, distressing memories of the event, dreams about the event, flashbacks to the event, avoidance of reminders of the event, reenacting the event, trouble remembering parts of the event, guilt about the event, being jumpy or ''on alert,'' trouble sleeping)?","0;1","0=No; 1=Yes",""
"mmhq_who","Integer","","Recommended","Who is the Mental Health History Questionnaire being administered to?","1;2","1=Participant (>= 18 years old); 2=Legally authorized representative (participant < 18 years old);",""
"mhhq1","Integer","","Recommended","Have/has you/your child been diagnosed with or treated for: Agoraphobia (very afraid/avoidance of situations such as open spaces, closed spaces, crowds, being in line, being away from home alone; fear/avoidance must be due to concern about having panic or other symptoms and having difficulty escaping or getting help)","0;1","0=No; 1=Yes",""
