"ElementName","DataType","Size","Required","ElementDescription","ValueRange","Notes","Aliases"
"icd_19","Integer","","Recommended","Persistence - Not ratable under 6 months","1 :: 6","1 = No evidence of persistence. If success is not immediate the infant/child may leave the task, turn to another task, or cry. Observed on at least two occasions; 2 = Slight persistence. After encountering difficulty with an activity the infant/child continues to show interest for a short period of time (on at least one occasion); 3 = Moderately persistent. Infant/child maintains activity for a moderate amount of time or returns to task after encountering difficulty; 4 = Considerable evidence of persistence. Infant/child persists at a task for an extended period of time or frequently completes tasks; 5 = Characteristic. Infant/child demonstrates ability to maintain appropriate goal-directed behavior until completion of a task on most occasions; 6 = N.R.",""
"icd_20","Integer","","Recommended","lmpulsivity- Not ratable under 9 months","1 :: 6","1 = Characteristically low frustration tolerance. Infant/child becomes frantic over any frustration or delay; little or no control of impulses; 2 = Considerable intolerance of frustration; shows some capacity to be diverted and can wait only a short time to get whats/he wants; 3 = Moderate frustration tolerance, control over impulses, and/or capacity for delay of gratification of needs; 4 = Mild reaction to frustration or interference with desires. Usually tolerant of delay of gratification; 5 = No evidence of impulsivity. Characteristically appears to have high frustration tolerance; inhibits overt expressions of frustration; gives impression of great patience or resignation; 6 = N.R.",""
"icd_21","Integer","","Recommended","Self-Regulation/Organizational Capacities","1 :: 6","1 = Characteristically appears disengaged from contact with the environment or disorganized; unable to maintain or regain alertness, focus or stable mood states; 2 = Considerable difficulty regulating state focus. Some evidence of attempts to stabilize
mood (e.g. by rocking, sucking on fingers etc.) observed on 1 or 2 occasions; 3 = Moderate degree of difficulty maintaining self-regulation. Intense or prolonged response to distress observed on several occasions; some evidence of attempts to regulate mood/focus; 4 = Minimal difficulty. Infant/child is able to quiet self quickly and/or refocus on most occasions; 5 = Infant/child characteristically maintains interest in his/her environment and appears very resilient to stressful stimulation; maintains organized focus/approach; 6 = N.R.",""
"icd_22","Integer","","Recommended","Consolability/Soothability","1 :: 6","1 = Infant/child shows continuous signs of distress following persistent attempts at soothing; 2 = Infant/child continues to be distressed for longer than a few minutes after persistent efforts at soothing; 3 = Moderate amount of time and effort is required to soothe the infant/child. Fussiness or crying may resume briefly before infant/child quiets or is calmed; 4 = Slightly less time and/or effort than in #3 are required to sooth infant/child; crying and fussing lessen after brief efforts at soothing; 5 = Infant/child characteristically responds to parent's face or voice and is quickly and easily soothed with little additional soothing required in most instances. Infant/child remains content for at least several minutes; 6 = N.R. This item cannot be rated when infant/child shows no distress.",""
"icd_23","Integer","","Recommended","Focus on Parent's Emotional State - Not ratable under 12 months","1 :: 6","1 = Child characteristically displays caretaking behavior toward the parent. Child is extremely sensitive and responsive to parent's mood and emotional state; child's behavior reflects a constant focus on parent's needs. Concern interferes with the child's own activities or expression of needs; 2 = Child attends to parent's mood, needs on many occasions. Child's play or activity is often delayed or interrupted, but not constantly; 3 = Child attends to parent's mood, needs on several occasions; some interruption or delay in child's activity; child has some trouble expressing his/her own needs;  4 = Child is aware of parent's mood, state, or needs; responds and attends briefly; child can express his/her own needs or inner feeling state; 5 = Child may recognize parent's emotional state; may respond, but concern for parent does not interfere with child's activities or own expression of needs or inner feeling state; 6 = N.R.",""
"icd_24","Integer","","Recommended","Passivity/Lethargy","1 :: 6","1 = Extremely passive; inactive; hypotonic; lethargic. Characteristic; 2 = Very passive or inactive; 3 = Somewhat passive or inactive; 4 = Minimal or brief instances of passivity or inactivity; 5 = No evidence of passivity or lethargy; 6 = N.R.",""
"icd_25","Integer","","Recommended","Hyperactivity","1 :: 6","1 = Extremely overactive or hyperactive; 2 = Very active; 3 = Somewhat active; somewhat hyperactive; 4 = Brief instances of overactivity; 5 = No evidence of hyperactivity; 6 = N.R.",""
"icd_26","Integer","","Recommended","Visual Contact","1 :: 6","1 = No evidence of communication through visual contact; 2 = Infrequently seeks and/or maintains eye contact with parent; on one or two occasions; 3 = Moderate amount of visual communication. Looking, gazing, or eye-to-eye contact observed several occasions; three or four occasions; 4 = Considerable number of attempts to communicate visually; five or more; not characteristic; 5 = Characteristically seeks and/or maintains visual contact with parent; 6 = N.R.",""
"icd_27","Integer","","Recommended","Communicative Competence","1 :: 6","1 = No evidence of spontaneous or receptive communication by infant/child and/or communicative behavior delayed or inappropriate for infant/child's developmental level; 2 = Infrequent and/or age inappropriate receptive or expressive attempts to communicate; one or two instances; 3 = Moderately communicative; three or four instances. Infant/child is somewhat receptive to communications or parent. Not frequent or characteristic; 4 = Considerable use of gestures, vocalizations or words to communicate with parent; five or more instances in an age appropriate manner; 5 = Characteristically communicative. Infant/child is receptive to communication from parent and is extremely competent at communicating; 6 = N.R.",""
"icd_28","Integer","","Recommended","Readability","1 :: 6","1 = Extremely difficult to read; signals very unclear; 2 = Slightly readable; occasional understanding of infant/child's signal; 3 = Moderately clear signals from child; readable approximately half the time; 4 = Considerable clarity to infant/child's behavior; predominantly readable; 5 = Characteristically readable; this child has been easy to rate; 6 = N.R.",""
"icd_29","Integer","","Recommended","Frustrated; Angry; Hostile","1 :: 6","1 = Extreme anger; hostility; 2 = Marked frustration, irritability, anger, hostility; some modulation; 3 = Somewhat frustrated, irritable, angry, or hostile. Quality less intense; 4 = Slight or brief episode of frustration, irritability; anger or hostility. Pervasive quality of interaction without anger; hostility; irritability; 5 = No frustration, anger; hostility; irritability; 6 = N.R.",""
"icd_30","Integer","","Recommended","Flat; Empty; Constricted","1 :: 6","1 = Extremely flat; empty; constricted. Dyadic interaction characterized by low energy level; 2 = Predominantly flat; 3 = Somewhat flat; somewhat constricted; 4 = Slight flatness or constriction evident; 5 = No flatness, emptiness or constriction; 6 = N.R.",""
"icd_31","Integer","","Recommended","Tension; Anxiety","1 :: 6","1 = Extreme tension or anxiety; 2 = Considerable tension or anxiety; 3 = Somewhat tense or anxious; 4 = Slight tension and/or anxiety. 5 = No tension or anxiety; 6 = N.R.",""
"icd_32","Integer","","Recommended","Mutual Enthusiasm; Joyfulness; Enjoyment. Dyadic ""Joie de Vivre""","1 :: 6","1 = No shared enjoyment and/or enthusiasm; 2 = Slight shared enjoyment and/or enthusiasm; 3 = Moderate shared enjoyment and/or enthusiasm; 4 = Considerable shared enjoyment and/or enthusiasm. Not characteristic; 5 = Characteristically shared enjoyment and/or enthusiasm; 6 = N.R.",""
"icd_33","Integer","","Recommended","Joint Attention; Activity","1 :: 6","1 = No joint attention; 2 = Slight joint attention. (<35%); 3 = Moderate amount of joint attention; half of the time. (35-64%); 4 = Considerable joint attention. Not characteristic. (65-80%); 5 = Characteristically engaged in joint attention and activity the majority of the time. (>80%); 6 = N.R.",""
"icd_34","Integer","","Recommended","Reciprocity","1 :: 6","1 = None; unconnected; 2 = Rare instances of reciprocity; 3 = Some instances of reciprocity; 4 = Considerable reciprocity. Not characteristic; 5 = Characteristically reciprocal; 6 = N.R.",""
"icd_35","Integer","","Recommended","Organization/Regulation of Interactions","1 :: 6","1 = No evidence of organization, regulation, and pacing in the interaction; 2 = Minimal amount of organization, regulation, and pacing; 3 = Moderate amount of organization, regulation, and pacing; 4 = Considerable organization, regulation, and pacing present. Nol characteristic; 5 = Dyad is characteristically regulated, organized, and coordinated in pacing; 6 = N.R.",""
"icd_36","Integer","","Recommended","Goodness of Fit","1 :: 6","1 = Extremely poor fit between parent's and child's arousal, activity level, style of interactive behavior and affective state. Parent unable to adapt to child's temperament, state, behavioral style and/or developmental abilities; 2 = Considerably poor fit between parent's and child's arousal, activity level, style of interactive behavior and affective state. Parent makes only 1-2 attempts to adapt to child's temperament, state, behavioral style and/or developmental abilities; 3 = Moderate goodness of fit between parent's and child's arousal, activity level, style of
interactive behavior and affective state. Parent makes some attempts to adapt to child's temperament, state, behavioral style and/or developmental abilities; 4 = Considerable goodness of fit between parent's and child's arousal, activity level, style of interactive behavior and affective state. Parent able to adapt to child's temperament, state, behavioral style and/or developmental abilities on most occasions; 5 = Goodness of fit characteristically observed between parent's and child's arousal,
activity level, style of interactive behavior and affective state. Parent is characteristically able to adapt to child's temperament, state, behavioral style and/or developmental abilities; 6= N.R",""
