"ElementName","DataType","Size","Required","ElementDescription","ValueRange","Notes","Aliases"
"pdp077","Integer","","Recommended","Shows discomfort with loud or high-pitched noises (e.g., vacuum, blender, fire alarms)","0::4; 9","0 = Does not show behavior; 1 = Rarely shows behavior; 2 = Sometimes/Partially shows the behavior; 3 = Usually/Typically shows the behavior; 4 = Don't understand; 9 = Missing/Blank",""
"pdp078","Integer","","Recommended","Shows unusual discomfort when hearing certain songs or TV commercials, etc.","0::4; 9","0 = Does not show behavior; 1 = Rarely shows behavior; 2 = Sometimes/Partially shows the behavior; 3 = Usually/Typically shows the behavior; 4 = Don't understand; 9 = Missing/Blank",""
"pdp079","Integer","","Recommended","Is unusually angry or frightened when others cry or  scream","0::4; 9","0 = Does not show behavior; 1 = Rarely shows behavior; 2 = Sometimes/Partially shows the behavior; 3 = Usually/Typically shows the behavior; 4 = Don't understand; 9 = Missing/Blank",""
"pdp080","Integer","","Recommended","Is unusually startled by sudden noises","0::4; 9","0 = Does not show behavior; 1 = Rarely shows behavior; 2 = Sometimes/Partially shows the behavior; 3 = Usually/Typically shows the behavior; 4 = Don't understand; 9 = Missing/Blank",""
"pdp081","Integer","","Recommended","Unusually afraid of visiting new places or trying new activities","0::4; 9","0 = Does not show behavior; 1 = Rarely shows behavior; 2 = Sometimes/Partially shows the behavior; 3 = Usually/Typically shows the behavior; 4 = Don't understand; 9 = Missing/Blank",""
"pdp082","Integer","","Recommended","Unusually afraid of the dark","0::4; 9","0 = Does not show behavior; 1 = Rarely shows behavior; 2 = Sometimes/Partially shows the behavior; 3 = Usually/Typically shows the behavior; 4 = Don't understand; 9 = Missing/Blank",""
"pdp083","Integer","","Recommended","Unusually afraid of meeting new people, going to parties, etc.","0::4; 9","0 = Does not show behavior; 1 = Rarely shows behavior; 2 = Sometimes/Partially shows the behavior; 3 = Usually/Typically shows the behavior; 4 = Don't understand; 9 = Missing/Blank",""
"pdp084","Integer","","Recommended","Unusually afraid of masks, monsters, ghosts, etc.","0::4; 9","0 = Does not show behavior; 1 = Rarely shows behavior; 2 = Sometimes/Partially shows the behavior; 3 = Usually/Typically shows the behavior; 4 = Don't understand; 9 = Missing/Blank",""
"pdp085","Integer","","Recommended","Tries to or leaves room when with unfamiliar people or in unfamiliar situations","0::4; 9","0 = Does not show behavior; 1 = Rarely shows behavior; 2 = Sometimes/Partially shows the behavior; 3 = Usually/Typically shows the behavior; 4 = Don't understand; 9 = Missing/Blank",""
"pdp086","Integer","","Recommended","Retreats to corner or goes under table when with unfamiliar people or in unfamiliar situations","0::4; 9","0 = Does not show behavior; 1 = Rarely shows behavior; 2 = Sometimes/Partially shows the behavior; 3 = Usually/Typically shows the behavior; 4 = Don't understand; 9 = Missing/Blank",""
"pdp087","Integer","","Recommended","Turns eyes, head, or body away from others","0::4; 9","0 = Does not show behavior; 1 = Rarely shows behavior; 2 = Sometimes/Partially shows the behavior; 3 = Usually/Typically shows the behavior; 4 = Don't understand; 9 = Missing/Blank",""
"pdp088","Integer","","Recommended","Avoids groups or crowds","0::4; 9","0 = Does not show behavior; 1 = Rarely shows behavior; 2 = Sometimes/Partially shows the behavior; 3 = Usually/Typically shows the behavior; 4 = Don't understand; 9 = Missing/Blank",""
"pdp089","Integer","","Recommended","Hits self","0::4; 9","0 = Does not show behavior; 1 = Rarely shows behavior; 2 = Sometimes/Partially shows the behavior; 3 = Usually/Typically shows the behavior; 4 = Don't understand; 9 = Missing/Blank",""
"pdp090","Integer","","Recommended","Bangs head on smooth surfaces","0::4; 9","0 = Does not show behavior; 1 = Rarely shows behavior; 2 = Sometimes/Partially shows the behavior; 3 = Usually/Typically shows the behavior; 4 = Don't understand; 9 = Missing/Blank",""
"pdp091","Integer","","Recommended","Bites self","0::4; 9","0 = Does not show behavior; 1 = Rarely shows behavior; 2 = Sometimes/Partially shows the behavior; 3 = Usually/Typically shows the behavior; 4 = Don't understand; 9 = Missing/Blank",""
"pdp092","Integer","","Recommended","Scratches self","0::4; 9","0 = Does not show behavior; 1 = Rarely shows behavior; 2 = Sometimes/Partially shows the behavior; 3 = Usually/Typically shows the behavior; 4 = Don't understand; 9 = Missing/Blank",""
"pdp093","Integer","","Recommended","Becomes fearful, frightened, or panicky for no  reason","0::4; 9","0 = Does not show behavior; 1 = Rarely shows behavior; 2 = Sometimes/Partially shows the behavior; 3 = Usually/Typically shows the behavior; 4 = Don't understand; 9 = Missing/Blank",""
"pdp094","Integer","","Recommended","Cries for no reason","0::4; 9","0 = Does not show behavior; 1 = Rarely shows behavior; 2 = Sometimes/Partially shows the behavior; 3 = Usually/Typically shows the behavior; 4 = Don't understand; 9 = Missing/Blank",""
"pdp095","Integer","","Recommended","Angry for no reason","0::4; 9","0 = Does not show behavior; 1 = Rarely shows behavior; 2 = Sometimes/Partially shows the behavior; 3 = Usually/Typically shows the behavior; 4 = Don't understand; 9 = Missing/Blank",""
"pdp096","Integer","","Recommended","Moody, emotions change rapidly","0::4; 9","0 = Does not show behavior; 1 = Rarely shows behavior; 2 = Sometimes/Partially shows the behavior; 3 = Usually/Typically shows the behavior; 4 = Don't understand; 9 = Missing/Blank",""
"pdp097","Integer","","Recommended","Shouts or screams","0::4; 9","0 = Does not show behavior; 1 = Rarely shows behavior; 2 = Sometimes/Partially shows the behavior; 3 = Usually/Typically shows the behavior; 4 = Don't understand; 9 = Missing/Blank",""
"pdp098","Integer","","Recommended","Hits self or others or kicks others","0::4; 9","0 = Does not show behavior; 1 = Rarely shows behavior; 2 = Sometimes/Partially shows the behavior; 3 = Usually/Typically shows the behavior; 4 = Don't understand; 9 = Missing/Blank",""
"pdp099","Integer","","Recommended","Tantrums","0::4; 9","0 = Does not show behavior; 1 = Rarely shows behavior; 2 = Sometimes/Partially shows the behavior; 3 = Usually/Typically shows the behavior; 4 = Don't understand; 9 = Missing/Blank",""
"pdp100","Integer","","Recommended","Throws things, becomes destructive","0::4; 9","0 = Does not show behavior; 1 = Rarely shows behavior; 2 = Sometimes/Partially shows the behavior; 3 = Usually/Typically shows the behavior; 4 = Don't understand; 9 = Missing/Blank",""
"pdp101","Integer","","Recommended","Hits or kicks","0::4; 9","0 = Does not show behavior; 1 = Rarely shows behavior; 2 = Sometimes/Partially shows the behavior; 3 = Usually/Typically shows the behavior; 4 = Don't understand; 9 = Missing/Blank",""
"pdp102","Integer","","Recommended","Scratches or pulls hair","0::4; 9","0 = Does not show behavior; 1 = Rarely shows behavior; 2 = Sometimes/Partially shows the behavior; 3 = Usually/Typically shows the behavior; 4 = Don't understand; 9 = Missing/Blank",""
"pdp103","Integer","","Recommended","Bites","0::4; 9","0 = Does not show behavior; 1 = Rarely shows behavior; 2 = Sometimes/Partially shows the behavior; 3 = Usually/Typically shows the behavior; 4 = Don't understand; 9 = Missing/Blank",""
"pdp104","Integer","","Recommended","Throws object(s) at others","0::4; 9","0 = Does not show behavior; 1 = Rarely shows behavior; 2 = Sometimes/Partially shows the behavior; 3 = Usually/Typically shows the behavior; 4 = Don't understand; 9 = Missing/Blank",""
"pdp105","Integer","","Recommended","Cranky, irritable","0::4; 9","0 = Does not show behavior; 1 = Rarely shows behavior; 2 = Sometimes/Partially shows the behavior; 3 = Usually/Typically shows the behavior; 4 = Don't understand; 9 = Missing/Blank",""
"pdp106","Integer","","Recommended","Difficult to please, not easily satisfied","0::4; 9","0 = Does not show behavior; 1 = Rarely shows behavior; 2 = Sometimes/Partially shows the behavior; 3 = Usually/Typically shows the behavior; 4 = Don't understand; 9 = Missing/Blank",""
"pdp107","Integer","","Recommended","Takes a long time to calm down when upset","0::4; 9","0 = Does not show behavior; 1 = Rarely shows behavior; 2 = Sometimes/Partially shows the behavior; 3 = Usually/Typically shows the behavior; 4 = Don't understand; 9 = Missing/Blank",""
"pdp108","Integer","","Recommended","Easily frustrated","0::4; 9","0 = Does not show behavior; 1 = Rarely shows behavior; 2 = Sometimes/Partially shows the behavior; 3 = Usually/Typically shows the behavior; 4 = Don't understand; 9 = Missing/Blank",""
"pdp109","Integer","","Recommended","Pays attention to other's face when given instructions or when asked questions","0::4; 9","0 = Does not show behavior; 1 = Rarely shows behavior; 2 = Sometimes/Partially shows the behavior; 3 = Usually/Typically shows the behavior; 4 = Don't understand; 9 = Missing/Blank",""
"pdp110","Integer","","Recommended","Looks at other to seek feedback and/or praise","0::4; 9","0 = Does not show behavior; 1 = Rarely shows behavior; 2 = Sometimes/Partially shows the behavior; 3 = Usually/Typically shows the behavior; 4 = Don't understand; 9 = Missing/Blank",""
"pdp111","Integer","","Recommended","Looks when called or praised","0::4; 9","0 = Does not show behavior; 1 = Rarely shows behavior; 2 = Sometimes/Partially shows the behavior; 3 = Usually/Typically shows the behavior; 4 = Don't understand; 9 = Missing/Blank",""
"pdp112","Integer","","Recommended","Looks at others in order to share the experience with them when he/she completes a task successfully, when an unexpected or happy event occurs, etc.","0::4; 9","0 = Does not show behavior; 1 = Rarely shows behavior; 2 = Sometimes/Partially shows the behavior; 3 = Usually/Typically shows the behavior; 4 = Don't understand; 9 = Missing/Blank",""
"pdp113","Integer","","Recommended","Smiles when praised","0::4; 9","0 = Does not show behavior; 1 = Rarely shows behavior; 2 = Sometimes/Partially shows the behavior; 3 = Usually/Typically shows the behavior; 4 = Don't understand; 9 = Missing/Blank",""
"pdp114","Integer","","Recommended","Smiles when a familiar song is sung, when a familiar name is mentioned, when he/she sees a  familiar picture, etc.","0::4; 9","0 = Does not show behavior; 1 = Rarely shows behavior; 2 = Sometimes/Partially shows the behavior; 3 = Usually/Typically shows the behavior; 4 = Don't understand; 9 = Missing/Blank",""
"pdp115","Integer","","Recommended","Shows affection (e.g., hugs, kisses) toward caregivers, friends, etc.","0::4; 9","0 = Does not show behavior; 1 = Rarely shows behavior; 2 = Sometimes/Partially shows the behavior; 3 = Usually/Typically shows the behavior; 4 = Don't understand; 9 = Missing/Blank",""
"pdp116","Integer","","Recommended","Starts to smile in anticipation of teasing, tickling,  etc","0::4; 9","0 = Does not show behavior; 1 = Rarely shows behavior; 2 = Sometimes/Partially shows the behavior; 3 = Usually/Typically shows the behavior; 4 = Don't understand; 9 = Missing/Blank",""
"pdp117","Integer","","Recommended","Shows recognition of pictures of familiar people, animals, etc., by spontaneously pointing to or touching  the pictures when he/she sees them","0::4; 9","0 = Does not show behavior; 1 = Rarely shows behavior; 2 = Sometimes/Partially shows the behavior; 3 = Usually/Typically shows the behavior; 4 = Don't understand; 9 = Missing/Blank",""
"pdp118","Integer","","Recommended","Spontaneously nods yes and/or shakes head no correctly when asked questions","0::4; 9","0 = Does not show behavior; 1 = Rarely shows behavior; 2 = Sometimes/Partially shows the behavior; 3 = Usually/Typically shows the behavior; 4 = Don't understand; 9 = Missing/Blank",""
"pdp119","Integer","","Recommended","Moves arm(s)/hand(s) in beckoning motion to signal others to come to him/her","0::4; 9","0 = Does not show behavior; 1 = Rarely shows behavior; 2 = Sometimes/Partially shows the behavior; 3 = Usually/Typically shows the behavior; 4 = Don't understand; 9 = Missing/Blank",""
"pdp120","Integer","","Recommended","Gestures and looks back and forth to others in order to share the experience with them (e.g., sees  airplane and points at it while looking back to other and   then back to the airplane)","0::4; 9","0 = Does not show behavior; 1 = Rarely shows behavior; 2 = Sometimes/Partially shows the behavior; 3 = Usually/Typically shows the behavior; 4 = Don't understand; 9 = Missing/Blank",""
"pdp121","Integer","","Recommended","Completely stops inappropriate behavior for at least a day when warned or punished","0::4; 9","0 = Does not show behavior; 1 = Rarely shows behavior; 2 = Sometimes/Partially shows the behavior; 3 = Usually/Typically shows the behavior; 4 = Don't understand; 9 = Missing/Blank",""
"pdp122","Integer","","Recommended","Stops doing inappropriate behavior when sees significant others approach him/her","0::4; 9","0 = Does not show behavior; 1 = Rarely shows behavior; 2 = Sometimes/Partially shows the behavior; 3 = Usually/Typically shows the behavior; 4 = Don't understand; 9 = Missing/Blank",""
"pdp123","Integer","","Recommended","Avoids inappropriate behavior when significant others are around (e.g., behaves self when caregivers  are around but mayor may not misbehave when they  leave)","0::4; 9","0 = Does not show behavior; 1 = Rarely shows behavior; 2 = Sometimes/Partially shows the behavior; 3 = Usually/Typically shows the behavior; 4 = Don't understand; 9 = Missing/Blank",""
"pdp124","Integer","","Recommended","Avoids inappropriate behavior (i.e., behaves self) in public situations (e.g., stores, malls)","0::4; 9","0 = Does not show behavior; 1 = Rarely shows behavior; 2 = Sometimes/Partially shows the behavior; 3 = Usually/Typically shows the behavior; 4 = Don't understand; 9 = Missing/Blank",""
"pdp125","Integer","","Recommended","Selects his/her own toys to play with and allows other(s) to play along","0::4; 9","0 = Does not show behavior; 1 = Rarely shows behavior; 2 = Sometimes/Partially shows the behavior; 3 = Usually/Typically shows the behavior; 4 = Don't understand; 9 = Missing/Blank",""
"pdp126","Integer","","Recommended","Watches others and plays near them","0::4; 9","0 = Does not show behavior; 1 = Rarely shows behavior; 2 = Sometimes/Partially shows the behavior; 3 = Usually/Typically shows the behavior; 4 = Don't understand; 9 = Missing/Blank",""
"pdp127","Integer","","Recommended","Initiates (e.g., pulls, asks) simple social play with others","0::4; 9","0 = Does not show behavior; 1 = Rarely shows behavior; 2 = Sometimes/Partially shows the behavior; 3 = Usually/Typically shows the behavior; 4 = Don't understand; 9 = Missing/Blank",""
"pdp128","Integer","","Recommended","Engages in cooperative, helpful, turn-taking play where both partners work on a common goal or theme  together (e.g., putting 50-piece jigsaw puzzle together;  cooperative team board or card game)","0::4; 9","0 = Does not show behavior; 1 = Rarely shows behavior; 2 = Sometimes/Partially shows the behavior; 3 = Usually/Typically shows the behavior; 4 = Don't understand; 9 = Missing/Blank",""
"pdp129","Integer","","Recommended","Shows recognition of toy or picture representation of object or animal (e.g., makes sounds of animal or   object when sees picture of the same or real object,   pushes toy car back and forth)","0::4; 9","0 = Does not show behavior; 1 = Rarely shows behavior; 2 = Sometimes/Partially shows the behavior; 3 = Usually/Typically shows the behavior; 4 = Don't understand; 9 = Missing/Blank",""
"pdp130","Integer","","Recommended","Shows active awareness of toy representation of object or animal (e.g., makes sounds of animal and  makes toy animal move, makes car move and says  'beep' )","0::4; 9","0 = Does not show behavior; 1 = Rarely shows behavior; 2 = Sometimes/Partially shows the behavior; 3 = Usually/Typically shows the behavior; 4 = Don't understand; 9 = Missing/Blank",""
"pdp131","Integer","","Recommended","Shows more complex imaginative toy play (e.g., feeds doll, makes Superman'' toy fly)","0::4; 9","0 = Does not show behavior; 1 = Rarely shows behavior; 2 = Sometimes/Partially shows the behavior; 3 = Usually/Typically shows the behavior; 4 = Don't understand; 9 = Missing/Blank",""
"pdp132","Integer","","Recommended","Uses available material imaginatively for novel purposes (e.g., makes paper airplane and flies it)","0::4; 9","0 = Does not show behavior; 1 = Rarely shows behavior; 2 = Sometimes/Partially shows the behavior; 3 = Usually/Typically shows the behavior; 4 = Don't understand; 9 = Missing/Blank",""
"pdp133","Integer","","Recommended","Tries to physically or verbally comfort others when they are sad","0::4; 9","0 = Does not show behavior; 1 = Rarely shows behavior; 2 = Sometimes/Partially shows the behavior; 3 = Usually/Typically shows the behavior; 4 = Don't understand; 9 = Missing/Blank",""
"pdp134","Integer","","Recommended","Offers help when others are in need of assistance (e.g., tries to open doors for others when they cannot)","0::4; 9","0 = Does not show behavior; 1 = Rarely shows behavior; 2 = Sometimes/Partially shows the behavior; 3 = Usually/Typically shows the behavior; 4 = Don't understand; 9 = Missing/Blank",""
"pdp135","Integer","","Recommended","Offers help when others are sick (e.g., offers tissues to someone if he/she is sneezing or sniffling)","0::4; 9","0 = Does not show behavior; 1 = Rarely shows behavior; 2 = Sometimes/Partially shows the behavior; 3 = Usually/Typically shows the behavior; 4 = Don't understand; 9 = Missing/Blank",""
"pdp136","Integer","","Recommended","Offers help when others are physically uncomfortable (e.g., gets someone a coat if he/she is  cold, gets a bandage if someone is cut)","0::4; 9","0 = Does not show behavior; 1 = Rarely shows behavior; 2 = Sometimes/Partially shows the behavior; 3 = Usually/Typically shows the behavior; 4 = Don't understand; 9 = Missing/Blank",""
"pdp137","Integer","","Recommended","Seeks affection (e.g., hugs, kisses) from caregivers or siblings","0::4; 9","0 = Does not show behavior; 1 = Rarely shows behavior; 2 = Sometimes/Partially shows the behavior; 3 = Usually/Typically shows the behavior; 4 = Don't understand; 9 = Missing/Blank",""
"pdp138","Integer","","Recommended","Spontaneously and appropriately shows affection toward caregivers or siblings","0::4; 9","0 = Does not show behavior; 1 = Rarely shows behavior; 2 = Sometimes/Partially shows the behavior; 3 = Usually/Typically shows the behavior; 4 = Don't understand; 9 = Missing/Blank",""
"pdp139","Integer","","Recommended","Has a special friend, his/her age, that he/she enjoys being around","0::4; 9","0 = Does not show behavior; 1 = Rarely shows behavior; 2 = Sometimes/Partially shows the behavior; 3 = Usually/Typically shows the behavior; 4 = Don't understand; 9 = Missing/Blank",""
"pdp140","Integer","","Recommended","Initiates socially acceptable play or conversations with others at parties","0::4; 9","0 = Does not show behavior; 1 = Rarely shows behavior; 2 = Sometimes/Partially shows the behavior; 3 = Usually/Typically shows the behavior; 4 = Don't understand; 9 = Missing/Blank",""
"pdp141","Integer","","Recommended","Can imitate tongue clicking","0::4; 9","0 = Does not show behavior; 1 = Rarely shows behavior; 2 = Sometimes/Partially shows the behavior; 3 = Usually/Typically shows the behavior; 4 = Don't understand; 9 = Missing/Blank",""
"pdp142","Integer","","Recommended","Can imitate coughing","0::4; 9","0 = Does not show behavior; 1 = Rarely shows behavior; 2 = Sometimes/Partially shows the behavior; 3 = Usually/Typically shows the behavior; 4 = Don't understand; 9 = Missing/Blank",""
"pdp143","Integer","","Recommended","Can imitate sticking tongue out","0::4; 9","0 = Does not show behavior; 1 = Rarely shows behavior; 2 = Sometimes/Partially shows the behavior; 3 = Usually/Typically shows the behavior; 4 = Don't understand; 9 = Missing/Blank",""
"pdp144","Integer","","Recommended","Can imitate peek-a-boo","0::4; 9","0 = Does not show behavior; 1 = Rarely shows behavior; 2 = Sometimes/Partially shows the behavior; 3 = Usually/Typically shows the behavior; 4 = Don't understand; 9 = Missing/Blank",""
"pdp145","Integer","","Recommended","Can make 'ih' sounds as in 'pit'","0::4; 9","0 = Does not show behavior; 1 = Rarely shows behavior; 2 = Sometimes/Partially shows the behavior; 3 = Usually/Typically shows the behavior; 4 = Don't understand; 9 = Missing/Blank",""
"pdp146","Integer","","Recommended","Can make 'eh' sounds as in 'pet'","0::4; 9","0 = Does not show behavior; 1 = Rarely shows behavior; 2 = Sometimes/Partially shows the behavior; 3 = Usually/Typically shows the behavior; 4 = Don't understand; 9 = Missing/Blank",""
"pdp147","Integer","","Recommended","Can make 'aa' sounds as in 'pat'","0::4; 9","0 = Does not show behavior; 1 = Rarely shows behavior; 2 = Sometimes/Partially shows the behavior; 3 = Usually/Typically shows the behavior; 4 = Don't understand; 9 = Missing/Blank",""
"pdp148","Integer","","Recommended","Can make '00' sounds as in 'boot'","0::4; 9","0 = Does not show behavior; 1 = Rarely shows behavior; 2 = Sometimes/Partially shows the behavior; 3 = Usually/Typically shows the behavior; 4 = Don't understand; 9 = Missing/Blank",""
"pdp149","Integer","","Recommended","Can make 'p' sounds as in 'pill,' 'apple,' and 'up'","0::4; 9","0 = Does not show behavior; 1 = Rarely shows behavior; 2 = Sometimes/Partially shows the behavior; 3 = Usually/Typically shows the behavior; 4 = Don't understand; 9 = Missing/Blank",""
"pdp150","Integer","","Recommended","Can make 't' sounds as in 'talk,' 'attic,' and 'bat'","0::4; 9","0 = Does not show behavior; 1 = Rarely shows behavior; 2 = Sometimes/Partially shows the behavior; 3 = Usually/Typically shows the behavior; 4 = Don't understand; 9 = Missing/Blank",""
"pdp151","Integer","","Recommended","Can make 'ss' sounds as in 'song,' 'messy,' and 'yes'","0::4; 9","0 = Does not show behavior; 1 = Rarely shows behavior; 2 = Sometimes/Partially shows the behavior; 3 = Usually/Typically shows the behavior; 4 = Don't understand; 9 = Missing/Blank",""
"pdp152","Integer","","Recommended","Can make 'g' sounds as in 'go,' 'again,' and 'bag'","0::4; 9","0 = Does not show behavior; 1 = Rarely shows behavior; 2 = Sometimes/Partially shows the behavior; 3 = Usually/Typically shows the behavior; 4 = Don't understand; 9 = Missing/Blank",""
"pdp153","Integer","","Recommended","Can make 'ay' sounds as in 'bay'","0::4; 9","0 = Does not show behavior; 1 = Rarely shows behavior; 2 = Sometimes/Partially shows the behavior; 3 = Usually/Typically shows the behavior; 4 = Don't understand; 9 = Missing/Blank",""
"pdp154","Integer","","Recommended","Can make 'uy' sounds as in 'buy'","0::4; 9","0 = Does not show behavior; 1 = Rarely shows behavior; 2 = Sometimes/Partially shows the behavior; 3 = Usually/Typically shows the behavior; 4 = Don't understand; 9 = Missing/Blank",""
"pdp155","Integer","","Recommended","Can make 'ow' sounds as in 'bout'","0::4; 9","0 = Does not show behavior; 1 = Rarely shows behavior; 2 = Sometimes/Partially shows the behavior; 3 = Usually/Typically shows the behavior; 4 = Don't understand; 9 = Missing/Blank",""
"pdp156","Integer","","Recommended","Can make 'oa' sounds as in 'boat'","0::4; 9","0 = Does not show behavior; 1 = Rarely shows behavior; 2 = Sometimes/Partially shows the behavior; 3 = Usually/Typically shows the behavior; 4 = Don't understand; 9 = Missing/Blank",""
"pdp157","Integer","","Recommended","Uses negatives correctly (e.g., won't, can't, never)","0::4; 9","0 = Does not show behavior; 1 = Rarely shows behavior; 2 = Sometimes/Partially shows the behavior; 3 = Usually/Typically shows the behavior; 4 = Don't understand; 9 = Missing/Blank",""
"pdp158","Integer","","Recommended","Uses the future tense correctly (e.g., 'He will go to school')","0::4; 9","0 = Does not show behavior; 1 = Rarely shows behavior; 2 = Sometimes/Partially shows the behavior; 3 = Usually/Typically shows the behavior; 4 = Don't understand; 9 = Missing/Blank",""
"pdp159","Integer","","Recommended","Spontaneously asks 'how' and 'why' questions (e.g., 'How did he do?' 'Why is it hot?')","0::4; 9","0 = Does not show behavior; 1 = Rarely shows behavior; 2 = Sometimes/Partially shows the behavior; 3 = Usually/Typically shows the behavior; 4 = Don't understand; 9 = Missing/Blank",""
"pdp160","Integer","","Recommended","Spontaneously uses sentences with the verb 'to have' (e.g., 'I have already eaten that.')","0::4; 9","0 = Does not show behavior; 1 = Rarely shows behavior; 2 = Sometimes/Partially shows the behavior; 3 = Usually/Typically shows the behavior; 4 = Don't understand; 9 = Missing/Blank",""
"pdp161","Integer","","Recommended","Uses past tense rule for irregular verbs correctly (e.g., 'I ran,' 'He sat,' 'It flew')","0::4; 9","0 = Does not show behavior; 1 = Rarely shows behavior; 2 = Sometimes/Partially shows the behavior; 3 = Usually/Typically shows the behavior; 4 = Don't understand; 9 = Missing/Blank",""
"pdp162","Integer","","Recommended","Uses 's.' in the third person singular (e.g., 'He goes. to school.')","0::4; 9","0 = Does not show behavior; 1 = Rarely shows behavior; 2 = Sometimes/Partially shows the behavior; 3 = Usually/Typically shows the behavior; 4 = Don't understand; 9 = Missing/Blank",""
"pdp163","Integer","","Recommended","Uses the regular past tense 'ed' rule correctly (e.g., 'He pushed')","0::4; 9","0 = Does not show behavior; 1 = Rarely shows behavior; 2 = Sometimes/Partially shows the behavior; 3 = Usually/Typically shows the behavior; 4 = Don't understand; 9 = Missing/Blank",""
