"ElementName","DataType","Size","Required","ElementDescription","ValueRange","Notes","Aliases"
"subjectkey","GUID","","Required","The NDAR Global Unique Identifier (GUID) for research subject","NDAR*","",""
"src_subject_id","String","45","Required","Subject ID how it's defined in lab/project","","",""
"interview_date","Date","","Required","Date on which the interview/genetic test/sampling/imaging/biospecimen was completed. MM/DD/YYYY","","","pdpdate"
"interview_age","Integer","","Required","Age in months at the time of the interview/test/sampling/imaging.","0::1440","Age is rounded to chronological month. If the research participant is 15-days-old at time of interview, the appropriate value would be 0 months. If the participant is 16-days-old, the value would be 1 month.","pdpagem"
"sex","String","20","Required","Sex of subject at birth","M;F; O; NR","M = Male; F = Female; O=Other; NR = Not reported","gender,pdpsex"
"pdprat","Integer","","Recommended","PDDBI Respondent","1::4","1 = Mother; 2 = Father; 3 = Other primary caregiver; 4 = Other",""
"pdprato","String","50","Recommended","(specify if 3 or 4)","","",""
"pdp001","Integer","","Recommended","Stares at or looks out of sides of eyes at his/her own image in mirror","0::4; 9","0 = Does not show behavior; 1 = Rarely shows behavior; 2 = Sometimes/Partially shows the behavior; 3 = Usually/Typically shows the behavior; 4 = Don't understand; 9 = Missing/Blank",""
"pdp002","Integer","","Recommended","Stares at or looks out of sides of eyes at objects (e.g., toys, strings)","0::4; 9","0 = Does not show behavior; 1 = Rarely shows behavior; 2 = Sometimes/Partially shows the behavior; 3 = Usually/Typically shows the behavior; 4 = Don't understand; 9 = Missing/Blank",""
"pdp003","Integer","","Recommended","Stares at or looks out of sides of eyes at his/her fingers or hands","0::4; 9","0 = Does not show behavior; 1 = Rarely shows behavior; 2 = Sometimes/Partially shows the behavior; 3 = Usually/Typically shows the behavior; 4 = Don't understand; 9 = Missing/Blank",""
"pdp004","Integer","","Recommended","Stares at or looks out of sides of eyes at lights or shiny objects","0::4; 9","0 = Does not show behavior; 1 = Rarely shows behavior; 2 = Sometimes/Partially shows the behavior; 3 = Usually/Typically shows the behavior; 4 = Don't understand; 9 = Missing/Blank",""
"pdp005","Integer","","Recommended","Licks or mouths objects","0::4; 9","0 = Does not show behavior; 1 = Rarely shows behavior; 2 = Sometimes/Partially shows the behavior; 3 = Usually/Typically shows the behavior; 4 = Don't understand; 9 = Missing/Blank",""
"pdp006","Integer","","Recommended","Licks or mouths hands","0::4; 9","0 = Does not show behavior; 1 = Rarely shows behavior; 2 = Sometimes/Partially shows the behavior; 3 = Usually/Typically shows the behavior; 4 = Don't understand; 9 = Missing/Blank",""
"pdp007","Integer","","Recommended","Chews on objects","0::4; 9","0 = Does not show behavior; 1 = Rarely shows behavior; 2 = Sometimes/Partially shows the behavior; 3 = Usually/Typically shows the behavior; 4 = Don't understand; 9 = Missing/Blank",""
"pdp008","Integer","","Recommended","Eats (swallows) inedible (non-food) objects (e.g., dirt, paper, plastic)","0::4; 9","0 = Does not show behavior; 1 = Rarely shows behavior; 2 = Sometimes/Partially shows the behavior; 3 = Usually/Typically shows the behavior; 4 = Don't understand; 9 = Missing/Blank",""
"pdp009","Integer","","Recommended","Rubs or taps own face or arms repetitively","0::4; 9","0 = Does not show behavior; 1 = Rarely shows behavior; 2 = Sometimes/Partially shows the behavior; 3 = Usually/Typically shows the behavior; 4 = Don't understand; 9 = Missing/Blank",""
"pdp010","Integer","","Recommended","Rubs or taps own torso (i.e., stomach, chest) or legs repetitively","0::4; 9","0 = Does not show behavior; 1 = Rarely shows behavior; 2 = Sometimes/Partially shows the behavior; 3 = Usually/Typically shows the behavior; 4 = Don't understand; 9 = Missing/Blank",""
"pdp011","Integer","","Recommended","Rubs or taps rough objects (e.g., sandpaper, unshaved faces) repetitively","0::4; 9","0 = Does not show behavior; 1 = Rarely shows behavior; 2 = Sometimes/Partially shows the behavior; 3 = Usually/Typically shows the behavior; 4 = Don't understand; 9 = Missing/Blank",""
"pdp012","Integer","","Recommended","Rubs liquid-like substances (e.g., water, saliva) repetitively","0::4; 9","0 = Does not show behavior; 1 = Rarely shows behavior; 2 = Sometimes/Partially shows the behavior; 3 = Usually/Typically shows the behavior; 4 = Don't understand; 9 = Missing/Blank",""
"pdp013","Integer","","Recommended","Flaps hands up and down","0::4; 9","0 = Does not show behavior; 1 = Rarely shows behavior; 2 = Sometimes/Partially shows the behavior; 3 = Usually/Typically shows the behavior; 4 = Don't understand; 9 = Missing/Blank",""
"pdp014","Integer","","Recommended","Makes odd or unusual finger movements (e.g., flicks fingers)","0::4; 9","0 = Does not show behavior; 1 = Rarely shows behavior; 2 = Sometimes/Partially shows the behavior; 3 = Usually/Typically shows the behavior; 4 = Don't understand; 9 = Missing/Blank",""
"pdp015","Integer","","Recommended","Holds fingers, hands, or arms in odd or unusual postures (e.g., spreads fingers apart, holds hand bent   at the wrist, holds arms out to the side)","0::4; 9","0 = Does not show behavior; 1 = Rarely shows behavior; 2 = Sometimes/Partially shows the behavior; 3 = Usually/Typically shows the behavior; 4 = Don't understand; 9 = Missing/Blank",""
"pdp016","Integer","","Recommended","Jumps repetitively","0::4; 9","0 = Does not show behavior; 1 = Rarely shows behavior; 2 = Sometimes/Partially shows the behavior; 3 = Usually/Typically shows the behavior; 4 = Don't understand; 9 = Missing/Blank",""
"pdp017","Integer","","Recommended","Repetitively twiddles or bangs objects or flaps objects back and forth","0::4; 9","0 = Does not show behavior; 1 = Rarely shows behavior; 2 = Sometimes/Partially shows the behavior; 3 = Usually/Typically shows the behavior; 4 = Don't understand; 9 = Missing/Blank",""
"pdp018","Integer","","Recommended","Spins objects (e.g., wheels of toy cars, strings) in a repetitive manner","0::4; 9","0 = Does not show behavior; 1 = Rarely shows behavior; 2 = Sometimes/Partially shows the behavior; 3 = Usually/Typically shows the behavior; 4 = Don't understand; 9 = Missing/Blank",""
"pdp019","Integer","","Recommended","Throws objects around, rips or tears paper or other material","0::4; 9","0 = Does not show behavior; 1 = Rarely shows behavior; 2 = Sometimes/Partially shows the behavior; 3 = Usually/Typically shows the behavior; 4 = Don't understand; 9 = Missing/Blank",""
"pdp020","Integer","","Recommended","Repetitively moves objects back and forth (e.g., turns pages back and forth, opens and closes doors,  turns lights on and off)","0::4; 9","0 = Does not show behavior; 1 = Rarely shows behavior; 2 = Sometimes/Partially shows the behavior; 3 = Usually/Typically shows the behavior; 4 = Don't understand; 9 = Missing/Blank",""
"pdp021","Integer","","Recommended","Tries to move furniture back to its original location when it is moved by others","0::4; 9","0 = Does not show behavior; 1 = Rarely shows behavior; 2 = Sometimes/Partially shows the behavior; 3 = Usually/Typically shows the behavior; 4 = Don't understand; 9 = Missing/Blank",""
"pdp022","Integer","","Recommended","Moves objects back to their original locations when they are moved by others (e.g., salt and pepper  shakers, pictures, toys, doors, window shades)","0::4; 9","0 = Does not show behavior; 1 = Rarely shows behavior; 2 = Sometimes/Partially shows the behavior; 3 = Usually/Typically shows the behavior; 4 = Don't understand; 9 = Missing/Blank",""
"pdp023","Integer","","Recommended","Insists that certain room lights stay on or stay off at inappropriate times","0::4; 9","0 = Does not show behavior; 1 = Rarely shows behavior; 2 = Sometimes/Partially shows the behavior; 3 = Usually/Typically shows the behavior; 4 = Don't understand; 9 = Missing/Blank",""
"pdp024","Integer","","Recommended","Inappropriately refuses to eat or drink foods that are the 'wrong' color, appearance, or brand Resistance   to Change in Schedules/Routines","0::4; 9","0 = Does not show behavior; 1 = Rarely shows behavior; 2 = Sometimes/Partially shows the behavior; 3 = Usually/Typically shows the behavior; 4 = Don't understand; 9 = Missing/Blank",""
"pdp025","Integer","","Recommended","Becomes upset when things don't occur at their usual times (e.g., buses, trains, meals)","0::4; 9","0 = Does not show behavior; 1 = Rarely shows behavior; 2 = Sometimes/Partially shows the behavior; 3 = Usually/Typically shows the behavior; 4 = Don't understand; 9 = Missing/Blank",""
"pdp026","Integer","","Recommended","Resists changing from one activity to another when requested to do so by familiar people","0::4; 9","0 = Does not show behavior; 1 = Rarely shows behavior; 2 = Sometimes/Partially shows the behavior; 3 = Usually/Typically shows the behavior; 4 = Don't understand; 9 = Missing/Blank",""
"pdp027","Integer","","Recommended","Becomes upset when own schedule or order of the routine is changed (e.g., time when going to school is  changed, when vacations interrupt schedule, when  time going to sleep is changed)","0::4; 9","0 = Does not show behavior; 1 = Rarely shows behavior; 2 = Sometimes/Partially shows the behavior; 3 = Usually/Typically shows the behavior; 4 = Don't understand; 9 = Missing/Blank",""
"pdp028","Integer","","Recommended","Dislikes surprises, feels uncomfortable trying new activities, or has difficulty adjusting to changes in   routine at home, school, or work","0::4; 9","0 = Does not show behavior; 1 = Rarely shows behavior; 2 = Sometimes/Partially shows the behavior; 3 = Usually/Typically shows the behavior; 4 = Don't understand; 9 = Missing/Blank",""
"pdp029","Integer","","Recommended","Inappropriately needs to carry or hold on to objects (e.g., toys, paper clips, strings)","0::4; 9","0 = Does not show behavior; 1 = Rarely shows behavior; 2 = Sometimes/Partially shows the behavior; 3 = Usually/Typically shows the behavior; 4 = Don't understand; 9 = Missing/Blank",""
"pdp030","Integer","","Recommended","Insists on taking the same route from one place to another or taking the same route from one part of a room to another part of the same room","0::4; 9","0 = Does not show behavior; 1 = Rarely shows behavior; 2 = Sometimes/Partially shows the behavior; 3 = Usually/Typically shows the behavior; 4 = Don't understand; 9 = Missing/Blank",""
"pdp031","Integer","","Recommended","Resists changing own location in room or wants others to stay in some fixed place","0::4; 9","0 = Does not show behavior; 1 = Rarely shows behavior; 2 = Sometimes/Partially shows the behavior; 3 = Usually/Typically shows the behavior; 4 = Don't understand; 9 = Missing/Blank",""
"pdp032","Integer","","Recommended","Insists that others say something over and over or insists that others say a certain word or phrase or  insists on listening to the same song over and over or must smell, mouth, touch, or tap some","0::4; 9","0 = Does not show behavior; 1 = Rarely shows behavior; 2 = Sometimes/Partially shows the behavior; 3 = Usually/Typically shows the behavior; 4 = Don't understand; 9 = Missing/Blank",""
"pdp033","Integer","","Recommended","Greets strangers in odd or unusual ways for his/her age (e.g., by asking repetitive questions, asking  questions on idiosyncratic topics that would be unknown to the stranger, inappropriately asking","0::4; 9","0 = Does not show behavior; 1 = Rarely shows behavior; 2 = Sometimes/Partially shows the behavior; 3 = Usually/Typically shows the behavior; 4 = Don't understand; 9 = Missing/Blank",""
"pdp034","Integer","","Recommended","Stands too closely to others when talking to them, forcing others to back away","0::4; 9","0 = Does not show behavior; 1 = Rarely shows behavior; 2 = Sometimes/Partially shows the behavior; 3 = Usually/Typically shows the behavior; 4 = Don't understand; 9 = Missing/Blank",""
"pdp035","Integer","","Recommended","Stares at others for too long a time when talking, making others uncomfortable","0::4; 9","0 = Does not show behavior; 1 = Rarely shows behavior; 2 = Sometimes/Partially shows the behavior; 3 = Usually/Typically shows the behavior; 4 = Don't understand; 9 = Missing/Blank",""
"pdp036","Integer","","Recommended","Approaches others inappropriately (e.g., touches them inappropriately, makes obscene comments)","0::4; 9","0 = Does not show behavior; 1 = Rarely shows behavior; 2 = Sometimes/Partially shows the behavior; 3 = Usually/Typically shows the behavior; 4 = Don't understand; 9 = Missing/Blank",""
"pdp037","Integer","","Recommended","Is overly serious in social situations; doesn't understand the humor in situations that others his/her  age would consider funny","0::4; 9","0 = Does not show behavior; 1 = Rarely shows behavior; 2 = Sometimes/Partially shows the behavior; 3 = Usually/Typically shows the behavior; 4 = Don't understand; 9 = Missing/Blank",""
"pdp038","Integer","","Recommended","Performs private actions in front of others, that others his/her age would consider inappropriate (e.g.,  picking nose)","0::4; 9","0 = Does not show behavior; 1 = Rarely shows behavior; 2 = Sometimes/Partially shows the behavior; 3 = Usually/Typically shows the behavior; 4 = Don't understand; 9 = Missing/Blank",""
"pdp039","Integer","","Recommended","Has problems understanding the need to be polite (e.g., the need to apologize) more than others his/her   age or has problems understanding social  age or has problems understanding social  relationships (e.g., boyfriend, girlfriend, marriage","0::4; 9","0 = Does not show behavior; 1 = Rarely shows behavior; 2 = Sometimes/Partially shows the behavior; 3 = Usually/Typically shows the behavior; 4 = Don't understand; 9 = Missing/Blank",""
"pdp040","Integer","","Recommended","Laughs or smiles for no apparent reason or laughs or smiles at the wrong time (e.g., when others are   crying)","0::4; 9","0 = Does not show behavior; 1 = Rarely shows behavior; 2 = Sometimes/Partially shows the behavior; 3 = Usually/Typically shows the behavior; 4 = Don't understand; 9 = Missing/Blank",""
"pdp041","Integer","","Recommended","Ignores the social approaches of people his/her  own age","0::4; 9","0 = Does not show behavior; 1 = Rarely shows behavior; 2 = Sometimes/Partially shows the behavior; 3 = Usually/Typically shows the behavior; 4 = Don't understand; 9 = Missing/Blank",""
"pdp042","Integer","","Recommended","Is inappropriately abrupt and dismissive of others (e.g., cuts off conversations abruptly or walks away,  showing little concern for how these actions affect others)","0::4; 9","0 = Does not show behavior; 1 = Rarely shows behavior; 2 = Sometimes/Partially shows the behavior; 3 = Usually/Typically shows the behavior; 4 = Don't understand; 9 = Missing/Blank",""
"pdp043","Integer","","Recommended","Actively avoids (e,g., runs away, turns away) other people who are his/her age when approached by them","0::4; 9","0 = Does not show behavior; 1 = Rarely shows behavior; 2 = Sometimes/Partially shows the behavior; 3 = Usually/Typically shows the behavior; 4 = Don't understand; 9 = Missing/Blank",""
"pdp044","Integer","","Recommended","Says inappropriate things when approached by others (e,g., asks personal questions, makes   embarrassing comments)","0::4; 9","0 = Does not show behavior; 1 = Rarely shows behavior; 2 = Sometimes/Partially shows the behavior; 3 = Usually/Typically shows the behavior; 4 = Don't understand; 9 = Missing/Blank",""
"pdp045","Integer","","Recommended","Uses a questioning tone of voice when saying things that aren't questions","0::4; 9","0 = Does not show behavior; 1 = Rarely shows behavior; 2 = Sometimes/Partially shows the behavior; 3 = Usually/Typically shows the behavior; 4 = Don't understand; 9 = Missing/Blank",""
"pdp046","Integer","","Recommended","Puts an unusual stress on words when speaking (not due to regional accent)","0::4; 9","0 = Does not show behavior; 1 = Rarely shows behavior; 2 = Sometimes/Partially shows the behavior; 3 = Usually/Typically shows the behavior; 4 = Don't understand; 9 = Missing/Blank",""
"pdp047","Integer","","Recommended","Speaks too loudly, causing others to tell himlher to speak quietly","0::4; 9","0 = Does not show behavior; 1 = Rarely shows behavior; 2 = Sometimes/Partially shows the behavior; 3 = Usually/Typically shows the behavior; 4 = Don't understand; 9 = Missing/Blank",""
"pdp048","Integer","","Recommended","Speaks too softly, causing others to tell him/her to speak louder","0::4; 9","0 = Does not show behavior; 1 = Rarely shows behavior; 2 = Sometimes/Partially shows the behavior; 3 = Usually/Typically shows the behavior; 4 = Don't understand; 9 = Missing/Blank",""
"pdp049","Integer","","Recommended","Has difficulty understanding variations in sentence structure for a given sentence topic (e.g., doesn't   answer when asked 'Can you tell me your name?' but answers when asked 'What's your name?'","0::4; 9","0 = Does not show behavior; 1 = Rarely shows behavior; 2 = Sometimes/Partially shows the behavior; 3 = Usually/Typically shows the behavior; 4 = Don't understand; 9 = Missing/Blank",""
"pdp050","Integer","","Recommended","Echoes request of other meaninglessly (like a parrot)","0::4; 9","0 = Does not show behavior; 1 = Rarely shows behavior; 2 = Sometimes/Partially shows the behavior; 3 = Usually/Typically shows the behavior; 4 = Don't understand; 9 = Missing/Blank",""
"pdp051","Integer","","Recommended","Shows understanding by repeating all or part of a question and then performing an action (e.g., when  asked 'Do you want to eat?' says 'Do you want to eat'   or 'Eat' or 'Want to eat' and then gets","0::4; 9","0 = Does not show behavior; 1 = Rarely shows behavior; 2 = Sometimes/Partially shows the behavior; 3 = Usually/Typically shows the behavior; 4 = Don't understand; 9 = Missing/Blank",""
"pdp052","Integer","","Recommended","Says a word, phrase, or sentence that is a reaction to part of a sentence said to him/her, but has no  relation to the sentence topic (e.g., parent asks where ball is and he/she says 'Ball is blue'","0::4; 9","0 = Does not show behavior; 1 = Rarely shows behavior; 2 = Sometimes/Partially shows the behavior; 3 = Usually/Typically shows the behavior; 4 = Don't understand; 9 = Missing/Blank",""
"pdp053","Integer","","Recommended","Perseverates (i.e., repeats over and over) on words or phrases and is insensitive to the reactions or   comments of others","0::4; 9","0 = Does not show behavior; 1 = Rarely shows behavior; 2 = Sometimes/Partially shows the behavior; 3 = Usually/Typically shows the behavior; 4 = Don't understand; 9 = Missing/Blank",""
"pdp054","Integer","","Recommended","Perseverates (i.e., repeats over and over) on topic or theme and is insensitive to the reactions or  comments of others (e.g., insists on talking about train schedules, game shows, even when partne","0::4; 9","0 = Does not show behavior; 1 = Rarely shows behavior; 2 = Sometimes/Partially shows the behavior; 3 = Usually/Typically shows the behavior; 4 = Don't understand; 9 = Missing/Blank",""
"pdp055","Integer","","Recommended","Starts to talk to himself /herse1f during a conversation with others about a given topic","0::4; 9","0 = Does not show behavior; 1 = Rarely shows behavior; 2 = Sometimes/Partially shows the behavior; 3 = Usually/Typically shows the behavior; 4 = Don't understand; 9 = Missing/Blank",""
"pdp056","Integer","","Recommended","Talks about topics and assumes that his/her conversational partner understands what he/she is   talking about (e.g., talks about TV programs or videos  to strangers and assumes that the stranger know","0::4; 9","0 = Does not show behavior; 1 = Rarely shows behavior; 2 = Sometimes/Partially shows the behavior; 3 = Usually/Typically shows the behavior; 4 = Don't understand; 9 = Missing/Blank",""
"pdp057","Integer","","Recommended","Restless","0::4; 9","0 = Does not show behavior; 1 = Rarely shows behavior; 2 = Sometimes/Partially shows the behavior; 3 = Usually/Typically shows the behavior; 4 = Don't understand; 9 = Missing/Blank",""
"pdp058","Integer","","Recommended","Fidgets","0::4; 9","0 = Does not show behavior; 1 = Rarely shows behavior; 2 = Sometimes/Partially shows the behavior; 3 = Usually/Typically shows the behavior; 4 = Don't understand; 9 = Missing/Blank",""
"pdp059","Integer","","Recommended","Climbs on furniture","0::4; 9","0 = Does not show behavior; 1 = Rarely shows behavior; 2 = Sometimes/Partially shows the behavior; 3 = Usually/Typically shows the behavior; 4 = Don't understand; 9 = Missing/Blank",""
"pdp060","Integer","","Recommended","Wanders around room","0::4; 9","0 = Does not show behavior; 1 = Rarely shows behavior; 2 = Sometimes/Partially shows the behavior; 3 = Usually/Typically shows the behavior; 4 = Don't understand; 9 = Missing/Blank",""
"pdp061","Integer","","Recommended","Restricted range (e.g., problems showing happiness, sadness, fear, guilt, disgust) and/or   reduced intensity of emotions (i.e., doesn't react as strongly as most others would)","0::4; 9","0 = Does not show behavior; 1 = Rarely shows behavior; 2 = Sometimes/Partially shows the behavior; 3 = Usually/Typically shows the behavior; 4 = Don't understand; 9 = Missing/Blank",""
"pdp062","Integer","","Recommended","Stares into space","0::4; 9","0 = Does not show behavior; 1 = Rarely shows behavior; 2 = Sometimes/Partially shows the behavior; 3 = Usually/Typically shows the behavior; 4 = Don't understand; 9 = Missing/Blank",""
"pdp063","Integer","","Recommended","Fails to respond to requests, name, or touch","0::4; 9","0 = Does not show behavior; 1 = Rarely shows behavior; 2 = Sometimes/Partially shows the behavior; 3 = Usually/Typically shows the behavior; 4 = Don't understand; 9 = Missing/Blank",""
"pdp064","Integer","","Recommended","Requires physical or verbal prompts to respond to requests that he/she knows how to do","0::4; 9","0 = Does not show behavior; 1 = Rarely shows behavior; 2 = Sometimes/Partially shows the behavior; 3 = Usually/Typically shows the behavior; 4 = Don't understand; 9 = Missing/Blank",""
"pdp065","Integer","","Recommended","Wants to stay up, has difficulty falling asleep","0::4; 9","0 = Does not show behavior; 1 = Rarely shows behavior; 2 = Sometimes/Partially shows the behavior; 3 = Usually/Typically shows the behavior; 4 = Don't understand; 9 = Missing/Blank",""
"pdp066","Integer","","Recommended","Awakens one or more times at night with difficulty in falling back to sleep","0::4; 9","0 = Does not show behavior; 1 = Rarely shows behavior; 2 = Sometimes/Partially shows the behavior; 3 = Usually/Typically shows the behavior; 4 = Don't understand; 9 = Missing/Blank",""
"pdp067","Integer","","Recommended","Goes to sleep at appropriate time but awakens unusually early and stays awake the rest of the day","0::4; 9","0 = Does not show behavior; 1 = Rarely shows behavior; 2 = Sometimes/Partially shows the behavior; 3 = Usually/Typically shows the behavior; 4 = Don't understand; 9 = Missing/Blank",""
"pdp068","Integer","","Recommended","Goes to sleep later than others in family and has difficulty awakening morning","0::4; 9","0 = Does not show behavior; 1 = Rarely shows behavior; 2 = Sometimes/Partially shows the behavior; 3 = Usually/Typically shows the behavior; 4 = Don't understand; 9 = Missing/Blank",""
"pdp069","Integer","","Recommended","Pouts","0::4; 9","0 = Does not show behavior; 1 = Rarely shows behavior; 2 = Sometimes/Partially shows the behavior; 3 = Usually/Typically shows the behavior; 4 = Don't understand; 9 = Missing/Blank",""
"pdp070","Integer","","Recommended","Looks sad","0::4; 9","0 = Does not show behavior; 1 = Rarely shows behavior; 2 = Sometimes/Partially shows the behavior; 3 = Usually/Typically shows the behavior; 4 = Don't understand; 9 = Missing/Blank",""
"pdp071","Integer","","Recommended","Whimpers","0::4; 9","0 = Does not show behavior; 1 = Rarely shows behavior; 2 = Sometimes/Partially shows the behavior; 3 = Usually/Typically shows the behavior; 4 = Don't understand; 9 = Missing/Blank",""
"pdp072","Integer","","Recommended","Looks depressed (e.g., mopes around, seems despondent) Anxiousness When Away From Caregiver, Other Significant Figure, or in New Situation","0::4; 9","0 = Does not show behavior; 1 = Rarely shows behavior; 2 = Sometimes/Partially shows the behavior; 3 = Usually/Typically shows the behavior; 4 = Don't understand; 9 = Missing/Blank",""
"pdp073","Integer","","Recommended","Seems unusually vigilant (e.g., overly alert; scanning room, doors, windows) as if he/she is  anxiously looking to see if his/her caregiver is coming back","0::4; 9","0 = Does not show behavior; 1 = Rarely shows behavior; 2 = Sometimes/Partially shows the behavior; 3 = Usually/Typically shows the behavior; 4 = Don't understand; 9 = Missing/Blank",""
"pdp074","Integer","","Recommended","Looks concerned or worried","0::4; 9","0 = Does not show behavior; 1 = Rarely shows behavior; 2 = Sometimes/Partially shows the behavior; 3 = Usually/Typically shows the behavior; 4 = Don't understand; 9 = Missing/Blank",""
"pdp075","Integer","","Recommended","Seems anxious, jumpy, or overly aroused (e.g., can't stay still)","0::4; 9","0 = Does not show behavior; 1 = Rarely shows behavior; 2 = Sometimes/Partially shows the behavior; 3 = Usually/Typically shows the behavior; 4 = Don't understand; 9 = Missing/Blank",""
"pdp076","Integer","","Recommended","Cowers, hides, or clings to others","0::4; 9","0 = Does not show behavior; 1 = Rarely shows behavior; 2 = Sometimes/Partially shows the behavior; 3 = Usually/Typically shows the behavior; 4 = Don't understand; 9 = Missing/Blank",""
