"ElementName","DataType","Size","Required","ElementDescription","ValueRange","Notes","Aliases"
"subjectkey","GUID","","Required","The NDAR Global Unique Identifier (GUID) for research subject","NDAR*","",""
"src_subject_id","String","45","Required","Subject ID how it's defined in lab/project","","","id"
"interview_date","Date","","Required","Date on which the interview/genetic test/sampling/imaging/biospecimen was completed. MM/DD/YYYY","","",""
"interview_age","Integer","","Required","Age in months at the time of the interview/test/sampling/imaging.","0::1440","Age is rounded to chronological month. If the research participant is 15-days-old at time of interview, the appropriate value would be 0 months. If the participant is 16-days-old, the value would be 1 month.","jusage"
"sex","String","20","Required","Sex of subject at birth","M;F; O; NR","M = Male; F = Female; O=Other; NR = Not reported","gender,sexmf"
"monthsbl","Float","","Recommended","Actual number of months from Baseline","","",""
"daystrt","Integer","","Recommended","Parent SNAP or CAARS Days from Baseline used as start of interval for SCAPI data","","",""
"dayend","Integer","","Recommended","Parent SNAP or CAARS Days from Baseline used as end of interval for SCAPI data","","",""
"snapyn","Integer","","Recommended","Is there a Parent SNAP or CAARS data-form present for the end-of-interval date?","1;2","1=Yes; 2=No",""
"site","String","101","Recommended","Site","","Study Site","sitenum"
"sjtyp","Integer","","Recommended","Subject type","1;2","1=MTA randomized trial subject; 2=Local normative comparison group (LNCG) subject",""
"knownpc","Float","","Recommended","Percentage of the interval for which data are known","","",""
"intlnth","Float","","Recommended","Interval length","","",""
"ynjus","Integer","","Recommended","Any Truancy, Fights in School or the Neighborhood, Weapons brought to School, School Punishments, or Police Contact?","1;2","1=Yes; 2=No",""
"yn11","Integer","","Recommended","Did the child skipped school or was the child truant during this interval?","1;2","1=Yes; 2=No",""
"t11","Float","","Recommended","Total number of times the child skipped school or was truant during this interval","","",""
"ync12","Integer","","Recommended","Did the child have fights with other children in school during this interval?","1;2","1=Yes; 2=No",""
"pvc12","Integer","","Recommended","Were these fights with other children in school physical, verbal or both?","1::3","1=Physical only; 2=Verbal only; 3=Both physical and verbal",""
"tc12","Float","","Recommended","Total number of times the child fought with other children in school during this interval","","",""
"ynt12","Integer","","Recommended","Did the child have fights with teachers during this interval?","1;2","1=Yes; 2=No",""
"pvt12","Integer","","Recommended","Were these fights with teachers physical, verbal or both?","1::3","1=Physical only; 2=Verbal only; 3=Both physical and verbal",""
"tt12","Float","","Recommended","Total number of times the child fought with teachers during this interval","","",""
"yn13","Integer","","Recommended","Did anyone accuse the child of bringing a weapon to school during this interval?","1;2","1=Yes; 2=No",""
"t13","Float","","Recommended","Total number of times the child was accused of bringing a weapon to school during this interval.","","",""
"ynd14","Integer","","Recommended","Did the child receive a detention from school during this interval?","1;2","1=Yes; 2=No",""
"prd14","Integer","","Recommended","What was the main reason the child received detention during this interval?","1::7;99","1=ADHD; 2=Learning; 3=Other behavioral/emotional; 4=ADHD and learning; 5=ADHD and other behavior/emotional; 6=Learning and other behavior/emotional; 7=ADHD and learning and other behavior/emotional; 99=Other",""
"td14","Float","","Recommended","Total number of times the child received detention during this interval","","",""
"hd14","Float","","Recommended","Total number of hours the child received detention during this interval","","",""
"yni14","Integer","","Recommended","Did the child receive an in-school suspension during this interval?","1;2","1=Yes; 2=No",""
"pri14","Integer","","Recommended","What was the main reason the child received an in-school suspension during this interval?","1::7;99","1=ADHD; 2=Learning; 3=Other behavioral/emotional; 4=ADHD and learning; 5=ADHD and other behavior/emotional; 6=Learning and other behavior/emotional; 7=ADHD and learning and other behavior/emotional; 99=Other",""
"ti14","Float","","Recommended","Total number of times the child received an in-school suspension during this interval","","",""
"hi14","Float","","Recommended","Total number of hours the child received an in-school suspension during this interval","","",""
"yns14","Integer","","Recommended","Did the child receive an out-of-school suspension during this interval?","1;2","1=Yes; 2=No",""
"prs14","Integer","","Recommended","What was the main reason the child received an out-of-school suspension during this interval?","1::7;99","1=ADHD; 2=Learning; 3=Other behavioral/emotional; 4=ADHD and learning; 5=ADHD and other behavior/emotional; 6=Learning and other behavior/emotional; 7=ADHD and learning and other behavior/emotional; 99=Other",""
"ts14","Float","","Recommended","Total number of times the child received an out-of-school suspension during this interval","","",""
"hs14","Float","","Recommended","Total number of hours the child received an out-of-school suspension during this interval","","",""
"yne14","Integer","","Recommended","Was the child expelled from school during this interval?","1;2","1=Yes; 2=No",""
"pre14","Integer","","Recommended","What was the main reason the child was expelled from a school during this interval?","1::7;99","1=ADHD; 2=Learning; 3=Other behavioral/emotional; 4=ADHD and learning; 5=ADHD and other behavior/emotional; 6=Learning and other behavior/emotional; 7=ADHD and learning and other behavior/emotional; 99=Other",""
"te14","Float","","Recommended","Total number of times the child was expelled from a school during this interval","","",""
"ynh14","Integer","","Recommended","Was the child sent home early from school during this interval?","1;2","1=Yes; 2=No",""
"prh14","Integer","","Recommended","What was the main reason the child was sent home early from a school during this interval?","1::7;99","1=ADHD; 2=Learning; 3=Other behavioral/emotional; 4=ADHD and learning; 5=ADHD and other behavior/emotional; 6=Learning and other behavior/emotional; 7=ADHD and learning and other behavior/emotional; 99=Other",""
"th14","Float","","Recommended","Total number of times the child was sent home early from school during this interval","","",""
"hh14","Float","","Recommended","Total number of hours the child was sent home early from school during this interval","","",""
"yno14","Integer","","Recommended","Was the child given any other school punishment during this interval?","1;2","1=Yes; 2=No",""
"pro14","Integer","","Recommended","What was the main reason the child was given any other school punishment during this interval?","1::7;99","1=ADHD; 2=Learning; 3=Other behavioral/emotional; 4=ADHD and learning; 5=ADHD and other behavior/emotional; 6=Learning and other behavior/emotional; 7=ADHD and learning and other behavior/emotional; 99=Other",""
"to14","Float","","Recommended","Total number of times the child was given any other school punishment during this interval","","",""
"ho14","Float","","Recommended","Total number of hours the child was given any other school punishment during this interval","","",""
"nschtyp","Integer","","Recommended","Number of different types of school violations child was accused of during this interval","","",""
"nschtim","Float","","Recommended","Number of incidences of school violations child was accused of during this interval","","",""
"yn15","Integer","","Recommended","Was the child aggressive at home or in the neighborhood during this interval?","1;2","1=Yes; 2=No",""
"ml15","Integer","","Recommended","If yes, was the child more or less aggressive overall this past year?","1::3","1=More; 2=Less; 3=Same",""
"yns15","Integer","","Recommended","Was the child aggressive toward siblings during this interval?","1;2","1=Yes; 2=No",""
"ts15","Float","","Recommended","Total number of times the child was aggressive toward siblings during this interval","","",""
"gs15","Integer","","Recommended","Did any sibling aggression take place as part of a group during this interval?","1;2","1=Yes; 2=No",""
"hs15","Integer","","Recommended","Did any sibling aggression result in injury to anyone during this interval?","1;2","1=Yes; 2=No",""
"ms15","Integer","","Recommended","Did any sibling aggression result in a medical person being contacted during this interval?","1;2","1=Yes; 2=No",""
"ps15","Integer","","Recommended","Did any sibling aggression result in a police officer being summoned during this interval?","1;2","1=Yes; 2=No",""
"ynn15","Integer","","Recommended","Has the child been aggressive toward peers in the neighborhood during this interval?","1;2","1=Yes; 2=No",""
"tn15","Float","","Recommended","Total number of times the child was aggressive toward peers in the neighborhood during this interval","","",""
"gn15","Integer","","Recommended","Did any aggression toward peers in the neighborhood take place as part of a group during this interval?","1;2","1=Yes; 2=No",""
"hn15","Integer","","Recommended","Did any aggression toward peers in the neighborhood result in injury to anyone during this interval?","1;2","1=Yes; 2=No",""
"mn15","Integer","","Recommended","Did any aggression toward peers in the neighborhood result in a medical person being contacted during this interval?","1;2","1=Yes; 2=No",""
"pn15","Integer","","Recommended","Did any aggression toward peers in the neighborhood result in a police officer being summoned during this interval?","1;2","1=Yes; 2=No",""
"ynp15","Integer","","Recommended","Has the child been aggressive toward parents during this interval?","1;2","1=Yes; 2=No",""
"tp15","Float","","Recommended","Total number of times the child was aggressive toward parents during this interval","","",""
"gp15","Integer","","Recommended","Did any aggression toward parents take place as part of a group during this interval?","1;2","1=Yes; 2=No",""
"hp15","Integer","","Recommended","Did any aggression toward parents result in injury to anyone during this interval?","1;2","1=Yes; 2=No",""
"mp15","Integer","","Recommended","Did any aggression toward parents result in a medical person being contacted during this interval?","1;2","1=Yes; 2=No",""
"pp15","Integer","","Recommended","Did any aggression toward parents result in a police officer being summoned during this interval?","1;2","1=Yes; 2=No",""
"yna15","Integer","","Recommended","Has the child been aggressive toward other adults in the neighborhood during this interval?","1;2","1=Yes; 2=No",""
"ta15","Float","","Recommended","Total number of times the child was aggressive toward other adults in the neighborhood during this interval","","",""
"ga15","Integer","","Recommended","Did any aggression toward other adults in the neighborhood take place as part of a group during this interval?","1;2","1=Yes; 2=No",""
"ha15","Integer","","Recommended","Dating people who are really attracted to","1::4","1=Not dating the people you are really attracted to; 4=Dating the people you are really attracted to",""
"ma15","Integer","","Recommended","Did any aggression toward other adults result in a medical person being contacted during this interval?","1;2","1=Yes; 2=No",""
"pa15","Integer","","Recommended","Did any aggression toward other adults result in a police officer being summoned during this interval during this interval?","1;2","1=Yes; 2=No",""
"yno15","Integer","","Recommended","Has the child been aggressive toward others in the neighborhood during this interval?","1;2","1=Yes; 2=No",""
"toth15","Float","","Recommended","Total number of times the child was aggressive toward others in the neighborhood during this interval","","",""
"go15","Integer","","Recommended","Did any aggression toward others in the neighborhood take place as part of a group during this interval?","1;2","1=Yes; 2=No",""
"ho15","Integer","","Recommended","Did any aggression toward others result in injury to anyone during this interval?","1;2","1=Yes; 2=No",""
"mo15","Integer","","Recommended","Did any aggression toward others result in a medical person being contacted during this interval?","1;2","1=Yes; 2=No",""
"po15","Integer","","Recommended","Did any aggression toward others result in a police officer being summoned during this interval?","1;2","1=Yes; 2=No",""
"nneityp","Integer","","Recommended","Number of different categories of people outside of school child was aggressive toward during this interval","","",""
"nneitim","Float","","Recommended","Number of times child was aggressive toward people outside of school during this interval","","",""
"nneigrp","Integer","","Recommended","Number of different categories of people outside of school child was aggressive toward as part of a group, during this interval","","",""
"nneiinj","Integer","","Recommended","Number of different categories of people outside of school child was aggressive toward that resulted in injury to anyone, during this interval","","",""
"nneimed","Integer","","Recommended","Number of different categories of people outside of school child was aggressive toward that resulted in a medical person being contacted, during this interval","","",""
"nneipol","Integer","","Recommended","Number of different categories of people outside of school child was aggressive toward that resulted in a police officer being summoned, during this interval","","",""
"nm16","Integer","","Recommended","Total number of times child had encounters with the police in this interval","","",""
"am16","Integer","","Recommended","Total number of times arrested during this interval","","",""
"cm16","Integer","","Recommended","Total number of times criminal charges filed during this interval","","",""
"dm16","Integer","","Recommended","Total number of times sent to (juvenile) detention during this interval","","",""
"jm16","Integer","","Recommended","Total number of times was represented or appeared in (juvenile) court or before a judge during this interval","","",""
"m1m16","Integer","","Recommended","Types of ""crimes"" that resulted in police encounters during this interval - 1","114::223;777;99","114 = moving driving offenses; 115 = nonmoving driving offenses; 116 = running away from home; 117 = skipping school; 118 = lying about age to buy alcohol or to see an adult movie; 119 = hitchhiking; 120 = being drunk; 121 = carrying a weapon; 122 = being loud, rowdy, unruly or out of control; 123 = begging from strangers (panhandling); 124 = sneaking onto a bus or train or into a movie; 125 = stealing/shoplifting/purse snatching/pick pocketing; 126 = damaging property or setting fires; 127 = stealing a car or motorcycle; 128 = fencing stolen goods; 129 = counterfeiting, writing bad checks, wrongly using charge/bank cards; 130 = conning someone; 131 = attacking someone without a weapon; 132 = attacking someone with a weapon; 133 = using a weapon or force to get things; 134 = being involved in a gang fight; 135 = prostituting self; 136 = raping or threatening someone for sex; 137 = selling illegal drugs; 138 = threatening someone with a weapon; 139 = verbally threatening someone; 161 = failed to show for hearing; 165 = make false 911 call; 207 = trespassing; 208 = possession of illegal drugs; 209 = burglary or breaking & entering; 210 = bribery; 211 = embezzlement; 212 = extortion/blackmail; 213 = gambling offenses; 214 = homicide; 215 = kidnapping/abduction; 216 = pornography/ obscene material; 217 = non-forcible sex offenses; 218 = drunkenness; 219 = non-violent family offenses; 220 = peeping tom; 221 = major traffic offense (includes DWI); 223 = probation violation; 777 = minor citations; 99 = some other misbehavior",""
"m2m16","Integer","","Recommended","Types of ""crimes"" that resulted in police encounters during this interval - 2","114::223;777;99","114 = moving driving offenses; 115 = nonmoving driving offenses; 116 = running away from home; 117 = skipping school; 118 = lying about age to buy alcohol or to see an adult movie; 119 = hitchhiking; 120 = being drunk; 121 = carrying a weapon; 122 = being loud, rowdy, unruly or out of control; 123 = begging from strangers (panhandling); 124 = sneaking onto a bus or train or into a movie; 125 = stealing/shoplifting/purse snatching/pick pocketing; 126 = damaging property or setting fires; 127 = stealing a car or motorcycle; 128 = fencing stolen goods; 129 = counterfeiting, writing bad checks, wrongly using charge/bank cards; 130 = conning someone; 131 = attacking someone without a weapon; 132 = attacking someone with a weapon; 133 = using a weapon or force to get things; 134 = being involved in a gang fight; 135 = prostituting self; 136 = raping or threatening someone for sex; 137 = selling illegal drugs; 138 = threatening someone with a weapon; 139 = verbally threatening someone; 161 = failed to show for hearing; 165 = make false 911 call; 207 = trespassing; 208 = possession of illegal drugs; 209 = burglary or breaking & entering; 210 = bribery; 211 = embezzlement; 212 = extortion/blackmail; 213 = gambling offenses; 214 = homicide; 215 = kidnapping/abduction; 216 = pornography/ obscene material; 217 = non-forcible sex offenses; 218 = drunkenness; 219 = non-violent family offenses; 220 = peeping tom; 221 = major traffic offense (includes DWI); 223 = probation violation; 777 = minor citations; 99 = some other misbehavior",""
"m3m16","Integer","","Recommended","Types of ""crimes"" that resulted in police encounters during this interval - 3","114::223;777;99","114 = moving driving offenses; 115 = nonmoving driving offenses; 116 = running away from home; 117 = skipping school; 118 = lying about age to buy alcohol or to see an adult movie; 119 = hitchhiking; 120 = being drunk; 121 = carrying a weapon; 122 = being loud, rowdy, unruly or out of control; 123 = begging from strangers (panhandling); 124 = sneaking onto a bus or train or into a movie; 125 = stealing/shoplifting/purse snatching/pick pocketing; 126 = damaging property or setting fires; 127 = stealing a car or motorcycle; 128 = fencing stolen goods; 129 = counterfeiting, writing bad checks, wrongly using charge/bank cards; 130 = conning someone; 131 = attacking someone without a weapon; 132 = attacking someone with a weapon; 133 = using a weapon or force to get things; 134 = being involved in a gang fight; 135 = prostituting self; 136 = raping or threatening someone for sex; 137 = selling illegal drugs; 138 = threatening someone with a weapon; 139 = verbally threatening someone; 161 = failed to show for hearing; 165 = make false 911 call; 207 = trespassing; 208 = possession of illegal drugs; 209 = burglary or breaking & entering; 210 = bribery; 211 = embezzlement; 212 = extortion/blackmail; 213 = gambling offenses; 214 = homicide; 215 = kidnapping/abduction; 216 = pornography/ obscene material; 217 = non-forcible sex offenses; 218 = drunkenness; 219 = non-violent family offenses; 220 = peeping tom; 221 = major traffic offense (includes DWI); 223 = probation violation; 777 = minor citations; 99 = some other misbehavior",""
"m4m16","Integer","","Recommended","Types of ""crimes"" that resulted in police encounters during this interval - 4","114::223;777;99","114 = moving driving offenses; 115 = nonmoving driving offenses; 116 = running away from home; 117 = skipping school; 118 = lying about age to buy alcohol or to see an adult movie; 119 = hitchhiking; 120 = being drunk; 121 = carrying a weapon; 122 = being loud, rowdy, unruly or out of control; 123 = begging from strangers (panhandling); 124 = sneaking onto a bus or train or into a movie; 125 = stealing/shoplifting/purse snatching/pick pocketing; 126 = damaging property or setting fires; 127 = stealing a car or motorcycle; 128 = fencing stolen goods; 129 = counterfeiting, writing bad checks, wrongly using charge/bank cards; 130 = conning someone; 131 = attacking someone without a weapon; 132 = attacking someone with a weapon; 133 = using a weapon or force to get things; 134 = being involved in a gang fight; 135 = prostituting self; 136 = raping or threatening someone for sex; 137 = selling illegal drugs; 138 = threatening someone with a weapon; 139 = verbally threatening someone; 161 = failed to show for hearing; 165 = make false 911 call; 207 = trespassing; 208 = possession of illegal drugs; 209 = burglary or breaking & entering; 210 = bribery; 211 = embezzlement; 212 = extortion/blackmail; 213 = gambling offenses; 214 = homicide; 215 = kidnapping/abduction; 216 = pornography/ obscene material; 217 = non-forcible sex offenses; 218 = drunkenness; 219 = non-violent family offenses; 220 = peeping tom; 221 = major traffic offense (includes DWI); 223 = probation violation; 777 = minor citations; 99 = some other misbehavior",""
"m5m16","Integer","","Recommended","Types of ""crimes"" that resulted in police encounters during this interval - 5","114::223;777;99","114 = moving driving offenses; 115 = nonmoving driving offenses; 116 = running away from home; 117 = skipping school; 118 = lying about age to buy alcohol or to see an adult movie; 119 = hitchhiking; 120 = being drunk; 121 = carrying a weapon; 122 = being loud, rowdy, unruly or out of control; 123 = begging from strangers (panhandling); 124 = sneaking onto a bus or train or into a movie; 125 = stealing/shoplifting/purse snatching/pick pocketing; 126 = damaging property or setting fires; 127 = stealing a car or motorcycle; 128 = fencing stolen goods; 129 = counterfeiting, writing bad checks, wrongly using charge/bank cards; 130 = conning someone; 131 = attacking someone without a weapon; 132 = attacking someone with a weapon; 133 = using a weapon or force to get things; 134 = being involved in a gang fight; 135 = prostituting self; 136 = raping or threatening someone for sex; 137 = selling illegal drugs; 138 = threatening someone with a weapon; 139 = verbally threatening someone; 161 = failed to show for hearing; 165 = make false 911 call; 207 = trespassing; 208 = possession of illegal drugs; 209 = burglary or breaking & entering; 210 = bribery; 211 = embezzlement; 212 = extortion/blackmail; 213 = gambling offenses; 214 = homicide; 215 = kidnapping/abduction; 216 = pornography/ obscene material; 217 = non-forcible sex offenses; 218 = drunkenness; 219 = non-violent family offenses; 220 = peeping tom; 221 = major traffic offense (includes DWI); 223 = probation violation; 777 = minor citations; 99 = some other misbehavior",""
"m6m16","Integer","","Recommended","Types of ""crimes"" that resulted in police encounters during this interval - 6","114::223;777;99","114 = moving driving offenses; 115 = nonmoving driving offenses; 116 = running away from home; 117 = skipping school; 118 = lying about age to buy alcohol or to see an adult movie; 119 = hitchhiking; 120 = being drunk; 121 = carrying a weapon; 122 = being loud, rowdy, unruly or out of control; 123 = begging from strangers (panhandling); 124 = sneaking onto a bus or train or into a movie; 125 = stealing/shoplifting/purse snatching/pick pocketing; 126 = damaging property or setting fires; 127 = stealing a car or motorcycle; 128 = fencing stolen goods; 129 = counterfeiting, writing bad checks, wrongly using charge/bank cards; 130 = conning someone; 131 = attacking someone without a weapon; 132 = attacking someone with a weapon; 133 = using a weapon or force to get things; 134 = being involved in a gang fight; 135 = prostituting self; 136 = raping or threatening someone for sex; 137 = selling illegal drugs; 138 = threatening someone with a weapon; 139 = verbally threatening someone; 161 = failed to show for hearing; 165 = make false 911 call; 207 = trespassing; 208 = possession of illegal drugs; 209 = burglary or breaking & entering; 210 = bribery; 211 = embezzlement; 212 = extortion/blackmail; 213 = gambling offenses; 214 = homicide; 215 = kidnapping/abduction; 216 = pornography/ obscene material; 217 = non-forcible sex offenses; 218 = drunkenness; 219 = non-violent family offenses; 220 = peeping tom; 221 = major traffic offense (includes DWI); 223 = probation violation; 777 = minor citations; 99 = some other misbehavior",""
"x1m16","Integer","","Recommended","What happened at the court hearing during this interval - 1","140::166","140 = charges were dismissed; 141 = found guilty of the charges; 160 = pleaded guilty of the charges; 161 = failed to show for hearing; 162 = pleaded NOT guilty of the charges; 166 = did not occur because combined with another hearing",""
"x2m16","Integer","","Recommended","What happened at the court hearing during this interval - 2","","140 = charges were dismissed; 141 = found guilty of the charges; 160 = pleaded guilty of the charges; 161 = failed to show for hearing; 162 = pleaded NOT guilty of the charges; 166 = did not occur because combined with another hearing",""
"x3m16","Integer","","Recommended","What happened at the court hearing during this interval - 3","","140 = charges were dismissed; 141 = found guilty of the charges; 160 = pleaded guilty of the charges; 161 = failed to show for hearing; 162 = pleaded NOT guilty of the charges; 166 = did not occur because combined with another hearing",""
"pm16","Integer","","Recommended","Were any conditions imposed as a consequence of this behavior during this interval?","1;2","1=Yes; 2=No",""
