"ElementName","DataType","Size","Required","ElementDescription","ValueRange","Notes","Aliases"
"y1m16","Integer","","Recommended","What were the consequences during this interval - 1","80::227;777;888;99","80 = psychiatric hospitalization; 83 = placed in [juvenile] detention facility; 84 = correctional/juvenile officer counseling; 85 = placed in a residential treatment facility; 86 = placed in foster care; 87 = adult prison; 88 = adult jail; 107 = out-of-school suspension; 108 = expulsion from school; 142 = placed on informal probation; 143 = placed on formal probation; 145 = community service; 146 = court-ordered into a special program or special services; 150 = placed in a group home/half-way house; 152 = residential treatment facility placement; 153 = placed in boot camp; 154 = placed in a secure correctional facility; 155 = returned home; 156 = another hearing was scheduled for a later date; 157 = pay monetary restitution or fine; 226 = apologize; 227 = awaiting trial; 777 = minor citation; 888 = there were no consequences imposed; 99 = other",""
"y2m16","Integer","","Recommended","What were the consequences during this interval - 2","80::227;777;888;99","80 = psychiatric hospitalization; 83 = placed in [juvenile] detention facility; 84 = correctional/juvenile officer counseling; 85 = placed in a residential treatment facility; 86 = placed in foster care; 87 = adult prison; 88 = adult jail; 107 = out-of-school suspension; 108 = expulsion from school; 142 = placed on informal probation; 143 = placed on formal probation; 145 = community service; 146 = court-ordered into a special program or special services; 150 = placed in a group home/half-way house; 152 = residential treatment facility placement; 153 = placed in boot camp; 154 = placed in a secure correctional facility; 155 = returned home; 156 = another hearing was scheduled for a later date; 157 = pay monetary restitution or fine; 226 = apologize; 227 = awaiting trial; 777 = minor citation; 888 = there were no consequences imposed; 99 = other",""
"y3m16","Integer","","Recommended","What were the consequences during this interval - 3","80::227;777;888;99","80 = psychiatric hospitalization; 83 = placed in [juvenile] detention facility; 84 = correctional/juvenile officer counseling; 85 = placed in a residential treatment facility; 86 = placed in foster care; 87 = adult prison; 88 = adult jail; 107 = out-of-school suspension; 108 = expulsion from school; 142 = placed on informal probation; 143 = placed on formal probation; 145 = community service; 146 = court-ordered into a special program or special services; 150 = placed in a group home/half-way house; 152 = residential treatment facility placement; 153 = placed in boot camp; 154 = placed in a secure correctional facility; 155 = returned home; 156 = another hearing was scheduled for a later date; 157 = pay monetary restitution or fine; 226 = apologize; 227 = awaiting trial; 777 = minor citation; 888 = there were no consequences imposed; 99 = other",""
"y4m16","Integer","","Recommended","What were the consequences during this interval - 4","80::227;777;888;99","80 = psychiatric hospitalization; 83 = placed in [juvenile] detention facility; 84 = correctional/juvenile officer counseling; 85 = placed in a residential treatment facility; 86 = placed in foster care; 87 = adult prison; 88 = adult jail; 107 = out-of-school suspension; 108 = expulsion from school; 142 = placed on informal probation; 143 = placed on formal probation; 145 = community service; 146 = court-ordered into a special program or special services; 150 = placed in a group home/half-way house; 152 = residential treatment facility placement; 153 = placed in boot camp; 154 = placed in a secure correctional facility; 155 = returned home; 156 = another hearing was scheduled for a later date; 157 = pay monetary restitution or fine; 226 = apologize; 227 = awaiting trial; 777 = minor citation; 888 = there were no consequences imposed; 99 = other",""
"y5m16","Integer","","Recommended","What were the consequences during this interval - 5","80::227;777;888;99","80 = psychiatric hospitalization; 83 = placed in [juvenile] detention facility; 84 = correctional/juvenile officer counseling; 85 = placed in a residential treatment facility; 86 = placed in foster care; 87 = adult prison; 88 = adult jail; 107 = out-of-school suspension; 108 = expulsion from school; 142 = placed on informal probation; 143 = placed on formal probation; 145 = community service; 146 = court-ordered into a special program or special services; 150 = placed in a group home/half-way house; 152 = residential treatment facility placement; 153 = placed in boot camp; 154 = placed in a secure correctional facility; 155 = returned home; 156 = another hearing was scheduled for a later date; 157 = pay monetary restitution or fine; 226 = apologize; 227 = awaiting trial; 777 = minor citation; 888 = there were no consequences imposed; 99 = other",""
"y6m16","Integer","","Recommended","What were the consequences during this interval - 6","80::227;777;888;99","80 = psychiatric hospitalization; 83 = placed in [juvenile] detention facility; 84 = correctional/juvenile officer counseling; 85 = placed in a residential treatment facility; 86 = placed in foster care; 87 = adult prison; 88 = adult jail; 107 = out-of-school suspension; 108 = expulsion from school; 142 = placed on informal probation; 143 = placed on formal probation; 145 = community service; 146 = court-ordered into a special program or special services; 150 = placed in a group home/half-way house; 152 = residential treatment facility placement; 153 = placed in boot camp; 154 = placed in a secure correctional facility; 155 = returned home; 156 = another hearing was scheduled for a later date; 157 = pay monetary restitution or fine; 226 = apologize; 227 = awaiting trial; 777 = minor citation; 888 = there were no consequences imposed; 99 = other",""
"y7m16","Integer","","Recommended","What were the consequences during this interval - 7","80::227;777;888;99","80 = psychiatric hospitalization; 83 = placed in [juvenile] detention facility; 84 = correctional/juvenile officer counseling; 85 = placed in a residential treatment facility; 86 = placed in foster care; 87 = adult prison; 88 = adult jail; 107 = out-of-school suspension; 108 = expulsion from school; 142 = placed on informal probation; 143 = placed on formal probation; 145 = community service; 146 = court-ordered into a special program or special services; 150 = placed in a group home/half-way house; 152 = residential treatment facility placement; 153 = placed in boot camp; 154 = placed in a secure correctional facility; 155 = returned home; 156 = another hearing was scheduled for a later date; 157 = pay monetary restitution or fine; 226 = apologize; 227 = awaiting trial; 777 = minor citation; 888 = there were no consequences imposed; 99 = other",""
"y8m16","Integer","","Recommended","What were the consequences during this interval - 8","80::227;777;888;99","80 = psychiatric hospitalization; 83 = placed in [juvenile] detention facility; 84 = correctional/juvenile officer counseling; 85 = placed in a residential treatment facility; 86 = placed in foster care; 87 = adult prison; 88 = adult jail; 107 = out-of-school suspension; 108 = expulsion from school; 142 = placed on informal probation; 143 = placed on formal probation; 145 = community service; 146 = court-ordered into a special program or special services; 150 = placed in a group home/half-way house; 152 = residential treatment facility placement; 153 = placed in boot camp; 154 = placed in a secure correctional facility; 155 = returned home; 156 = another hearing was scheduled for a later date; 157 = pay monetary restitution or fine; 226 = apologize; 227 = awaiting trial; 777 = minor citation; 888 = there were no consequences imposed; 99 = other",""
"t1m16","Float","","Recommended","Total number of days of consequences was newly imposed in this interval for all of the misbehaviors during this interval?","","",""
"t2m16","Float","","Recommended","Total number of hours of consequences was newly imposed in this interval for all of the misbehaviors during this interval?","","",""
"cumarr","Integer","","Recommended","How many cumulative arrests are there for this subject?","","",""
"cumjud","Integer","","Recommended","How many cumulative appearances in (juvenile) court or before a judge are there for this subject?","","",""
"cumday","Float","","Recommended","How many cumulative days of consequences are there for this subject?","","",""
"stimyn","Integer","","Recommended","Did the child take stimulant medication for ADHD (for at least 30 days) during this interval?","0;1","0=No; 1=Yes",""
"stimhol","Float","","Recommended","Number of days during this interval that were free of stimulant medication for at least two-weeks at a time (i.e., stimulant ""holidays"")?","0;14::868","0=Always on stimulants or no stimulant free interval of at least 14 days",""
"stimhinm","String","50","Recommended","Name of stimulant medication taken at the highest dose during this interval?","","",""
"stimhido","Float","","Recommended","Highest daily dose of stimulant medication (mgs/day) taken during this interval?","","",""
"stimhida","Float","","Recommended","Number of days during this interval that the highest dose of stimulant medication was taken?","","",""
"stimhipc","Float","","Recommended","Percent of the total number of days in this interval that the highest dose was taken?","","",""
"stimdays","Float","","Recommended","Number of days during this interval that any stimulant medication was taken?","","",""
"stimpc","Float","","Recommended","Percent of the total number of days in this interval that any stimulant medication was taken?","","",""
"stimavdo","Float","","Recommended","Average daily dose (mgs/day) of all stimulant medications taken during this interval?","","",""
"stimlada","Float","","Recommended","Number of days during this interval that any long-acting stimulant medication was taken?","","",""
"stimadq","Float","","Recommended","Number of days during this interval that a daily dose of at least 15 mg/day of any stimulant medication was taken (i.e., ""adequate"" dose)?","","",""
"stimamt","Float","","Recommended","Total amount of stimulant medication (mgs) taken during this interval?","","",""
"stimcum","Float","","Recommended","Total cumulative amount of stimulant medication (mgs) taken since Baseline (includes 3 months prior) through and including this interval?","","",""
"stimdo30","Float","","Recommended","Average Daily Dose (mgs/day) of any stimulant medication taken for at least 15 days during the 30 days prior to SNAP evaluation?","","",""
"nonstday","Float","","Recommended","Number of days during this interval that any non-stimulant medication was taken for ADHD?","","",""
"nonstpc","Float","","Recommended","Percent of the total number of days in this interval that any non-stimulant medication was taken for ADHD?","","",""
"admedpc","Float","","Recommended","Percent of the total number of days in this interval that any stimulant OR non-stimulant medication was taken for ADHD?","","",""
"othpsyda","Float","","Recommended","Number of days during this interval that any other psychotropic medication was taken?","","",""
"othpsypc","Float","","Recommended","Percent of the total number of days in this interval that any other psychotropic medication was taken?","","",""
"monyn","Integer","","Recommended","Were there any ADHD medication monitoring visits during this interval?","1;2","1=Yes; 2=No",""
"monprov1","Integer","","Recommended","Medication monitoring provider 1","28::49;99","28 = Pharmacotherapist; 30 = Pediatrician; 31 = Family Doctor; 33 = Nurse or Nurse Practitioner; 34 = Physician's Assistant; 35 = Psychiatrist; 48 = Psychiatrist or Psychologist (respondent unable to specify); 49 = Neurologist; 99 = Other",""
"montime1","Integer","","Recommended","Number of times child saw provider 1 during this interval","","",""
"monhrs1","Float","","Recommended","Average hours per visit child saw provider 1 during this interval","","",""
"monprov2","Integer","","Recommended","Medication monitoring provider 2","28::49;99","28 = Pharmacotherapist; 30 = Pediatrician; 31 = Family Doctor; 33 = Nurse or Nurse Practitioner; 34 = Physician's Assistant; 35 = Psychiatrist; 48 = Psychiatrist or Psychologist (respondent unable to specify); 49 = Neurologist; 99 = Other",""
"montime2","Integer","","Recommended","Number of times child saw provider 2 during this interval","","",""
"monhrs2","Float","","Recommended","Average hours per visit child saw provider 2 during this interval","","",""
"monprov3","Integer","","Recommended","Medication monitoring provider 3","28::49;99","28 = Pharmacotherapist; 30 = Pediatrician; 31 = Family Doctor; 33 = Nurse or Nurse Practitioner; 34 = Physician's Assistant; 35 = Psychiatrist; 48 = Psychiatrist or Psychologist (respondent unable to specify); 49 = Neurologist; 99 = Other",""
"montime3","Integer","","Recommended","Number of times child saw provider 3 during this interval","","",""
"monhrs3","Float","","Recommended","Average hours per visit child saw provider 3 during this interval","","",""
"monprov4","Integer","","Recommended","Medication monitoring provider 4","28::49;99","28 = Pharmacotherapist; 30 = Pediatrician; 31 = Family Doctor; 33 = Nurse or Nurse Practitioner; 34 = Physician's Assistant; 35 = Psychiatrist; 48 = Psychiatrist or Psychologist (respondent unable to specify); 49 = Neurologist; 99 = Other",""
"montime4","Integer","","Recommended","Number of times child saw provider 4 during this interval","","",""
"monhrs4","Float","","Recommended","Average hours per visit child saw provider 4 during this interval","","",""
"monvist","Integer","","Recommended","Total number of medication monitoring visits during this interval","","",""
"monprot","Integer","","Recommended","Number of different provider types seen for medication monitoring during this interval","","",""
"monhrst","Float","","Recommended","Total number of hours of medication monitoring during this interval","","",""
"monvisc","Integer","","Recommended","Cumulative number of medication monitoring visits","","",""
"monhrsc","Float","","Recommended","Cumulative number of medication monitoring hours","","",""
"paryn","Integer","","Recommended","Did a parent take psychiatric medication this interval?","1;2","1=Yes; 2=No",""
"medrel","String","20","Recommended","If yes, which parent took this psychiatric medication?","","",""
"adhd_mta","Integer","","Recommended","Was the psychiatric medication for ADHD?","1","1=Yes",""
"anx_mta","Integer","","Recommended","Was the psychiatric medication for Anxiety?","1","1=Yes",""
"dep_mta","Integer","","Recommended","Was the psychiatric medication for Depression?","1","1=Yes",""
"sz_mta","Integer","","Recommended","Was the psychiatric medication for Schizophrenia?","1","1=Yes",""
"bipolar_mta","Integer","","Recommended","Was the psychiatric medication for Bipolar Disorder?","1","1=Yes",""
"sleep_mta","Integer","","Recommended","Was the psychiatric medication for sleep?","1","1=Yes",""
"seizure_mta","Integer","","Recommended","Was the psychiatric medication for seizures?","1","1=Yes",""
"ptsd_mta","Integer","","Recommended","Was the psychiatric medication for Post-Traumatic Stress Disorder?","1","1=Yes",""
"ocd_mta","Integer","","Recommended","Was the psychiatric medication for Obsessive-Compulsive disorder?","1","1=Yes",""
"tics_mta","Integer","","Recommended","Was the psychiatric medication for tics?","1","1=Yes",""
"panic_mta","Integer","","Recommended","Was the psychiatric medication for panic?","1","1=Yes",""
"medname_mta","String","200","Recommended","What is the psychiatric medication name?","","",""
"begin_mta","Integer","","Recommended","Days from baseline psychiatric medication began in this interval at this dose?","","",""
"end_mta","Integer","","Recommended","Days from baseline psychiatric medication ended in this interval at this dose?","","",""
"freq_mta","Float","","Recommended","Frequency of psychiatric medication?","","",""
"dose_mta","Float","","Recommended","If consistent dose multiple times a day, dose at each time?","","",""
"dailydose_mta","Float","","Recommended","Daily dose?","","",""
"paryn_therapy","Integer","","Recommended","Did parents receive any therapy during this interval?","1;2","1=Yes; 2=No",""
"svctype","Integer","","Recommended","Parenting Therapy Type","16::80","16 = MTA Parent Group; 18 = Local Attention Deficit/Hyperactivity Disorder Parent Group; 19 = Other Parent Support Group; 20 = Marriage Classes or Activities taught through the community; 21 = Other Self-Help Groups, like Alcoholics Anonymous (AA) or Narcotics Anonymous (NA); 51 = Special parent testing for attentional, learning, behavioral, or emotional problems; 57 = Occupational/Physical Therapy for parents; 60 = Parent Training, Classes, or Groups for help with child; 61 = Parent Counseling, Guidance or Training Individually for help with child; 62 = Group Therapy or other Group Treatment for you/your spouse; 63 = Individual Therapy/Counseling for you/your spouse; 72 = Marital/Couples Therapy; 73 = Parent Training, Classes, or Groups for help with other children in family; 80 = Psychiatric Hospitalization",""
"rel1","String","20","Recommended","Parent 1 receiving therapy","","",""
"rel2","String","20","Recommended","Parent 2 receiving therapy","","",""
"parreas","Integer","","Recommended","Reason for therapy","1::7;99","1=ADHD; 2=Learning; 3=Other behavioral/emotional; 4=ADHD and learning; 5=ADHD and other behavior/emotional; 6=Learning and other behavior/emotional; 7=ADHD and learning and other behavior/emotional; 99=Other",""
"prov","Integer","","Recommended","Provider of therapy","14::88;99","14 = School Counseling; 18 = Local Attention Deficit/Hyperactivity Disorder Parent Group (e.g., ChADD, ADDA, LDA); 20 = Marriage Classes or Activities taught through the community (church, synagogue, etc.); 21 = Other Self-Help Groups, like Alcoholics Anonymous (AA) or Narcotics Anonymous (NA); 27 = Homeopathic Healer; 29 = Principal of school; 30 = Pediatrician; 31 = Family Doctor; 32 = Other Counselor or Therapist; 33 = Nurse; 34 = Physician's Assistant; 35 = Psychiatrist; 36 = Psychologist; 37 = Social Worker; 38 = Child's Academic Classroom Teacher; 40 = Special Education Teacher/Resource Teacher; 41 = School/Guidance Counselor; 43 = Marriage Counselor; 44 = Family Therapist; 45 = Alcohol/Substance Use Counselor; 46 = Rabbi/Pastor/Priest/Minister; 47 = Graduate Study or Trainee or other Interns; 48 = Psychiatrist or Psychologist; 49 = Neurologist; 55 = Recreational and supportive activities; 57 = Occupational/Physical Therapy; 58 = Parent Other than child's parent; 60 = Parent Training, Classes, or Groups for help with child; 71 = Speech and Language Therapy; 72 = Marital/Couples Therapy; 74 = Provided additional Education and Information; 77 = Type of provider is not applicable; 80 = Psychiatric Hospitalization; 84 = Correctional/Juvenile Officer Counseling; 88 = Adult Jail; 99 = Other",""
"numtim","Integer","","Recommended","Number of times received therapy during this interval","","",""
"avgmin","Float","","Recommended","9c. Average Minutes per Visit","","",""
"year_mta","Integer","","Recommended","Year in study","","",""
"grade_mta","Float","","Recommended","Grade in school","1::12;20;25;30;99","20=Not participating; 25=Not in school; 30=Report card available but unable to collect; 99=Other",""
"ynsvc","Integer","","Recommended","Did child receive any school service during this school year?","1;2","1=Yes; 2=No",""
"yn12","Integer","","Recommended","Was the resource room/special education classes received?","1;2","1=Yes; 2=No",""
"reas12","Integer","","Recommended","Reason for the resource room/special education classes","1::7;99","1=ADHD; 2=Learning; 3=Other behavioral/emotional; 4=ADHD and learning; 5=ADHD and other behavior/emotional; 6=Learning and other behavior/emotional; 7=ADHD and learning and other behavior/emotional; 99=Other",""
"s12p35","Integer","","Recommended","Who provided the resource room/special education classes: Psychiatrist","1","1=Yes",""
"s12p36","Integer","","Recommended","Who provided the resource room/special education classes: Psychologist","1","1=Yes",""
"s12p37","Integer","","Recommended","Who provided the resource room/special education classes: Social Worker","1","1=Yes",""
"s12p38","Integer","","Recommended","Who provided the resource room/special education classes: Academic Classroom Teacher","1","1=Yes",""
"s12p39","Integer","","Recommended","Who provided the resource room/special education classes: Classroom Aide","1","1=Yes",""
"s12p40","Integer","","Recommended","Who provided the resource room/special education classes: Special Education/Resource Teacher","1","1=Yes",""
"s12p41","Integer","","Recommended","Who provided the resource room/special education classes: School/Guidance Counselor","1","1=Yes",""
"s12p57","Integer","","Recommended","Who provided the resource room/special education classes: Occupational/Physical Therapist","1","1=Yes",""
"s12p67","Integer","","Recommended","Who provided the resource room/special education classes: Tutor","1","1=Yes",""
"s12p71","Integer","","Recommended","Who provided the resource room/special education classes: Speech & Language Therapist","1","1=Yes",""
"s12oth1","Integer","","Recommended","Who provided the resource room/special education classes: First Other","25::84;99","25=Audiologist; 26=Opthamologist/optometrist; 29=Principal; 30=Pediatrician; 32=Other counselor or therapist; 33=Nurse or nurse practitioner; 46=Rabbi/pastor/priest/minister; 47=Graduate study/trainee intern; 48=Psychiatrist or psychologist; 65=Multiple school staff; 84=Correctional/juvenile officer counseling; 99=Other",""
"s12oth2","Integer","","Recommended","Who provided the resource room/special education classes: Second Other","25::84;99","25=Audiologist; 26=Opthamologist/optometrist; 29=Principal; 30=Pediatrician; 32=Other counselor or therapist; 33=Nurse or nurse practitioner; 46=Rabbi/pastor/priest/minister; 47=Graduate study/trainee intern; 48=Psychiatrist or psychologist; 65=Multiple school staff; 84=Correctional/juvenile officer counseling; 99=Other",""
"num12","Float","","Recommended","Summary variable: Number of times in school year resource room/special education classes received","","",""
"xhr12","Float","","Recommended","Summary variable: Average hours per time resource room/special education classes received","","",""
"tothr12","Float","","Recommended","Summary variable: Total hours per school year resource room/special education classes received","","",""
"pc12","Float","","Recommended","Summary variable: Percent of the school year resource room/special education classes received","","",""
"yn13_1","Integer","","Recommended","Was the day long special education programs received?","1;2","1=Yes; 2=No",""
"reas13","Integer","","Recommended","Reason for the day long special education programs","1::7;99","1=ADHD; 2=Learning; 3=Other behavioral/emotional; 4=ADHD and learning; 5=ADHD and other behavior/emotional; 6=Learning and other behavior/emotional; 7=ADHD and learning and other behavior/emotional; 99=Other",""
"s13p35","Integer","","Recommended","Who provided the day long special education programs: Psychiatrist","1","1=Yes",""
"s13p36","Integer","","Recommended","Who provided the day long special education programs: Psychologist","1","1=Yes",""
"s13p37","Integer","","Recommended","Who provided the day long special education programs: Social Worker","1","1=Yes",""
"s13p38","Integer","","Recommended","Who provided the day long special education programs: Academic Classroom Teacher","1","1=Yes",""
"s13p39","Integer","","Recommended","Who provided the day long special education programs: Classroom Aide","1","1=Yes",""
"s13p40","Integer","","Recommended","Who provided the day long special education programs: Special Education/Resource Teacher","1","1=Yes",""
"s13p41","Integer","","Recommended","Who provided the day long special education programs: School/Guidance Counselor","1","1=Yes",""
"s13p57","Integer","","Recommended","Who provided the day long special education programs: Occupational/Physical Therapist","1","1=Yes",""
"s13p67","Integer","","Recommended","Who provided the day long special education programs: Tutor","1","1=Yes",""
"s13p71","Integer","","Recommended","Who provided the day long special education programs: Speech & Language Therapist","1","1=Yes",""
"s13oth1","Integer","","Recommended","Who provided the day long special education programs: First Other","25::84;99","25=Audiologist; 26=Opthamologist/optometrist; 29=Principal; 30=Pediatrician; 32=Other counselor or therapist; 33=Nurse or nurse practitioner; 46=Rabbi/pastor/priest/minister; 47=Graduate study/trainee intern; 48=Psychiatrist or psychologist; 65=Multiple school staff; 84=Correctional/juvenile officer counseling; 99=Other",""
"s13oth2","Integer","","Recommended","Who provided the day long special education programs: Second Other","25::84;99","25=Audiologist; 26=Opthamologist/optometrist; 29=Principal; 30=Pediatrician; 32=Other counselor or therapist; 33=Nurse or nurse practitioner; 46=Rabbi/pastor/priest/minister; 47=Graduate study/trainee intern; 48=Psychiatrist or psychologist; 65=Multiple school staff; 84=Correctional/juvenile officer counseling; 99=Other",""
"num13","Float","","Recommended","Summary variable: Number of times in school year day long special education programs received","","",""
"xhr13","Float","","Recommended","Summary variable: Average hours per time day long special education programs received","","",""
"tothr13","Float","","Recommended","Summary variable: Total hours per school year day long special education programs received","","",""
