"ElementName","DataType","Size","Required","ElementDescription","ValueRange","Notes","Aliases"
"subjectkey","GUID","","Required","The NDAR Global Unique Identifier (GUID) for research subject","NDAR*","",""
"src_subject_id","String","45","Required","Subject ID how it's defined in lab/project","","","child_id,subject"
"interview_date","Date","","Required","Date on which the interview/genetic test/sampling/imaging/biospecimen was completed. MM/DD/YYYY","","",""
"interview_age","Integer","","Required","Age in months at the time of the interview/test/sampling/imaging.","0::1440","Age is rounded to chronological month. If the research participant is 15-days-old at time of interview, the appropriate value would be 0 months. If the participant is 16-days-old, the value would be 1 month.",""
"sex","String","20","Required","Sex of subject at birth","M;F; O; NR","M = Male; F = Female; O=Other; NR = Not reported","gender"
"sleepdisturb_p1","Integer","","Recommended","How many hours of sleep does your child get on most nights?","1::5","1 = 9-11 hours ; 2 = 8-9 hours ; 3 = 7-8 hours ; 4 = 5-7 hours ; 5 = Less than 5 hours",""
"sleepdisturb_p2","Integer","","Recommended","How long after going to bed does your child usually fall asleep?","1::5","1 = Less than 15 minutes ; 2 = 15-30 minutes ; 3 = 30-45 minutes ; 4 = 45-60 minutes ; 5 = More than 60 minutes",""
"sleepdisturb_p3","Integer","","Recommended","The child goes to bed reluctantly","1::5","1 = Never ; 2 = Occasionally (once or twice per month or less) ; 3 = Sometimes (once or twice per week) ; 4 = Often (3 or 5 times per week) ; 5 = Always (daily)",""
"sleepdisturb_p4","Integer","","Recommended","The child has difficulty getting to sleep at night","1::5","1 = Never ; 2 = Occasionally (once or twice per month or less) ; 3 = Sometimes (once or twice per week) ; 4 = Often (3 or 5 times per week) ; 5 = Always (daily)",""
"sleepdisturb_p5","Integer","","Recommended","The child feels anxious or afraid when falling asleep","1::5","1 = Never ; 2 = Occasionally (once or twice per month or less) ; 3 = Sometimes (once or twice per week) ; 4 = Often (3 or 5 times per week) ; 5 = Always (daily)",""
"sleepdisturb_p6","Integer","","Recommended","The child startles or jerks parts of the body while falling asleep","1::5","1 = Never ; 2 = Occasionally (once or twice per month or less) ; 3 = Sometimes (once or twice per week) ; 4 = Often (3 or 5 times per week) ; 5 = Always (daily)",""
"sleepdisturb_p7","Integer","","Recommended","The child shows repetitive actions such as rocking or head banging while falling asleep","1::5","1 = Never ; 2 = Occasionally (once or twice per month or less) ; 3 = Sometimes (once or twice per week) ; 4 = Often (3 or 5 times per week) ; 5 = Always (daily)",""
"sleepdisturb_p8","Integer","","Recommended","The child experiences vivid dream-like scenes while falling asleep","1::5","1 = Never ; 2 = Occasionally (once or twice per month or less) ; 3 = Sometimes (once or twice per week) ; 4 = Often (3 or 5 times per week) ; 5 = Always (daily)",""
"sleepdisturb_p9","Integer","","Recommended","The child sweats excessively while falling asleep","1::5","1 = Never ; 2 = Occasionally (once or twice per month or less) ; 3 = Sometimes (once or twice per week) ; 4 = Often (3 or 5 times per week) ; 5 = Always (daily)",""
"sleepdisturb_p10","Integer","","Recommended","The child wakes up more than twice per night","1::5","1 = Never ; 2 = Occasionally (once or twice per month or less) ; 3 = Sometimes (once or twice per week) ; 4 = Often (3 or 5 times per week) ; 5 = Always (daily)",""
"sleepdisturb_p11","Integer","","Recommended","After waking up in the night, the child has difficulty falling asleep again","1::5","1 = Never ; 2 = Occasionally (once or twice per month or less) ; 3 = Sometimes (once or twice per week) ; 4 = Often (3 or 5 times per week) ; 5 = Always (daily)",""
"sleepdisturb_p12","Integer","","Recommended","The child has frequent twitching or jerking of legs while asleep or often changes position during the night or kicks the covers off the bed","1::5","1 = Never ; 2 = Occasionally (once or twice per month or less) ; 3 = Sometimes (once or twice per week) ; 4 = Often (3 or 5 times per week) ; 5 = Always (daily)",""
"sleepdisturb_p13","Integer","","Recommended","The child has difficulty breathing during the night","1::5","1 = Never ; 2 = Occasionally (once or twice per month or less) ; 3 = Sometimes (once or twice per week) ; 4 = Often (3 or 5 times per week) ; 5 = Always (daily)",""
"sleepdisturb_p14","Integer","","Recommended","The child gasps for breaths or is unable to breathe during sleep","1::5","1 = Never ; 2 = Occasionally (once or twice per month or less) ; 3 = Sometimes (once or twice per week) ; 4 = Often (3 or 5 times per week) ; 5 = Always (daily)",""
"sleepdisturb_p15","Integer","","Recommended","The child snores","1::5","1 = Never ; 2 = Occasionally (once or twice per month or less) ; 3 = Sometimes (once or twice per week) ; 4 = Often (3 or 5 times per week) ; 5 = Always (daily)",""
"sleepdisturb_p16","Integer","","Recommended","The child sweats exessively during the night","1::5","1 = Never ; 2 = Occasionally (once or twice per month or less) ; 3 = Sometimes (once or twice per week) ; 4 = Often (3 or 5 times per week) ; 5 = Always (daily)",""
"sleepdisturb_p17","Integer","","Recommended","You have observed the child sleepwalking","1::5","1 = Never ; 2 = Occasionally (once or twice per month or less) ; 3 = Sometimes (once or twice per week) ; 4 = Often (3 or 5 times per week) ; 5 = Always (daily)",""
"sleepdisturb_p18","Integer","","Recommended","You have observed the child talking in his/her sleep","1::5","1 = Never ; 2 = Occasionally (once or twice per month or less) ; 3 = Sometimes (once or twice per week) ; 4 = Often (3 or 5 times per week) ; 5 = Always (daily)",""
"sleepdisturb_p19","Integer","","Recommended","The child grinds his/her teeth during sleep","1::5","1 = Never ; 2 = Occasionally (once or twice per month or less) ; 3 = Sometimes (once or twice per week) ; 4 = Often (3 or 5 times per week) ; 5 = Always (daily)",""
"sleepdisturb_p20","Integer","","Recommended","The child wakes from sleep screaming or confused so you cannot seem to get through to him/her, but has no memory of these events the next morning","1::5","1 = Never ; 2 = Occasionally (once or twice per month or less) ; 3 = Sometimes (once or twice per week) ; 4 = Often (3 or 5 times per week) ; 5 = Always (daily)",""
"sleepdisturb_p21","Integer","","Recommended","The child has nightmares which he/she doesn't remember the next day","1::5","1 = Never ; 2 = Occasionally (once or twice per month or less) ; 3 = Sometimes (once or twice per week) ; 4 = Often (3 or 5 times per week) ; 5 = Always (daily)",""
"sleepdisturb_p22","Integer","","Recommended","The child is unusuallly difficult to wake up in the morning","1::5","1 = Never ; 2 = Occasionally (once or twice per month or less) ; 3 = Sometimes (once or twice per week) ; 4 = Often (3 or 5 times per week) ; 5 = Always (daily)",""
"sleepdisturb_p23","Integer","","Recommended","The child awakes in the morning feeling tired","1::5","1 = Never ; 2 = Occasionally (once or twice per month or less) ; 3 = Sometimes (once or twice per week) ; 4 = Often (3 or 5 times per week) ; 5 = Always (daily)",""
"sleepdisturb_p24","Integer","","Recommended","The child feels unable to move when waking up in the morning","1::5","1 = Never ; 2 = Occasionally (once or twice per month or less) ; 3 = Sometimes (once or twice per week) ; 4 = Often (3 or 5 times per week) ; 5 = Always (daily)",""
"sleepdisturb_p25","Integer","","Recommended","The child experiences daytime sleepiness","1::5","1 = Never ; 2 = Occasionally (once or twice per month or less) ; 3 = Sometimes (once or twice per week) ; 4 = Often (3 or 5 times per week) ; 5 = Always (daily)",""
"sleepdisturb_p26","Integer","","Recommended","The child falls asleep suddenly in inappropriate situations","1::5","1 = Never ; 2 = Occasionally (once or twice per month or less) ; 3 = Sometimes (once or twice per week) ; 4 = Often (3 or 5 times per week) ; 5 = Always (daily)",""
"sleepdisturb_arsal","Integer","","Recommended","Disorders of arousal ","","",""
"sleepdisturb_brth","Integer","","Recommended","Sleep Breathing Disorders ","","",""
"sleepdisturb_hype","Integer","","Recommended","Sleep Hyperhydrosis ","","",""
"sleepdisturb_mtan","Integer","","Recommended","Disorders of initiating and maintaining sleep ","","",""
"sleepdisturb_somn","Integer","","Recommended","Disorders of excessive somnolence ","","",""
"sleepdisturb_total","Integer","","Recommended","Total score ","","",""
"sleepdisturb_trans","Integer","","Recommended","Sleep-Wake Transition Disorders ","","",""
"comqother","String","255","Recommended","Respondent - Other (text)","","",""
