"ElementName","DataType","Size","Required","ElementDescription","ValueRange","Notes","Aliases"
"spsi49","Integer","","Recommended","Question 49. When I am having trouble understanding a problem, I try to get more specific and concrete information about the problem to help clarify it (Imputed Version). Imputation Rule: if less than 5 of SPSI11_U, SPSI29_U, SPSI33_U, SPSI44_U, SPSI49_U, SPSI5_U, SPSI20_U, SPSI39_U, SPSI47_U, SPSI48_U, SPSI18_U, SPSI24_U, SPSI40_U, SPSI43_U, SPSI46_U, SPSI25_U, SPSI26_U, SPSI27_U, SPSI35_U, SPSI37_U are missing and SPSI49 missing then SPSI49=integer(median of non-missing (SPSI11_U, SPSI29_U, SPSI33_U, SPSI44_U, SPSI49_U, SPSI5_U, SPSI20_U, SPSI39_U, SPSI47_U, SPSI48_U, SPSI18_U, SPSI24_U, SPSI40_U, SPSI43_U, SPSI46_U, SPSI25_U, SPSI26_U, SPSI27_U, SPSI35_U, SPSI37_U))","0::4; -7","0 = Not at all true of me; 1 = Slightly true of me; 2 = Moderately true of me; 3 = Very true of me; 4 = Extremely true of me; -7=refused",""
"spsi50","Integer","","Recommended","Question 50. When my first efforts to solve a problem fail, I get discouraged and depressed (Imputed Version). Imputation Rule: if less than 3 of SPSI1_U, SPSI2_U, SPSI6_U, SPSI12_U, SPSI13_U, SPSI17_U, SPSI32_U, SPSI36_U,SPSI41_U, SPSI50_U are missing and SPSI50 missing then SPSI50=integer(median of non-missing (SPSI1_U, SPSI2_U, SPSI6_U, SPSI12_U, SPSI13_U, SPSI17_U, SPSI32_U, SPSI36_U, SPSI41_U, SPSI50_U))","0::4; -7","0 = Not at all true of me; 1 = Slightly true of me; 2 = Moderately true of me; 3 = Very true of me; 4 = Extremely true of me; -7=refused",""
"spsi51","Integer","","Recommended","Question 51. When a solution that I have carried out does not solve my problem satisfactorily, I do not take the time to examine carefully why it did not work (Imputed Version). Imputation Rule: if less than 3 of SPSI3_U, SPSI4_U, SPSI8_U, SPSI15_U, SPSI21_U, SPSI22_U, SPSI34_U, SPSI45_U, SPSI51_U, SPSI52_U are missing and SPSI51 missing then SPSI51=integer(median of non-missing (SPSI3_U, SPSI4_U, SPSI8_U, SPSI15_U, SPSI21_U, SPSI22_U, SPSI34_U, SPSI45_U, SPSI51_U, SPSI52_U))","0::4; -7","0 = Not at all true of me; 1 = Slightly true of me; 2 = Moderately true of me; 3 = Very true of me; 4 = Extremely true of me; -7=refused",""
"spsi52","Integer","","Recommended","Question 52. I am too impulsive when it comes to making decisions (Imputed Version). Imputation Rule: if less than 3 of SPSI3_U, SPSI4_U, SPSI8_U, SPSI15_U, SPSI21_U, SPSI22_U, SPSI34_U, SPSI45_U, SPSI51_U, SPSI52_U are missing and SPSI52 missing then SPSI52=integer(median of non-missing (SPSI3_U, SPSI4_U, SPSI8_U, SPSI15_U, SPSI21_U, SPSI22_U, SPSI34_U, SPSI45_U, SPSI51_U, SPSI52_U))","0::4; -7","0 = Not at all true of me; 1 = Slightly true of me; 2 = Moderately true of me; 3 = Very true of me; 4 = Extremely true of me; -7=refused",""
"spsi_ppo","Integer","","Recommended","Positive Problem Orientation (PPO) Scale using imputed values","0::20","Items included in score: SPSI7, SPSI9, SPSI19, SPSI28, SPSI38","spsippo"
"spsi_npo","Integer","","Recommended","Negative Problem Orientation (NPO) Scale using imputed values","0::40","Items included in score: SPSI1, SPSI2, SPSI6, SPSI12, SPSI13, SPSI17, SPSI32, SPSI36, SPSI41, SPSI50","spsinpo"
"spsi_rps","Integer","","Recommended","Rational Problem Solving (RPS) Scale using imputed values.","0::80","Items included in score: SPSI11, SPSI29, SPSI33, SPSI44, SPSI49, SPSI5, SPSI20, SPSI39, SPSI47, SPSI48, SPSI18, SPSI24, SPSI40, SPSI43, SPSI46, SPSI25, SPSI26, SPSI27, SPSI35, SPSI37","spsirps"
"spsi_ics","Integer","","Recommended","Impulsivity/Carelessness Style (ICS) Scale using imputed values.","0::40","Items included in score: SPSI3, SPSI4, SPSI8, SPSI15, SPSI21, SPSI22, SPSI34, SPSI45, SPSI51, SPSI52","spsiics"
"spsi_as","Integer","","Recommended","Avoidance Style (AS) Scale using imputed values.","0::28","Items included in score: SPSI10, SPSI14, SPSI16, SPSI23, SPSI30, SPSI31, SPSI42","spsias"
"spsi_pdf","Integer","","Recommended","Problem Definition and Formulation (PDF) Subscale using imputed values","0::20","Items included in score: SPSI11, SPSI29, SPSI33, SPSI44, SPSI49","spsipdf"
"spsi_gas","Integer","","Recommended","Generation of Alternative Solutions (GAS) Subscale using imputed values","0::20","Items included in score: SPSI5, SPSI20, SPSI39, SPSI47, SPSI48","spsigas"
"spsi_dm","Integer","","Recommended","Decision Making (DM) Subscale using imputed values","0::20","Items included in score: SPSI18, SPSI24, SPSI40, SPSI43, SPSI46","spsidm"
"spsi_siv","Integer","","Recommended","Solution Implementation and Verification (SIV) Subscale using imputed values","0::20","Items included in score: SPSI25, SPSI26, SPSI27, SPSI35, SPSI37","spsisiv"
"spsi_tot","Float","","Recommended","Total Social-Problem Solving (SPS) Score using imputed values","","Derivation Details: (SPSI_PPO/5) + (SPSI_RPS/20) + ((40- SPSI_NPO)/10) + ((40  SPSI_ICS)/10) + ((28  SPSI_AS)/7)","spsitot"
"week","Float","","Recommended","Week in level/study","","99=week 10-week 14",""
"site","String","101","Recommended","Site","","Study Site","siteid"
"phase","Integer","","Recommended","Phase","","9 =follow up",""
"visday","Integer","","Recommended","Number of days from study baseline to date of visit","","","date"
"spsi8_p","Integer","","Recommended","Complex problems make me very angry or upset.","0;1","0 = False; 1 = True",""
"spsi9_p","Integer","","Recommended","I often become sad and do not feel like doing anything when I have a problem to solve.","0;1","0 = False; 1 = True",""
"spsi10_p","Integer","","Recommended","I put off solving a problem for as long as I can.","0;1","0 = False; 1 = True",""
"spsi11_p","Integer","","Recommended","I avoid dealing with problems in my life.","0;1","0 = False; 1 = True",""
"spsi12_p","Integer","","Recommended","I put off solving problems until it is too late to do anything about them.","0;1","0 = False; 1 = True",""
"spsi13_p","Integer","","Recommended","When I have a problem, I find out if it is part of a bigger problem that I should deal with.","0;1","0 = False; 1 = True",""
"spsi14_p","Integer","","Recommended","I try to solve a complex problem by breaking it into smaller pieces that I can solve one at a time.","0;1","0 = False; 1 = True",""
"spsi15_p","Integer","","Recommended","Before I solve a problem, I gather as many facts about the problem as I can.","0;1","0 = False; 1 = True",""
"spsi16_p","Integer","","Recommended","When I solve a problem, I think of a number of options and combine them to make a better solution.","0;1","0 = False; 1 = True",""
"spsi17_p","Integer","","Recommended","I try to think of as many ways to approach a problem as I can.","0;1","0 = False; 1 = True",""
"spsi18_p","Integer","","Recommended","When I solve a problem, I think of as many options as I can until I can''t think of any more.","0;1","0 = False; 1 = True",""
"spsi19_p","Integer","","Recommended","When I decide which option is best, I predict what the outcome will be.","0;1","0 = False; 1 = True",""
"spsi20_p","Integer","","Recommended","I weigh the outcomes for each of the options I can think of.","0;1","0 = False; 1 = True",""
"spsi21_p","Integer","","Recommended","I think of the short-term and long-term outcomes of each option.","0;1","0 = False; 1 = True",""
"spsi22_p","Integer","","Recommended","Before I try to solve a problem, I set a goal so I know what I want to achieve. ","0;1","0 = False; 1 = True",""
"spsi23_p","Integer","","Recommended","Before solving a problem, I practice my solution to increase my chances of success.","0;1","0 = False; 1 = True",""
"spsi24_p","Integer","","Recommended","I write a specific objective down so I know how to solve my problem.","0;1","0 = False; 1 = True",""
"spsi25_p","Integer","","Recommended","After solving a problem, I decide if the situation is better.","0;1","0 = False; 1 = True",""
"spsi26_p","Integer","","Recommended","After solving a problem, I decide if I feel better about the situation.","0;1","0 = False; 1 = True",""
"spsi27_p","Integer","","Recommended","I often solve my problems and achieve my goals.","0;1","0 = False; 1 = True",""
"spsi1_p","Integer","","Recommended","When I have a problem, I think of the ways that I have handled the problem before.","0;1","0 = False; 1 = True",""
"spsi28_p","Integer","","Recommended","If the solution to a problem fails, I go back to the beginning and try again.","0;1","0 = False; 1 = True",""
"spsi29_p","Integer","","Recommended","When a solution does not work, I try to determine what part of the process went wrong.","0;1","0 = False; 1 = True",""
"spsi30_p","Integer","","Recommended","I go through the problem-solving process again when my first option fails.","0;1","0 = False; 1 = True",""
"spsi2_p","Integer","","Recommended","To solve a problem, I do what has worked for me in the past.","0;1","0 = False; 1 = True",""
"spsi3_p","Integer","","Recommended","When I solve a problem, I use the skills I have developed that have worked for me in the past.","0;1","0 = False; 1 = True",""
"spsi4_p","Integer","","Recommended","When I can''t solve a problem quickly and easily, I think that I am stupid.","0;1","0 = False; 1 = True",""
"spsi5_p","Integer","","Recommended","I often doubt that there is a good way to solve problems that I have.","0;1","0 = False; 1 = True",""
"spsi6_p","Integer","","Recommended","When faced with a hard problem, I believe that if I try, I will be able to solve it on my own.","0;1","0 = False; 1 = True",""
"spsi7_p","Integer","","Recommended","I feel afraid when I have an important problem to solve.","0;1","0 = False; 1 = True",""
"timepoint_label","String","50","Recommended","Timepoint/visit label","","e.g., Baseline, Morning, At Bedtime",""
"spsi_new8","Integer","","Recommended","I get nervous and unsure of myself when I have to make an important decision.","0::4","0 = Not at all true of me; 1 = Slightly true of me; 2 = Moderately true of me; 3 = Very true of me; 4 = Extremely true of me",""
"spsi_new9","Integer","","Recommended","When making decisions, I do not think carefully about my many options.","0::4","0 = Not at all true of me; 1 = Slightly true of me; 2 = Moderately true of me; 3 = Very true of me; 4 = Extremely true of me",""
"spsi7_p_alt","Integer","","Recommended","I feel afraid when I have an important problem to solve.","0::4","0 = Not at all true of me; 1 = Slightly true of me; 2 = Moderately true of me; 3 = Very true of me; 4 = Extremely true of me",""
"spsi12_p_alt","Integer","","Recommended","I put off solving problems until it is too late to do anything about them.","0::4","0 = Not at all true of me; 1 = Slightly true of me; 2 = Moderately true of me; 3 = Very true of me; 4 = Extremely true of me",""
"spsi_new1","Integer","","Recommended","When my first efforts to solve a problem fail, I give up quickly because finding a solution is too difficult.","0::4","0 = Not at all true of me; 1 = Slightly true of me; 2 = Moderately true of me; 3 = Very true of me; 4 = Extremely true of me",""
"spsi_new2","Integer","","Recommended","If I am faced with a difficult problem, I probably will not be able to solve it on my own no matter how hard I try.","0::4","0 = Not at all true of me; 1 = Slightly true of me; 2 = Moderately true of me; 3 = Very true of me; 4 = Extremely true of me",""
"spsi_new3","Integer","","Recommended","I try to do anything I can in order to avoid problems in my life.","0::4","0 = Not at all true of me; 1 = Slightly true of me; 2 = Moderately true of me; 3 = Very true of me; 4 = Extremely true of me",""
"spsi_new4","Integer","","Recommended","If I avoid problems, they will generally go away on their own.","0::4","0 = Not at all true of me; 1 = Slightly true of me; 2 = Moderately true of me; 3 = Very true of me; 4 = Extremely true of me",""
"spsi_new5","Integer","","Recommended","When I have a decision to make, I take the time to try to predict the positive and negative consequences of each possible option before I act.","0::4","0 = Not at all true of me; 1 = Slightly true of me; 2 = Moderately true of me; 3 = Very true of me; 4 = Extremely true of me",""
"spsi_new6","Integer","","Recommended","Sometimes even difficult problems can have a way of moving my life forward in positive ways.","0::4","0 = Not at all true of me; 1 = Slightly true of me; 2 = Moderately true of me; 3 = Very true of me; 4 = Extremely true of me",""
"spsi_new7","Integer","","Recommended","When I cannot solve a problem, I get very frustrated.","0::4","0 = Not at all true of me; 1 = Slightly true of me; 2 = Moderately true of me; 3 = Very true of me; 4 = Extremely true of me",""
