"ElementName","DataType","Size","Required","ElementDescription","ValueRange","Notes","Aliases"
"intmit_nssi_urge_average","Integer","","Recommended","In the past 2 weeks, how strong was your average urge to hurt yourself without wanting to die (such as wanting to cut or burn yourself)? Urge means internal push or impulse to do it","0::10","0= Not present; 10= Very strong",""
"intmit_nssi_urge_strongest","Integer","","Recommended","In the past 2 weeks, how strong was your strongest urge to hurt yourself without wanting to die (such as wanting to cut or burn yourself)? Urge means internal push or impulse to do it","0::10","0= Not present; 10= Very strong",""
"intmit_stb_plan","Integer","","Recommended","In the past 2 weeks, did you make a plan to kill yourself?","1;2","1= Yes; 2= No",""
"intmit_stb_plan_qual","String","100","Recommended","In the past 2 weeks, did you make a plan to kill yourself? Can you provide more detail about the plan you thought about?","","",""
"daily_si_urge_kill_avg","Integer","","Recommended","In the past 24 hours, how strong was your average urge to kill yourself? Urge means internal push or impulse to do it","0::10","0= Not present; 10= Very strong",""
"daily_si_urge_kill_strongest","Integer","","Recommended","In the past 24 hours, how strong was your strongest urge to kill yourself? Urge means internal push or impulse to do it","0::10","0= Not present; 10= Very strong",""
"daily_si_intent_kill_avg","Integer","","Recommended","In the past 24 hours, how strong was your average intent to kill yourself? Intent means determined to actually kill yourself","0::10","0= Not present; 10= Very strong",""
"daily_si_intent_kill_str","Integer","","Recommended","In the past 24 hours, how strong was your strongest intent to kill yourself? Intent means determined to actually kill yourself","0::10","0= Not present; 10= Very strong",""
"pre_urge","Integer","","Recommended","Right now, how strong is your urge to hurt yourself?","0::10","0= Not present; 10= Very strong",""
"pre_desire","Integer","","Recommended","Right now, how strong is your desire to die?","0::10","0= Not present; 10= Very strong",""
"pre_mood","Integer","","Recommended","What is your mood right now?","0::10","0= Very Negative; 10= Very positive",""
