"ElementName","DataType","Size","Required","ElementDescription","ValueRange","Notes","Aliases"
"ssi_c_5","Integer","","Recommended","Past 24 hours: Passive suicidal desire - You walk past the train tracks and the train is coming, you trip and fall. Do you get up?","0::2","0= Would take precautions to save life; 1= Would leave life/death to chance; 2= Would avoid steps necessary to save or maintain life",""
"ssi_c_6","Integer","","Recommended","Past 24 hours: Time dimension, duration of suicide ideation/wish - When suicidal thoughts come into your mind, how long do they last? Are they fleeting, lasting only a few minutes, or are they longer?","0::2","0= Brief, fleeting periods; 1= Longer periods; 2= Continuous (chronic) or almost continuous",""
"ssi_c_7","Integer","","Recommended","Past 24 hours: Time dimension, frequency of suicide - How often do these thoughts occur?","0::2","0= Rare, occasional; 1= Intermittent; 2= Persistent or continuous",""
"bssi8","Integer","","Recommended","In the last week, would you say that you accept or reject the idea of killing yourself?","0::2","0= I do not accept the idea of killing myself; 1= I neither accept nor reject the idea of killing myself; 2= I accept the idea of killing myself",""
"bssi9","Integer","","Recommended","In the last week, how much have you felt that you could keep yourself from attempting suicide?","0::3","0= I can keep myself from committing suicide; 2= I am unsure that I can keep myself from committing suicide; 3= I cannot keep myself from committing suicide",""
"bssi10","Integer","","Recommended","Deterrents to active attempt (e.g., family, religion, irreversibility) ","0::2","0= I would not have killed myself because of my family, friends, religion, possible injury from an unsuccessful attempt, etc; 1= I was somewhat concerned about killing myself because of my family, friends, religion, possible injury from an unsuccessful attempt, etc; 2= I was not or only a little concerned about killing myself because of my family, friends, religion, possible injury from an unsuccessful attempt, etc",""
"bssi11","Integer","","Recommended","Reason for contemplated attempt ","0::2","0= My reasons for wanting to commit suicide were primarily aimed at influencing other people, such as getting even with people, making people happier, making people pay attention to me, etc; 1= My reasons for wanting to commit suicide were not only aimed at influencing other people, but also represent a way of solving my problems; 2= My reasons for wanting to commit suicide were primarily based upon escaping from my problems",""
"bssi12","Integer","","Recommended","Method: Specificity planning of contemplated attempt ","0::2","0= I had no specific plan about how to kill myself; 1= I had considered ways of killing myself, but have not worked out the details; 2= I had a specific plan for killing myself",""
"bssi13","Integer","","Recommended","Method: Availability or opportunity for contemplated attempt ","0::2","0= I did not have access to a method or an opportunity to kill myself; 1= The method that I would have used for committing suicide took time, and I really did not have a good opportunity to use this method; 2= I had access or anticipated having access to the method that I chose for killing myself and also had or the opportunity to use it",""
"bssi14","Integer","","Recommended","Intent: Courage","0::2","0= I do not have the courage or the ability to commit suicide; 1= I am unsure that I have the courage or the ability to commit suicide; 2= I have the courage and the ability to commit suicide",""
"bssi15","Integer","","Recommended","Intent: Expectation","0::2","0= I did not expect to make a suicide attempt; 1= I was unsure that I could make a suicide attempt; 2= I was sure that I could make a suicide attempt",""
"bssi16","Integer","","Recommended","Preparations","0::2","0= I had made no preparations for committing suicide; 1= I had made some preparations for committing suicide; 2= I had almost finished or completed my preparations for committing suicide",""
"bssi17","Integer","","Recommended","Suicide Note","0::2","0= I had not written a suicide note; 1= I had thought about writing a suicide note or had started to write one, but had not completed it; 2= I had completed a suicide note",""
"bssi18","Integer","","Recommended","Arrangements After Death","0::2","0= I had made no arrangements for what will happen after I had committed suicide; 1= I had thought about making some arrangements for what will happen after I had committed suicide; 2= I had made definite arrangements for what will happen after I had committed suicide",""
"bssi19","Integer","","Recommended","Hide Desire to Kill Self","0::2","0= I had not hidden my desire to kill myself from people; 1= I held back telling people about wanting to kill myself; 2= I attempted to hide, conceal, or lie about wanting to commit suicide",""
"bssi1","Integer","","Recommended","In the past week, how would you rate your wish to live?","0::2","0= I have a moderate to strong wish to live; 1= I have a weak wish to live; 2= I have no wish to live",""
"bssi2","Integer","","Recommended","In the last week, how would you rate your wish to die?","0::2","0= I have no wish to die; 1= I have a weak wish to die; 2= I have a moderate to strong wish to die",""
"bssi3","Integer","","Recommended","In the last week, would you say that your reasons for living outweigh your reasons dying, or your reasons for dying outweigh your reasons for living, or that your reasons for living or dying are about the same?","0::2","0= My reasons for living outweigh my reasons for dying; 1= My reasons for living and dying are equal; 2= My reasons for dying outweigh my reasons for living",""
"bssi4","Integer","","Recommended","In the last week, how strong has your desire been to kill yourself?","0::2","0= I have no desire to kill myself; 1= I have a weak desire to kill myself; 2= I have a strong desire to kill myself",""
"bssi5","Integer","","Recommended","In the past week, would you try to save your life if you found yourself in a life-threatening situation?","0::2","0= I would try to save my life if I found myself in a life-threatening situation; 1= I would take a chance on life or death if I found myself in a life-threatening situation; 2= I would not take steps necessary to avoid death if I found myself in a life-threatening situation",""
"bssi6","Integer","","Recommended","In the past week, how long do your thoughts about killing yourself last?","0::2","0= I have brief periods of thinking about killing myself which pass quickly; 1= I have periods of thinking about killing myself which last moderate amounts of time; 2= I have long periods of thinking about killing myself",""
"bssi7","Integer","","Recommended","In the last week, how often do you think about killing yourself?","0::2","0= I rarely or occasionally think about killing myself; 1= I have frequent thoughts about killing myself; 2= I continuously think about killing myself",""
"provider_no","String","300","Recommended","Was the participant's provider informed? If no, why not?","","",""
"provider_who","String","200","Recommended","Was the participant's provider informed - Who?","","",""
"provider_dt","Date","","Recommended","Was the participant's provider informed - Date","","MM/DD/YYYY",""
"provider_tm","String","50","Recommended","Was the participant's provider informed - Time","","",""
"provider_how","String","300","Recommended","Was the participant's provider informed - How","","",""
"provider_type","String","200","Recommended","Was the participant's provider informed - What type of provider?","","",""
"recommendations","Integer","","Recommended","What were the recommendations made by the clinical research team?","1::5;99","1= Visit with existing provider; 2= Consult with referral for mental health services; 3= Contact crisis hotline; 4= Go to ER; 5= No follow up recommendations were necessary; 99= Other",""
"recommendations_other","String","300","Recommended","What were the recommendations made by the clinical research team? Other, specify","","",""
"narrative","String","500","Recommended","Narrative - Briefly summarize what the participant endorsed, factors that indicated risk and protection from subsequent suicidal behavior, your safety planning process (if applicable), your estimation of their ability to stay safe, the team's recommendations, and the family's response to those recommendations","","",""
"wish_dead","Integer","","Recommended","Last 2 weeks - Wish to be Dead - Subject endorses thoughts about a wish to be dead or not alive anymore, or wish to fall asleep and not wake up.","0;1","0= No; 1= Yes",""
"wish_dead_describe","String","500","Recommended","Last 2 weeks - Wish to be Dead - If yes, describe","","",""
"act_thoughts","Integer","","Recommended","Last 2 weeks - Non-Specific Active Suicidal Thoughts - General non-specific thoughts of wanting to end one's life/commit suicide (e.g., ''I have thought about killing myself'') without thoughts of ways to kill oneself/associated methods, intent, or plan during the assessment period.","0;1","0= No; 1= Yes",""
"act_thoughts_describe","String","500","Recommended","Last 2 weeks - Non-Specific Active Suicidal Thoughts - If yes, describe","","",""
"si_method","Integer","","Recommended","Last 2 weeks - Active Suicidal Ideation with Any Methods (not Plan) without Intent to Act - Subject endorses thoughts of suicide and has thought of at least one method during the assessment period. This is different than a specific plan with time, place or method details worked out (e.g. thought of method to kill self but not a specific plan). Includes person who would say, ''I thought about taking an overdose but I never made a specific plan as to when, where or how I would actually do it... and I would never go through with it.''","0;1","0= No; 1= Yes",""
"si_method_describe","String","500","Recommended","Last 2 weeks - Active Suicidal Ideation with Any Methods (not Plan) without Intent to Act) - If yes, describe","","",""
"si_intent","Integer","","Recommended","Last 2 weeks - Active Suicidal Ideation with Some Intent to Act, without Specific Plan - Active suicidal thoughts of killing oneself and subject reports having some intent to act on such thoughts, as opposed to 'I have the thoughts but I definitely will not do anything about them.''","0;1","0= No; 1= Yes",""
"si_intent_describe","String","500","Recommended","Last 2 weeks - Active Suicidal Ideation with Some Intent to Act, without Specific Plan - If yes, describe","","",""
"si_details","Integer","","Recommended","Last 2 weeks - Active Suicidal Ideation with Specific Plan and Intent - Thoughts of killing oneself with details of plan fully or partially worked out and subject has some intent to carry it out.","0;1","0= No; 1= Yes",""
"si_details_describe","String","500","Recommended","Last 2 weeks - Active Suicidal Ideation with Specific Plan and Intent - If yes, describe","","",""
"proceed","Integer","","Recommended","Based on other factors related to the participant's clinical risk, would you like to proceed with Part A: Risk Characterization?","0;1","0= No; 1= Yes",""
"supervisor_contacted","Integer","","Recommended","Was a Clinical Supervisor contacted?","0;1","0= No; 1= Yes",""
"method_48hr","Integer","","Recommended","Past 48 hours - Method: Availability/Opportunity for contemplated attempt - Have you worked out the way to carry out your thoughts of suicide? Do you have the chance right now? Do you think you will have the chance to kill yourself soon?","0::2","0= Method not available, not opportunity; 1= Method would take time and effort, opportunity not readily available; 2= Method and opportunity available",""
"method_comment","String","500","Recommended","Past 48 hours - Method: Availability/Opportunity for contemplated attempt - Comments","","",""
"capability","Integer","","Recommended","Past 48 hours - Sense of ''capability'' to carry out attempt - Do you believe you have the ability to kill yourself? Do you know exactly what you would have to do to cause your own death? Do you feel sure that you would not hesitate to harm yourself?","0::2","0= No sense of ability to carry out; 1= Some sense of ability to carry out, unsure of ability to carry out; 2= Sure of sense of ability to carry out",""
"capability_comment","String","500","Recommended","Past 48 hours - Sense of ''capability'' to carry out attempt - Comments","","",""
"expectancy","Integer","","Recommended","Past 48 hours - Expectancy, anticipation of actual participation - Do you expect or anticipate that you will actually make a suicide attempt? Are you certain that you will make an attempt?","0::2","0= No; 1= Uncertain, not sure; 2= Yes",""
"expectancy_comment","String","500","Recommended","Past 48 hours - Expectancy, anticipation of actual participation - Comments","","",""
"exptime","Integer","","Recommended","Timeframe a suicide attempt is expected","0::2","0= Less than 24 hours; 1= 24-48 hours; 2= Greater than 48 hours",""
"exptime_comment","String","500","Recommended","Timeframe a suicide attempt is expected - Comments","","",""
"preparation","Integer","","Recommended","Past 48 hours - Actual preparation for contemplated attempt - Have you taken any steps to make it possible for you to take your own life? In other words, have you actually put your method into place? Have you tied up loose ends? For example, have you written a suicide note?","0::2","0= None; 1= Partial (e.g., starting to collect pills, started to write note); 2= Complete (e.g., had pills, loaded gun)",""
"preparation_comment","String","500","Recommended","Past 48 hours - Actual preparation for contemplated attempt - Comments","","",""
"supervisor_no","String","300","Recommended","Was a Clinical Supervisor contacted? If no, why not?","","",""
"risk_lvl","Integer","","Recommended","Suicide Risk Management Protocol - Risk Assessment","1::4","1= Low (current ideation is endorsed within the past 3 months but not in the past 2 weeks); 2= Moderate (current ideation is endorsed within the past 2 weeks without method or plan); 3= High (current ideation is endorsed within the past 2 weeks with method or plan); 4= Immediate (participant expects to make an attempt within the next 48 hours)",""
"dtfollowup","Date","","Recommended","Suicide Risk Management Protocol - Followup Contact Date","","MM/DD/YYYY",""
"description","String","2000","Recommended","Suicide Risk Management Protocol - Followup Description","","",""
"see_otherprovider","Integer","","Recommended","Are there providers you have been working with since our last visit that you will be following-up with for your treatment (such as a psychiatrist, therapist, social worker, case worker or other)?","0;1","0= No; 1= Yes",""
"physspec","Integer","","Recommended","Specialty of provider you have been working with that you will be following up with","1::4;99","1= Primary Care Physician (PCP); 2= Psychiatrist; 3= Therapist; 4= Case Worker; 99= Other",""
"physspec_other","String","200","Recommended","Specialty of provider you have been working with that you will be following up with - Other, specify","","",""
"respondent_other_specify","String","50","Recommended","Respondent: Other (specify)","","",""
"supervisor_who","String","200","Recommended","Was a Clinical Supervisor contacted - Who?","","",""
"supervisor_dt","Date","","Recommended","Was a Clinical Supervisor contacted - Date","","MM/DD/YYYY",""
"supervisor_tm","String","50","Recommended","Was a Clinical Supervisor contacted - Time","","",""
"supervisor_how","String","300","Recommended","Was a Clinical Supervisor contacted - How","","",""
"provider_informed","Integer","","Recommended","Was the participant's provider informed?","0;1","0= No; 1= Yes",""
"daily_si_intent_kill_now","Integer","","Recommended","How strong is your intent to kill yourself right now? Intent means determined to actually kill yourself","0::10","0= Not present; 10= Very strong",""
"daily_kill_self_today","Integer","","Recommended","Are you going to kill yourself today?","1::3","1= Yes; 2= Don't know; 3= No",""
"daily_thoughts_notworth","Integer","","Recommended","At your worst point in the past 24 hours, what best describes the thoughts that you were having? My life is not worth living","0;1","0= Unchecked; 1= Checked",""
"daily_thoughts_disappear","Integer","","Recommended","At your worst point in the past 24 hours, what best describes the thoughts that you were having? I wish I could disappear and not exist","0;1","0= Unchecked; 1= Checked",""
"daily_thoughts_betteroff","Integer","","Recommended","At your worst point in the past 24 hours, what best describes the thoughts that you were having? I'd be better off dead","0;1","0= Unchecked; 1= Checked",""
"daily_thoughts_wishdead","Integer","","Recommended","At your worst point in the past 24 hours, what best describes the thoughts that you were having? I wish I was dead","0;1","0= Unchecked; 1= Checked",""
"daily_thoughts_wishkill","Integer","","Recommended","At your worst point in the past 24 hours, what best describes the thoughts that you were having? I wish I could kill myself","0;1","0= Unchecked; 1= Checked",""
"daily_thoughts_wantkill","Integer","","Recommended","At your worst point in the past 24 hours, what best describes the thoughts that you were having? I want to kill myself","0;1","0= Unchecked; 1= Checked",""
"daily_thoughts_shouldkill","Integer","","Recommended","At your worst point in the past 24 hours, what best describes the thoughts that you were having? I should kill myself","0;1","0= Unchecked; 1= Checked",""
"daily_thoughts_none","Integer","","Recommended","At your worst point in the past 24 hours, what best describes the thoughts that you were having? I didn't have any of these thoughts","0;1","0= Unchecked; 1= Checked",""
"daily_mental_img_death","Integer","","Recommended","In the past 24 hours, did you have any mental images of you being dead (e.g., in a hospital bed or your funeral)?","1;2","1= Yes; 2= No",""
"daily_mental_img_kill","Integer","","Recommended","In the past 24 hours, did you have any mental images of killing yourself?","1;2","1= Yes; 2= No",""
"daily_nssi_urge_average","Integer","","Recommended","In the past 24 hours, how strong was your average urge to hurt yourself without wanting to die (such as wanting to cut or burn yourself)? Urge means internal push or impulse to do it","0::10","0= Not present; 10= Very strong",""
"daily_nssi_urge_strongest","Integer","","Recommended","In the past 24 hours, how strong was your strongest urge to hurt yourself without wanting to die (such as wanting to cut or burn yourself)? Urge means internal push or impulse to do it","0::10","0= Not present; 10= Very strong",""
"daily_nssi","Integer","","Recommended","Since the last survey, did you hurt yourself without wanting to die (such as cutting or burning yourself)?","1;2","1= Yes; 2= No",""
"daily_nssi_count","Integer","","Recommended","Since the last survey, did you hurt yourself without wanting to die (such as cutting or burning yourself)? How many times did this happen since the last survey?","0::10","0= 0 times; 10= 10+ times",""
"daily_nssi_qual","String","100","Recommended","Since the last survey, did you hurt yourself without wanting to die (such as cutting or burning yourself)? Can you give us more details about what happened?","","",""
"daily_stb_plan","Integer","","Recommended","In the past 24 hours, did you make a plan to kill yourself?","1;2","1= Yes; 2= No",""
"daily_stb_plan_qual","String","100","Recommended","In the past 24 hours, did you make a plan to kill yourself? Can you provide more detail about the plan you thought about?","","",""
"daily_stb_steps","Integer","","Recommended","Since the last survey, did you take steps to kill yourself?","1;2","1= Yes; 2= No",""
"study_phase","String","10","Recommended","Study phase of survey completion","Inpatient; Outpatient","",""
"daily_stb_steps_next","Integer","","Recommended","Since the last survey, did you take steps to kill yourself? After you took steps to kill yourself, what happened?","1::4","1=You stopped yourself before you hurt yourself; 2=Someone else stopped you before you hurt yourself; 3=You hurt yourself; 4=None of the above",""
"daily_stb_nothing_qual","String","100","Recommended","Since the last survey, did you take steps to kill yourself? Can you tell us what happened?","","",""
"daily_stb_steps_injury","Integer","","Recommended","Since the last survey, if you took steps to kill yourself, just to be clear, did you have a physical injury?","1;2","1= Yes; 2= No",""
"daily_stb_steps_plan_method","String","100","Recommended","What were you going to use to try to kill yourself?","","",""
"daily_stb_steps_plan_qual","String","100","Recommended","Since the last survey, did you take steps to kill yourself? Can you give us more details about what happened?","","",""
"daily_stb_steps_injury_method","String","100","Recommended","Since the last survey, did you take steps to kill yourself? If yes, what did you use to try to kill yourself?","","",""
"daily_stb_sa","Integer","","Recommended","When you hurt yourself, were you trying to die from the injury?","1::3","1=Yes; 2=No; 3=Unsure",""
"daily_stb_sa_fu","Integer","","Recommended","When you hurt yourself, were you trying to die from the injury? If yes or unsure,  was even a small part of you trying to die when you hurt yourself?","1;2","1= Yes; 2= No",""
"daily_stb_sa_lethality","Integer","","Recommended","When you hurt yourself, were you trying to die from the injury? How confident were you that the method you used would kill you?","1::5","1= Very sure method would NOT kill me; 2= Good chance of survival; 3= Unsure whether I would live or die; 4= Good chance of death; 5= Very sure method would kill me",""
"daily_stb_sa_qual","String","100","Recommended","When you hurt yourself, were you trying to die from the injury? Can you give us more details about what happened?","","",""
"daily_si_desire_kill_avg","Integer","","Recommended","In the past 24 hours, how strong was your average desire to kill yourself? Desire means wanting to do it","0::10","0= Not present; 10= Very strong",""
"intmit_si_desire_kill_avg","Integer","","Recommended","In the past 2 weeks, how strong was your average desire to kill yourself? Desire means wanting to do it","0::10","0= Not present; 10= Very strong",""
"intmit_si_desire_kill_str","Integer","","Recommended","In the past 2 weeks, how strong was your strongest desire to kill yourself? Desire means wanting to do it","0::10","0= Not present; 10= Very strong",""
"intmit_si_urge_kill_avg","Integer","","Recommended","In the past 2 weeks, how strong was your average urge to kill yourself? Urge means internal push or impulse","0::10","0= Not present; 10= Very strong",""
"intmit_si_urge_kill_strongest","Integer","","Recommended","In the past 2 weeks, how strong was your strongest urge to kill yourself? Urge means internal push or impulse to do it","0::10","0= Not present; 10= Very strong",""
"intmit_si_intent_kill_avg","Integer","","Recommended","In the past 2 weeks, how strong was your average intent to kill yourself? Intent means determined to actually kill yourself","0::10","0= Not present; 10= Very strong",""
"intmit_si_intent_kill_str","Integer","","Recommended","In the past 2 weeks, how strong was your strongest intent to kill yourself? Intent means determined to actually kill yourself","0::10","0= Not present; 10= Very strong",""
"intmit_thoughts_notworth","Integer","","Recommended","At your worst point in the past 2 weeks, what best describes the thoughts that you were having? My life is not worth living","0;1","0= Unchecked; 1= Checked",""
"intmit_thoughts_disappear","Integer","","Recommended","At your worst point in the past 2 weeks, what best describes the thoughts that you were having? I wish I could disappear and not exist","0;1","0= Unchecked; 1= Checked",""
"intmit_thoughts_betteroff","Integer","","Recommended","At your worst point in the past 2 weeks, what best describes the thoughts that you were having? I'd be better off dead","0;1","0= Unchecked; 1= Checked",""
"intmit_thoughts_wishdead","Integer","","Recommended","At your worst point in the past 2 weeks, what best describes the thoughts that you were having? I wish I was dead","0;1","0= Unchecked; 1= Checked",""
"daily_si_desire_kill_str","Integer","","Recommended","In the past 24 hours, how strong was your strongest desire to kill yourself? Desire means wanting to do it","0::10","0= Not present; 10= Very strong",""
"intmit_thoughts_wishkill","Integer","","Recommended","At your worst point in the past 2 weeks, what best describes the thoughts that you were having? I wish I could kill myself","0;1","0= Unchecked; 1= Checked",""
"intmit_thoughts_wantkill","Integer","","Recommended","At your worst point in the past 2 weeks, what best describes the thoughts that you were having? I want to kill myself","0;1","0= Unchecked; 1= Checked",""
"intmit_thoughts_shouldkill","Integer","","Recommended","At your worst point in the past 2 weeks, what best describes the thoughts that you were having? I should kill myself","0;1","0= Unchecked; 1= Checked",""
"intmit_thoughts_none","Integer","","Recommended","At your worst point in the past 2 weeks, what best describes the thoughts that you were having? I didn't have any of these thoughts","0;1","0= Unchecked; 1= Checked",""
"intmit_mental_img_death","Integer","","Recommended","In the past 2 weeks, did you have any mental images of you being dead (e.g., in a hospital bed or your funeral)?","1;2","1= Yes; 2= No",""
"intmit_mental_img_kill","Integer","","Recommended","In the past 2 weeks, did you have any mental images of killing yourself?","1;2","1= Yes; 2= No",""
