"ElementName","DataType","Size","Required","ElementDescription","ValueRange","Notes","Aliases"
"subjectkey","GUID","","Required","The NDAR Global Unique Identifier (GUID) for research subject","NDAR*","",""
"src_subject_id","String","45","Required","Subject ID how it's defined in lab/project","","","id,subject_id"
"interview_date","Date","","Required","Date on which the interview/genetic test/sampling/imaging/biospecimen was completed. MM/DD/YYYY","","",""
"interview_age","Integer","","Required","Age in months at the time of the interview/test/sampling/imaging.","0::1440","Age is rounded to chronological month. If the research participant is 15-days-old at time of interview, the appropriate value would be 0 months. If the participant is 16-days-old, the value would be 1 month.",""
"sex","String","20","Required","Sex of subject at birth","M;F; O; NR","M = Male; F = Female; O=Other; NR = Not reported","gender"
"dyscov_tlfb","Integer","","Recommended","Days Covered?","0 :: 90","",""
"dysuse_sib","Integer","","Recommended","Days of Self-Injurious Behaivors","","","dysuse_tlfb"
"behtype_tlfb","String","2","Recommended","Type(s) of self-injurious behavior","BH; CA; PI; SS; BT; CU; PH; SN; BU; IW; RS; O","BH = Banging/Hitting; CA = Carving; PI = Pinching; SS = Severe Scratching; BT = Biting; CU = Cutting; PH = Pulling Hair; SN = Sticking Self w/ Needles; BU = Burning; IW = Interfering w/ Wound Healing; RS = Rubbing Skin Against Rough Surfaces; O = Other",""
"otherdes_tlfb","String","50","Recommended","Other behavior description","","",""
