"ElementName","DataType","Size","Required","ElementDescription","ValueRange","Notes","Aliases"
"subjectkey","GUID","","Required","The NDAR Global Unique Identifier (GUID) for research subject","NDAR*","",""
"src_subject_id","String","20","Required","Subject ID how it's defined in lab/project","","","subject_id"
"interview_date","Date","","Required","Date on which the interview/genetic test/sampling/imaging/biospecimen was completed. MM/DD/YYYY","","",""
"interview_age","Integer","","Required","Age in months at the time of the interview/test/sampling/imaging.","0::1440","Age is rounded to chronological month. If the research participant is 15-days-old at time of interview, the appropriate value would be 0 months. If the participant is 16-days-old, the value would be 1 month.",""
"sex","String","20","Required","Sex of subject at birth","M;F; O; NR","M = Male; F = Female; O=Other; NR = Not reported","gender"
"timept","Integer","","Recommended","Time Point","","888 = not applicable; 999 = missing",""
"phi1","Integer","","Recommended","Type of interview","1::5","1 = In person; 2 = Phone; 3 = Mail; 4 = SIG-O only; 5 = Carp only","in_person"
"wills_01","Integer","","Recommended","I like to plan things way ahead of time.","1 :: 5;444;555;777;888;999","1= Not at all true; 2= A little true; 3= Somewhat true; 4= Pretty true; 5= Very true; 444= Do not wish to respond ;999= No Answer; 888= Skipped; 777= Condition Skipped; 555= Missing","pla01"
"wills_02","Integer","","Recommended","When I promise to do something, you can count on me to do it.","1 :: 5;444;555;777;888;999","1= Not at all true; 2= A little true; 3= Somewhat true; 4= Pretty true; 5= Very true; 444= Do not wish to respond ;999= No Answer; 888= Skipped; 777= Condition Skipped; 555= Missing","pla02"
"wills_03","Integer","","Recommended","When I have to wait in line, I do it patiently.","1 :: 5;444;555;777;888;999","1= Not at all true; 2= A little true; 3= Somewhat true; 4= Pretty true; 5= Very true; 444= Do not wish to respond ;999= No Answer; 888= Skipped; 777= Condition Skipped; 555= Missing","pla03"
"wills_04","Integer","","Recommended","I stick with what I'm doing until I'm finished with it.","1 :: 5;444;555;777;888;999","1= Not at all true; 2= A little true; 3= Somewhat true; 4= Pretty true; 5= Very true; 444= Do not wish to respond ;999= No Answer; 888= Skipped; 777= Condition Skipped; 555= Missing","pla04"
"wills_05","Integer","","Recommended","I usually think before I act.","1 :: 5;444;555;777;888;999","1= Not at all true; 2= A little true; 3= Somewhat true; 4= Pretty true; 5= Very true; 444= Do not wish to respond ;999= No Answer; 888= Skipped; 777= Condition Skipped; 555= Missing","pla05"
"wills_06","Integer","","Recommended","I prefer to concentrate on one thing at a time.","1 :: 5;444;555;777;888;999","1= Not at all true; 2= A little true; 3= Somewhat true; 4= Pretty true; 5= Very true; 444= Do not wish to respond ;999= No Answer; 888= Skipped; 777= Condition Skipped; 555= Missing","pla06"
"wills_07","Integer","","Recommended","I like to work for long-range goals.","1 :: 5;444;555;777;888;999","1= Not at all true; 2= A little true; 3= Somewhat true; 4= Pretty true; 5= Very true; 444= Do not wish to respond ;999= No Answer; 888= Skipped; 777= Condition Skipped; 555= Missing",""
"wps_q1_y","Integer","","Recommended","I get as much information as I can.","1 :: 5;444;555;777;888;999","1= Never; 2= A little; 3= Sometimes; 4= Pretty often; 5= Usually; 444= Do not wish to respond ;999= No Answer; 888= Skipped; 777= Condition Skipped; 555= Missing","prs01,wills_08"
"wps_q2_y","Integer","","Recommended","I think hard about what steps to take.","1 :: 5;444;555;777;888;999","1= Never; 2= A little; 3= Sometimes; 4= Pretty often; 5= Usually; 444= Do not wish to respond ;999= No Answer; 888= Skipped; 777= Condition Skipped; 555= Missing","prs02,wills_09"
"wps_q3_y","Integer","","Recommended","I think about the choices before I do anything.","1 :: 5;444;555;777;888;999","1= Never; 2= A little; 3= Sometimes; 4= Pretty often; 5= Usually; 444= Do not wish to respond ;999= No Answer; 888= Skipped; 777= Condition Skipped; 555= Missing","prs03,wills_10"
"wps_q4_y","Integer","","Recommended","I think of different ways to take care of it.","1 :: 5;444;555;777;888;999","1= Never; 2= A little; 3= Sometimes; 4= Pretty often; 5= Usually; 444= Do not wish to respond ;999= No Answer; 888= Skipped; 777= Condition Skipped; 555= Missing","prs04,wills_11"
"wps_q5_y","Integer","","Recommended","I try different ways to solve the problem.","1 :: 5;444;555;777;888;999","1= Never; 2= A little; 3= Sometimes; 4= Pretty often; 5= Usually; 444= Do not wish to respond ;999= No Answer; 888= Skipped; 777= Condition Skipped; 555= Missing","wills_12"
"wills_13","Integer","","Recommended","I do something to try to solve the problem.","1 :: 5;444;555;777;888;999","1= Never; 2= A little; 3= Sometimes; 4= Pretty often; 5= Usually; 444= Do not wish to respond ;999= No Answer; 888= Skipped; 777= Condition Skipped; 555= Missing","prs05"
"wills_14","Integer","","Recommended","I make a plan of action and follow it.","1 :: 5;444;555;777;888;999","1= Never; 2= A little; 3= Sometimes; 4= Pretty often; 5= Usually; 444= Do not wish to respond ;999= No Answer; 888= Skipped; 777= Condition Skipped; 555= Missing","prs06"
"wills_15","Integer","","Recommended","I tell myself 'Stop and think before you do anything.'","1 :: 5;444;555;777;888;999","1= Never; 2= A little; 3= Sometimes; 4= Pretty often; 5= Usually; 444= Do not wish to respond ;999= No Answer; 888= Skipped; 777= Condition Skipped; 555= Missing",""
"wills_16","Integer","","Recommended","I often do things without stopping to think.","1 :: 5;444;555;777;888;999","1= Not at all true; 2= A little true; 3= Somewhat true; 4= Pretty true; 5= Very true; 444= Do not wish to respond ;999= No Answer; 888= Skipped; 777= Condition Skipped; 555= Missing",""
"wills_17","Integer","","Recommended","I am an impulsive person.","1 :: 5;444;555;777;888;999","1= Not at all true; 2= A little true; 3= Somewhat true; 4= Pretty true; 5= Very true; 444= Do not wish to respond ;999= No Answer; 888= Skipped; 777= Condition Skipped; 555= Missing",""
"wills_18","Integer","","Recommended","I often talk quickly, before thinking things out.","1 :: 5 ; 444; 555; 777; 888; 999","1 = Not at all true ; 2 = A little true ; 3 = Somewhat true ; 4 = Pretty true ; 5 = Very true ; 444 = Do not wish to respond ;999 = No Answer ; 888 = Skipped ; 777 = Condition Skipped ; 555 = Missing",""
"wills_19","Integer","","Recommended","I often get involved in things I later wish I could get out of.","1 :: 5 ; 444; 555; 777; 888; 999","1 = Not at all true ; 2 = A little true ; 3 = Somewhat true ; 4 = Pretty true ; 5 = Very true ; 444 = Do not wish to respond ;999 = No Answer ; 888 = Skipped ; 777 = Condition Skipped ; 555 = Missing",""
"wills_20","Integer","","Recommended","I need to use a lot of self-control to keep out of trouble.","1 :: 5 ; 444; 555; 777; 888; 999","1 = Not at all true ; 2 = A little true ; 3 = Somewhat true ; 4 = Pretty true ; 5 = Very true ; 444 = Do not wish to respond ;999 = No Answer ; 888 = Skipped ; 777 = Condition Skipped ; 555 = Missing",""
"wills_21","Integer","","Recommended","I often get into trouble because I do things without thinking.","1 :: 5 ; 444; 555; 777; 888; 999","1 = Not at all true ; 2 = A little true ; 3 = Somewhat true ; 4 = Pretty true ; 5 = Very true ; 444 = Do not wish to respond ;999 = No Answer ; 888 = Skipped ; 777 = Condition Skipped ; 555 = Missing",""
"wills_22","Integer","","Recommended","I get carried away by new and exciting ideas, but I don't think of the possible problems.","1 :: 5 ; 444; 555; 777; 888; 999","1 = Not at all true ; 2 = A little true ; 3 = Somewhat true ; 4 = Pretty true ; 5 = Very true ; 444 = Do not wish to respond ;999 = No Answer ; 888 = Skipped ; 777 = Condition Skipped ; 555 = Missing",""
"wills_23","Integer","","Recommended","When I really want something, I cannot keep my mind off it.","1 :: 5;444;555;777;888;999","1= Not at all true; 2= A little true; 3= Somewhat true; 4= Pretty true; 5= Very true; 444= Do not wish to respond ;999= No Answer; 888= Skipped; 777= Condition Skipped; 555= Missing",""
"wills_24","Integer","","Recommended","I don't understand why people save their money when they could enjoy it right now.","1 :: 5;444;555;777;888;999","1= Not at all true; 2= A little true; 3= Somewhat true; 4= Pretty true; 5= Very true; 444= Do not wish to respond ;999= No Answer; 888= Skipped; 777= Condition Skipped; 555= Missing",""
"wills_25","Integer","","Recommended","I have difficulty saving money to buy something several weeks later.","1 :: 5;444;555;777;888;999","1= Not at all true; 2= A little true; 3= Somewhat true; 4= Pretty true; 5= Very true; 444= Do not wish to respond ;999= No Answer; 888= Skipped; 777= Condition Skipped; 555= Missing",""
"wills_26","Integer","","Recommended","It's difficult for me when I have to wait my turn for a long time.","1 :: 5;444;555;777;888;999","1= Not at all true; 2= A little true; 3= Somewhat true; 4= Pretty true; 5= Very true; 444= Do not wish to respond ;999= No Answer; 888= Skipped; 777= Condition Skipped; 555= Missing",""
"wills_27","Integer","","Recommended","I tend to spend my money as soon as I get it.","1 :: 5;444;555;777;888;999","1= Not at all true; 2= A little true; 3= Somewhat true; 4= Pretty true; 5= Very true; 444= Do not wish to respond ;999= No Answer; 888= Skipped; 777= Condition Skipped; 555= Missing",""
"wills_28","Integer","","Recommended","I usually do what I want when I want to, I don't think about what it will mean to me later.","1 :: 5;444;555;777;888;999","1= Not at all true; 2= A little true; 3= Somewhat true; 4= Pretty true; 5= Very true; 444= Do not wish to respond ;999= No Answer; 888= Skipped; 777= Condition Skipped; 555= Missing",""
"wills_29","Integer","","Recommended","I don't like being in a boring situation.","1 :: 5;444;555;777;888;999","1= Not at all true; 2= A little true; 3= Somewhat true; 4= Pretty true; 5= Very true; 444= Do not wish to respond ;999= No Answer; 888= Skipped; 777= Condition Skipped; 555= Missing",""
"wills_30","Integer","","Recommended","I feel that having a good time now is more important than thinking about what might happen ""sometime.""","1 :: 5;444;555;777;888;999","1= Not at all true; 2= A little true; 3= Somewhat true; 4= Pretty true; 5= Very true; 444= Do not wish to respond ;999= No Answer; 888= Skipped; 777= Condition Skipped; 555= Missing",""
"wills_tend","Integer","","Recommended","Wills Behavioral Self Control - Tendency to Plan Ahead Total","","",""
"wills_del","Integer","","Recommended","Wills Behavioral Self Control - Delay Gratification Total","","",""
"wills_eng","Integer","","Recommended","Wills Behavioral Self Control - Engage in Adaptive Problem Solving Total","","",""
"wills_total","Integer","","Recommended","Wills Behavioral Self Control - Total","","",""
"ssr07","Integer","","Recommended","I have trouble making plans to help me reach my goals.","1 :: 5;444;555;777;888;999","1= Strongly disagree; 2= Disagree; 3= Uncertain or unsure;  444= Do not wish to respond ;999= No Answer; 888= Skipped; 777= Condition Skipped; 555= Missing",""
"ssr08","Integer","","Recommended","I set goals for myself and keep track of my progress.","1 :: 5;444;555;777;888;999","1= Strongly disagree; 2= Disagree; 3= Uncertain or unsure; 4= Agree; 5= Strongly agree; 444= Do not wish to respond ;999= No Answer; 888= Skipped; 777= Condition Skipped; 555= Missing",""
"ssr09","Integer","","Recommended","If I make a resolution to change something, I pay a lot of attention to how I'm doing.","1 :: 5;444;555;777;888;999","1= Strongly disagree; 2= Disagree; 3= Uncertain or unsure; 4= Agree; 5= Strongly agree; 444= Do not wish to respond ;999= No Answer; 888= Skipped; 777= Condition Skipped; 555= Missing",""
"ssr10","Integer","","Recommended","I know how I want to be.","1 :: 5;444;555;777;888;999","1= Strongly disagree; 2= Disagree; 3= Uncertain or unsure;  444= Do not wish to respond ;999= No Answer; 888= Skipped; 777= Condition Skipped; 555= Missing",""
"pla07","Integer","","Recommended","I like to be organized and have rules for things.","1 :: 5;444;555;777;888;999","1= Not at all true; 2= A little true; 3= Somewhat true; 4= Pretty true; 5= Very true; 444= Do not wish to respond ;999= No Answer; 888= Skipped; 777= Condition Skipped; 555= Missing",""
"ssr01","Integer","","Recommended","I usually keep track of my progress toward my goals.","1 :: 5;444;555;777;888;999","1= Strongly disagree; 2= Disagree; 3= Uncertain or unsure; 4= Agree; 5= Strongly agree; 444= Do not wish to respond ;999= No Answer; 888= Skipped; 777= Condition Skipped; 555= Missing",""
"ssr02","Integer","","Recommended","I am able to accomplish goals I set for myself.","1 :: 5;444;555;777;888;999","1= Strongly disagree; 2= Disagree; 3= Uncertain or unsure; 4= Agree; 5= Strongly agree; 444= Do not wish to respond ;999= No Answer; 888= Skipped; 777= Condition Skipped; 555= Missing",""
"ssr03","Integer","","Recommended","I have personal standards, and try to live up to them.","1 :: 5;444;555;777;888;999","1= Strongly disagree; 2= Disagree; 3= Uncertain or unsure; 4= Agree; 5= Strongly agree; 444= Do not wish to respond ;999= No Answer; 888= Skipped; 777= Condition Skipped; 555= Missing",""
"ssr04","Integer","","Recommended","As soon as I see a problem or challenge, I start looking for possible solutions.","1 :: 5;444;555;777;888;999","1= Strongly disagree; 2= Disagree; 3= Uncertain or unsure; 4= Agree; 5= Strongly agree; 444= Do not wish to respond ;999= No Answer; 888= Skipped; 777= Condition Skipped; 555= Missing",""
"ssr05","Integer","","Recommended","I have a hard time setting goals for myself.","1 :: 5;444;555;777;888;999","1= Strongly disagree; 2= Disagree; 3= Uncertain or unsure;  444= Do not wish to respond ;999= No Answer; 888= Skipped; 777= Condition Skipped; 555= Missing",""
"ssr06","Integer","","Recommended","When I'm trying to change something, I pay a lot of attention to how I'm doing.","1 :: 5;444;555;777;888;999","1= Strongly disagree; 2= Disagree; 3= Uncertain or unsure; 4= Agree; 5= Strongly agree; 444= Do not wish to respond ;999= No Answer; 888= Skipped; 777= Condition Skipped; 555= Missing",""
